5.1-trtexec/models/log/sample2/build/build.log
[05/25/2023-09:14:53] [V] [TRT] *************** Autotuning Reformat: Float(12288,4096,64,1) -> Float(12288,1,192,3) ***************
[05/25/2023-09:14:53] [V] [TRT] --------------- Timing Runner: Optimizer Reformat(input0 -> <out>) (Reformat)
[05/25/2023-09:14:53] [V] [TRT] Tactic: 0x00000000000003e8 Time: 0.00267708
[05/25/2023-09:14:53] [V] [TRT] Tactic: 0x00000000000003ea Time: 0.00398006
[05/25/2023-09:14:53] [V] [TRT] Tactic: 0x0000000000000000 Time: 0.00265769
[05/25/2023-09:14:53] [V] [TRT] Fastest Tactic: 0x0000000000000000 Time: 0.00265769
[05/25/2023-09:14:53] [V] [TRT] *************** Autotuning Reformat: Float(12288,4096,64,1) -> Float(4096,1:4,64,1) ***************
[05/25/2023-09:14:53] [V] [TRT] --------------- Timing Runner: Optimizer Reformat(input0 -> <out>) (Reformat)
[05/25/2023-09:14:53] [V] [TRT] Tactic: 0x00000000000003e8 Time: 0.00269037
[05/25/2023-09:14:53] [V] [TRT] Tactic: 0x00000000000003ea Time: 0.00392686
[05/25/2023-09:14:53] [V] [TRT] Tactic: 0x0000000000000000 Time: 0.00269037
[05/25/2023-09:14:53] [V] [TRT] Fastest Tactic: 0x0000000000000000 Time: 0.00269037
[05/25/2023-09:14:53] [V] [TRT] =============== Computing reformatting costs: 
[05/25/2023-09:14:53] [V] [TRT] *************** Autotuning Reformat: Float(61504,3844,62,1) -> Float(61504,1,992,16) ***************
[05/25/2023-09:14:53] [V] [TRT] --------------- Timing Runner: Optimizer Reformat(/act1/Relu_output_0 -> <out>) (Reformat)
[05/25/2023-09:14:53] [V] [TRT] Tactic: 0x00000000000003e8 Time: 0.00308503
[05/25/2023-09:14:53] [V] [TRT] Tactic: 0x00000000000003ea Time: 0.00423112
[05/25/2023-09:14:53] [V] [TRT] Tactic: 0x0000000000000000 Time: 0.00307531
[05/25/2023-09:14:53] [V] [TRT] Fastest Tactic: 0x0000000000000000 Time: 0.00307531
[05/25/2023-09:14:53] [V] [TRT] *************** Autotuning Reformat: Float(61504,3844,62,1) -> Float(15376,1:4,248,4) ***************
[05/25/2023-09:14:53] [V] [TRT] --------------- Timing Runner: Optimizer Reformat(/act1/Relu_output_0 -> <out>) (Reformat)
[05/25/2023-09:14:53] [V] [TRT] Tactic: 0x00000000000003e8 Time: 0.00314753
[05/25/2023-09:14:53] [V] [TRT] Tactic: 0x00000000000003ea Time: 0.00424457
[05/25/2023-09:14:53] [V] [TRT] Tactic: 0x0000000000000000 Time: 0.00315906
[05/25/2023-09:14:53] [V] [TRT] Fastest Tactic: 0x00000000000003e8 Time: 0.00314753
[05/25/2023-09:14:53] [V] [TRT] *************** Autotuning Reformat: Float(61504,1,992,16) -> Float(61504,3844,62,1) ***************
[05/25/2023-09:14:53] [V] [TRT] --------------- Timing Runner: Optimizer Reformat(/act1/Relu_output_0 -> <out>) (Reformat)
[05/25/2023-09:14:53] [V] [TRT] Tactic: 0x00000000000003e8 Time: 0.00385672
[05/25/2023-09:14:53] [V] [TRT] Tactic: 0x00000000000003ea Time: 0.00726971
[05/25/2023-09:14:53] [V] [TRT] Tactic: 0x0000000000000000 Time: 0.00385937
[05/25/2023-09:14:53] [V] [TRT] Fastest Tactic: 0x00000000000003e8 Time: 0.00385672
[05/25/2023-09:14:53] [V] [TRT] *************** Autotuning Reformat: Float(61504,1,992,16) -> Float(15376,1:4,248,4) ***************
[05/25/2023-09:14:53] [V] [TRT] --------------- Timing Runner: Optimizer Reformat(/act1/Relu_output_0 -> <out>) (Reformat)
[05/25/2023-09:14:53] [V] [TRT] Tactic: 0x00000000000003e8 Time: 0.00312656
[05/25/2023-09:14:53] [V] [TRT] Tactic: 0x00000000000003ea Time: 0.00704218
[05/25/2023-09:14:53] [V] [TRT] Tactic: 0x0000000000000000 Time: 0.00312924
[05/25/2023-09:14:53] [V] [TRT] Fastest Tactic: 0x00000000000003e8 Time: 0.00312656
[05/25/2023-09:14:53] [V] [TRT] *************** Autotuning Reformat: Float(15376,1:4,248,4) -> Float(61504,3844,62,1) ***************
[05/25/2023-09:14:53] [V] [TRT] --------------- Timing Runner: Optimizer Reformat(/act1/Relu_output_0 -> <out>) (Reformat)
[05/25/2023-09:14:53] [V] [TRT] Tactic: 0x00000000000003e8 Time: 0.00391067
[05/25/2023-09:14:53] [V] [TRT] Tactic: 0x00000000000003ea Time: 0.00725554
[05/25/2023-09:14:53] [V] [TRT] Tactic: 0x0000000000000000 Time: 0.00390956
[05/25/2023-09:14:53] [V] [TRT] Fastest Tactic: 0x0000000000000000 Time: 0.00390956
[05/25/2023-09:14:53] [V] [TRT] *************** Autotuning Reformat: Float(15376,1:4,248,4) -> Float(61504,1,992,16) ***************
[05/25/2023-09:14:53] [V] [TRT] --------------- Timing Runner: Optimizer Reformat(/act1/Relu_output_0 -> <out>) (Reformat)
[05/25/2023-09:14:53] [V] [TRT] Tactic: 0x00000000000003e8 Time: 0.00312845
[05/25/2023-09:14:53] [V] [TRT] Tactic: 0x00000000000003ea Time: 0.00706242
[05/25/2023-09:14:53] [V] [TRT] Tactic: 0x0000000000000000 Time: 0.0031352
[05/25/2023-09:14:53] [V] [TRT] Fastest Tactic: 0x00000000000003e8 Time: 0.00312845
[05/25/2023-09:14:53] [V] [TRT] =============== Computing reformatting costs: 
[05/25/2023-09:14:53] [V] [TRT] *************** Autotuning Reformat: Float(215296,3364,58,1) -> Float(215296,1,3712,64) ***************
[05/25/2023-09:14:53] [V] [TRT] --------------- Timing Runner: Optimizer Reformat(/act2/Relu_output_0 -> <out>) (Reformat)
[05/25/2023-09:14:53] [V] [TRT] Tactic: 0x00000000000003e8 Time: 0.00474116
[05/25/2023-09:14:53] [V] [TRT] Tactic: 0x00000000000003ea Time: 0.00652384
[05/25/2023-09:14:53] [V] [TRT] Tactic: 0x0000000000000000 Time: 0.00475016
[05/25/2023-09:14:53] [V] [TRT] Fastest Tactic: 0x00000000000003e8 Time: 0.00474116
[05/25/2023-09:14:53] [V] [TRT] *************** Autotuning Reformat: Float(215296,3364,58,1) -> Float(53824,1:4,928,16) ***************
[05/25/2023-09:14:53] [V] [TRT] --------------- Timing Runner: Optimizer Reformat(/act2/Relu_output_0 -> <out>) (Reformat)
[05/25/2023-09:14:53] [V] [TRT] Tactic: 0x00000000000003e8 Time: 0.0049682
[05/25/2023-09:14:53] [V] [TRT] Tactic: 0x00000000000003ea Time: 0.00652509
[05/25/2023-09:14:53] [V] [TRT] Tactic: 0x0000000000000000 Time: 0.00495354
[05/25/2023-09:14:53] [V] [TRT] Fastest Tactic: 0x0000000000000000 Time: 0.00495354
[05/25/2023-09:14:53] [V] [TRT] *************** Autotuning Reformat: Float(215296,3364,58,1) -> Float(6728,3364:32,58,1) ***************
[05/25/2023-09:14:53] [V] [TRT] --------------- Timing Runner: Optimizer Reformat(/act2/Relu_output_0 -> <out>) (Reformat)
[05/25/2023-09:14:53] [V] [TRT] Tactic: 0x00000000000003e8 Time: 0.0110716
[05/25/2023-09:14:53] [V] [TRT] Tactic: 0x00000000000003ea Time: 0.00661776
[05/25/2023-09:14:53] [V] [TRT] Tactic: 0x0000000000000000 Time: 0.0110752
[05/25/2023-09:14:53] [V] [TRT] Fastest Tactic: 0x00000000000003ea Time: 0.00661776
[05/25/2023-09:14:53] [V] [TRT] *************** Autotuning Reformat: Float(215296,1,3712,64) -> Float(215296,3364,58,1) ***************
[05/25/2023-09:14:53] [V] [TRT] --------------- Timing Runner: Optimizer Reformat(/act2/Relu_output_0 -> <out>) (Reformat)
[05/25/2023-09:14:53] [V] [TRT] Tactic: 0x00000000000003e8 Time: 0.00649725
[05/25/2023-09:14:53] [V] [TRT] Tactic: 0x00000000000003ea Time: 0.00788283
[05/25/2023-09:14:53] [V] [TRT] Tactic: 0x0000000000000000 Time: 0.00651719
[05/25/2023-09:14:53] [V] [TRT] Fastest Tactic: 0x00000000000003e8 Time: 0.00649725
[05/25/2023-09:14:53] [V] [TRT] *************** Autotuning Reformat: Float(215296,1,3712,64) -> Float(53824,1:4,928,16) ***************
[05/25/2023-09:14:53] [V] [TRT] --------------- Timing Runner: Optimizer Reformat(/act2/Relu_output_0 -> <out>) (Reformat)
[05/25/2023-09:14:53] [V] [TRT] Tactic: 0x00000000000003e8 Time: 0.00471801
[05/25/2023-09:14:53] [V] [TRT] Tactic: 0x00000000000003ea Time: 0.00621754
[05/25/2023-09:14:53] [V] [TRT] Tactic: 0x0000000000000000 Time: 0.00470901
[05/25/2023-09:14:53] [V] [TRT] Fastest Tactic: 0x0000000000000000 Time: 0.00470901
[05/25/2023-09:14:53] [V] [TRT] *************** Autotuning Reformat: Float(215296,1,3712,64) -> Float(6728,3364:32,58,1) ***************
[05/25/2023-09:14:53] [V] [TRT] --------------- Timing Runner: Optimizer Reformat(/act2/Relu_output_0 -> <out>) (Reformat)
[05/25/2023-09:14:53] [V] [TRT] Tactic: 0x00000000000003e8 Time: 0.013489
[05/25/2023-09:14:53] [V] [TRT] Tactic: 0x00000000000003ea Time: 0.00622132
[05/25/2023-09:14:53] [V] [TRT] Tactic: 0x0000000000000000 Time: 0.0134575
[05/25/2023-09:14:53] [V] [TRT] Fastest Tactic: 0x00000000000003ea Time: 0.00622132
[05/25/2023-09:14:53] [V] [TRT] *************** Autotuning Reformat: Float(53824,1:4,928,16) -> Float(215296,3364,58,1) ***************
[05/25/2023-09:14:53] [V] [TRT] --------------- Timing Runner: Optimizer Reformat(/act2/Relu_output_0 -> <out>) (Reformat)
[05/25/2023-09:14:53] [V] [TRT] Tactic: 0x00000000000003e8 Time: 0.00653777
[05/25/2023-09:14:53] [V] [TRT] Tactic: 0x00000000000003ea Time: 0.00787008
[05/25/2023-09:14:53] [V] [TRT] Tactic: 0x0000000000000000 Time: 0.00654566
[05/25/2023-09:14:53] [V] [TRT] Fastest Tactic: 0x00000000000003e8 Time: 0.00653777
[05/25/2023-09:14:53] [V] [TRT] *************** Autotuning Reformat: Float(53824,1:4,928,16) -> Float(215296,1,3712,64) ***************
[05/25/2023-09:14:53] [V] [TRT] --------------- Timing Runner: Optimizer Reformat(/act2/Relu_output_0 -> <out>) (Reformat)
[05/25/2023-09:14:53] [V] [TRT] Tactic: 0x00000000000003e8 Time: 0.00470725
[05/25/2023-09:14:53] [V] [TRT] Tactic: 0x00000000000003ea Time: 0.00621615
[05/25/2023-09:14:53] [V] [TRT] Tactic: 0x0000000000000000 Time: 0.00470916
[05/25/2023-09:14:53] [V] [TRT] Fastest Tactic: 0x00000000000003e8 Time: 0.00470725
[05/25/2023-09:14:53] [V] [TRT] *************** Autotuning Reformat: Float(53824,1:4,928,16) -> Float(6728,3364:32,58,1) ***************
[05/25/2023-09:14:53] [V] [TRT] --------------- Timing Runner: Optimizer Reformat(/act2/Relu_output_0 -> <out>) (Reformat)
[05/25/2023-09:14:53] [V] [TRT] Tactic: 0x00000000000003e8 Time: 0.0135152
[05/25/2023-09:14:53] [V] [TRT] Tactic: 0x00000000000003ea Time: 0.00621181
[05/25/2023-09:14:53] [V] [TRT] Tactic: 0x0000000000000000 Time: 0.0135252
[05/25/2023-09:14:53] [V] [TRT] Fastest Tactic: 0x00000000000003ea Time: 0.00621181
[05/25/2023-09:14:53] [V] [TRT] *************** Autotuning Reformat: Float(6728,3364:32,58,1) -> Float(215296,3364,58,1) ***************
[05/25/2023-09:14:53] [V] [TRT] --------------- Timing Runner: Optimizer Reformat(/act2/Relu_output_0 -> <out>) (Reformat)
[05/25/2023-09:14:53] [V] [TRT] Tactic: 0x00000000000003e8 Time: 0.00655148
[05/25/2023-09:14:53] [V] [TRT] Tactic: 0x00000000000003ea Time: 0.00788114
[05/25/2023-09:14:53] [V] [TRT] Tactic: 0x0000000000000000 Time: 0.00654234
[05/25/2023-09:14:53] [V] [TRT] Fastest Tactic: 0x0000000000000000 Time: 0.00654234
[05/25/2023-09:14:53] [V] [TRT] *************** Autotuning Reformat: Float(6728,3364:32,58,1) -> Float(215296,1,3712,64) ***************
[05/25/2023-09:14:53] [V] [TRT] --------------- Timing Runner: Optimizer Reformat(/act2/Relu_output_0 -> <out>) (Reformat)
[05/25/2023-09:14:53] [V] [TRT] Tactic: 0x00000000000003e8 Time: 0.00472553
[05/25/2023-09:14:53] [V] [TRT] Tactic: 0x00000000000003ea Time: 0.00621448
[05/25/2023-09:14:53] [V] [TRT] Tactic: 0x0000000000000000 Time: 0.00473217
[05/25/2023-09:14:53] [V] [TRT] Fastest Tactic: 0x00000000000003e8 Time: 0.00472553
[05/25/2023-09:14:53] [V] [TRT] *************** Autotuning Reformat: Float(6728,3364:32,58,1) -> Float(53824,1:4,928,16) ***************
[05/25/2023-09:14:53] [V] [TRT] --------------- Timing Runner: Optimizer Reformat(/act2/Relu_output_0 -> <out>) (Reformat)
[05/25/2023-09:14:53] [V] [TRT] Tactic: 0x00000000000003e8 Time: 0.00516979
[05/25/2023-09:14:53] [V] [TRT] Tactic: 0x00000000000003ea Time: 0.00621105
[05/25/2023-09:14:53] [V] [TRT] Tactic: 0x0000000000000000 Time: 0.00515314
[05/25/2023-09:14:53] [V] [TRT] Fastest Tactic: 0x0000000000000000 Time: 0.00515314
[05/25/2023-09:14:53] [V] [TRT] =============== Computing reformatting costs: 
[05/25/2023-09:14:53] [V] [TRT] *************** Autotuning Reformat: Float(1,3364,1) -> Float(215296,3364,1) ***************
[05/25/2023-09:14:53] [V] [TRT] --------------- Timing Runner: Optimizer Reformat(/Reshape_output_0 -> <out>) (Reformat)
[05/25/2023-09:14:53] [V] [TRT] Tactic: 0x00000000000003e8 Time: 0.00302238
[05/25/2023-09:14:53] [V] [TRT] Tactic: 0x00000000000003ea Time: 0.00547962
[05/25/2023-09:14:53] [V] [TRT] Tactic: 0x0000000000000000 Time: 0.00301876
[05/25/2023-09:14:53] [V] [TRT] Fastest Tactic: 0x0000000000000000 Time: 0.00301876
[05/25/2023-09:14:53] [V] [TRT] *************** Autotuning Reformat: Float(1:4,3364,1) -> Float(215296,3364,1) ***************
[05/25/2023-09:14:53] [V] [TRT] --------------- Timing Runner: Optimizer Reformat(/Reshape_output_0 -> <out>) (Reformat)
[05/25/2023-09:14:53] [V] [TRT] Tactic: 0x00000000000003e8 Time: 0.00479695
[05/25/2023-09:14:53] [V] [TRT] Tactic: 0x00000000000003ea Time: 0.0926537
[05/25/2023-09:14:53] [V] [TRT] Tactic: 0x0000000000000000 Time: 0.00478552
[05/25/2023-09:14:53] [V] [TRT] Fastest Tactic: 0x0000000000000000 Time: 0.00478552
[05/25/2023-09:14:53] [V] [TRT] *************** Autotuning Reformat: Float(215296:32,3364,1) -> Float(215296,3364,1) ***************
[05/25/2023-09:14:53] [V] [TRT] --------------- Timing Runner: Optimizer Reformat(/Reshape_output_0 -> <out>) (Reformat)
[05/25/2023-09:14:53] [V] [TRT] Tactic: 0x00000000000003e8 Time: 0.0145243
[05/25/2023-09:14:53] [V] [TRT] Tactic: 0x00000000000003ea Time: 0.0930377
[05/25/2023-09:14:53] [V] [TRT] Tactic: 0x0000000000000000 Time: 0.014624
[05/25/2023-09:14:53] [V] [TRT] Fastest Tactic: 0x00000000000003e8 Time: 0.0145243
[05/25/2023-09:14:53] [V] [TRT] =============== Computing reformatting costs: 
[05/25/2023-09:14:53] [V] [TRT] *************** Autotuning Reformat: Float(64,1,1) -> Float(1,1,1) ***************
[05/25/2023-09:14:53] [V] [TRT] --------------- Timing Runner: Optimizer Reformat(<in> -> /avgpool/GlobalAveragePool_output_0) (Reformat)
[05/25/2023-09:14:53] [V] [TRT] Tactic: 0x00000000000003e8 Time: 0.00274875
[05/25/2023-09:14:53] [V] [TRT] Tactic: 0x00000000000003ea Time: 0.00645366
[05/25/2023-09:14:53] [V] [TRT] Tactic: 0x0000000000000000 Time: 0.00297828
[05/25/2023-09:14:53] [V] [TRT] Fastest Tactic: 0x00000000000003e8 Time: 0.00274875
[05/25/2023-09:14:53] [V] [TRT] *************** Autotuning Reformat: Float(64,1,1) -> Float(1:4,1,1) ***************
[05/25/2023-09:14:53] [V] [TRT] --------------- Timing Runner: Optimizer Reformat(<in> -> /avgpool/GlobalAveragePool_output_0) (Reformat)
[05/25/2023-09:14:53] [V] [TRT] Tactic: 0x00000000000003e8 Time: 0.00298714
[05/25/2023-09:14:53] [V] [TRT] Tactic: 0x00000000000003ea Time: 0.00539191
[05/25/2023-09:14:53] [V] [TRT] Tactic: 0x0000000000000000 Time: 0.00303086
[05/25/2023-09:14:53] [V] [TRT] Fastest Tactic: 0x00000000000003e8 Time: 0.00298714
[05/25/2023-09:14:53] [V] [TRT] *************** Autotuning Reformat: Float(64,1,1) -> Float(64:32,1,1) ***************
[05/25/2023-09:14:53] [V] [TRT] --------------- Timing Runner: Optimizer Reformat(<in> -> /avgpool/GlobalAveragePool_output_0) (Reformat)
[05/25/2023-09:14:53] [V] [TRT] Tactic: 0x00000000000003e8 Time: 0.00299057
[05/25/2023-09:14:53] [V] [TRT] Tactic: 0x00000000000003ea Time: 0.0066614
[05/25/2023-09:14:53] [V] [TRT] Tactic: 0x0000000000000000 Time: 0.00292002
[05/25/2023-09:14:53] [V] [TRT] Fastest Tactic: 0x0000000000000000 Time: 0.00292002
[05/25/2023-09:14:53] [V] [TRT] =============== Computing reformatting costs: 
[05/25/2023-09:14:53] [V] [TRT] *************** Autotuning Reformat: Float(64,1,1) -> Float(1,1,1) ***************
[05/25/2023-09:14:53] [V] [TRT] --------------- Timing Runner: Optimizer Reformat(/avgpool/GlobalAveragePool_output_0 -> <out>) (Reformat)
[05/25/2023-09:14:53] [V] [TRT] Tactic: 0x00000000000003e8 Time: 0.00225507
[05/25/2023-09:14:53] [V] [TRT] Tactic: 0x00000000000003ea Time: 0.0057216
[05/25/2023-09:14:53] [V] [TRT] Tactic: 0x0000000000000000 Time: 0.0022196
[05/25/2023-09:14:53] [V] [TRT] Fastest Tactic: 0x0000000000000000 Time: 0.0022196
[05/25/2023-09:14:53] [V] [TRT] *************** Autotuning Reformat: Float(64,1,1) -> Float(1:4,1,1) ***************
[05/25/2023-09:14:53] [V] [TRT] --------------- Timing Runner: Optimizer Reformat(/avgpool/GlobalAveragePool_output_0 -> <out>) (Reformat)
[05/25/2023-09:14:53] [V] [TRT] Tactic: 0x00000000000003e8 Time: 0.00224871
[05/25/2023-09:14:53] [V] [TRT] Tactic: 0x00000000000003ea Time: 0.00440256
[05/25/2023-09:14:53] [V] [TRT] Tactic: 0x0000000000000000 Time: 0.00223507
[05/25/2023-09:14:53] [V] [TRT] Fastest Tactic: 0x0000000000000000 Time: 0.00223507
[05/25/2023-09:14:53] [V] [TRT] *************** Autotuning Reformat: Float(64,1,1) -> Float(64:32,1,1) ***************
[05/25/2023-09:14:53] [V] [TRT] --------------- Timing Runner: Optimizer Reformat(/avgpool/GlobalAveragePool_output_0 -> <out>) (Reformat)
[05/25/2023-09:14:53] [V] [TRT] Tactic: 0x00000000000003e8 Time: 0.00261328
[05/25/2023-09:14:53] [V] [TRT] Tactic: 0x00000000000003ea Time: 0.00593024
[05/25/2023-09:14:53] [V] [TRT] Tactic: 0x0000000000000000 Time: 0.00264087
[05/25/2023-09:14:53] [V] [TRT] Fastest Tactic: 0x00000000000003e8 Time: 0.00261328
[05/25/2023-09:14:53] [V] [TRT] *************** Autotuning Reformat: Float(1,1,1) -> Float(64,1,1) ***************
[05/25/2023-09:14:53] [V] [TRT] --------------- Timing Runner: Optimizer Reformat(/avgpool/GlobalAveragePool_output_0 -> <out>) (Reformat)
[05/25/2023-09:14:53] [V] [TRT] Tactic: 0x00000000000003e8 Time: 0.00210171
[05/25/2023-09:14:53] [V] [TRT] Tactic: 0x00000000000003ea Time: 0.00572745
[05/25/2023-09:14:53] [V] [TRT] Tactic: 0x0000000000000000 Time: 0.00215328
[05/25/2023-09:14:53] [V] [TRT] Fastest Tactic: 0x00000000000003e8 Time: 0.00210171
[05/25/2023-09:14:53] [V] [TRT] *************** Autotuning Reformat: Float(1,1,1) -> Float(1:4,1,1) ***************
[05/25/2023-09:14:53] [V] [TRT] --------------- Timing Runner: Optimizer Reformat(/avgpool/GlobalAveragePool_output_0 -> <out>) (Reformat)
[05/25/2023-09:14:53] [V] [TRT] Tactic: 0x00000000000003e8 Time: 0.00224636
[05/25/2023-09:14:53] [V] [TRT] Tactic: 0x00000000000003ea Time: 0.00595772
[05/25/2023-09:14:53] [V] [TRT] Tactic: 0x0000000000000000 Time: 0.00223044
[05/25/2023-09:14:53] [V] [TRT] Fastest Tactic: 0x0000000000000000 Time: 0.00223044
[05/25/2023-09:14:53] [V] [TRT] *************** Autotuning Reformat: Float(1,1,1) -> Float(64:32,1,1) ***************
[05/25/2023-09:14:53] [V] [TRT] --------------- Timing Runner: Optimizer Reformat(/avgpool/GlobalAveragePool_output_0 -> <out>) (Reformat)
[05/25/2023-09:14:53] [V] [TRT] Tactic: 0x00000000000003e8 Time: 0.00262001
[05/25/2023-09:14:53] [V] [TRT] Tactic: 0x00000000000003ea Time: 0.00592604
[05/25/2023-09:14:53] [V] [TRT] Tactic: 0x0000000000000000 Time: 0.00267877
[05/25/2023-09:14:53] [V] [TRT] Fastest Tactic: 0x00000000000003e8 Time: 0.00262001
[05/25/2023-09:14:53] [V] [TRT] *************** Autotuning Reformat: Float(1:4,1,1) -> Float(64,1,1) ***************
[05/25/2023-09:14:53] [V] [TRT] --------------- Timing Runner: Optimizer Reformat(/avgpool/GlobalAveragePool_output_0 -> <out>) (Reformat)
[05/25/2023-09:14:53] [V] [TRT] Tactic: 0x00000000000003e8 Time: 0.00223521
[05/25/2023-09:14:53] [V] [TRT] Tactic: 0x00000000000003ea Time: 0.00575671
[05/25/2023-09:14:53] [V] [TRT] Tactic: 0x0000000000000000 Time: 0.00221728
[05/25/2023-09:14:53] [V] [TRT] Fastest Tactic: 0x0000000000000000 Time: 0.00221728
[05/25/2023-09:14:53] [V] [TRT] *************** Autotuning Reformat: Float(1:4,1,1) -> Float(1,1,1) ***************
[05/25/2023-09:14:53] [V] [TRT] --------------- Timing Runner: Optimizer Reformat(/avgpool/GlobalAveragePool_output_0 -> <out>) (Reformat)
[05/25/2023-09:14:53] [V] [TRT] Tactic: 0x00000000000003e8 Time: 0.00222481
[05/25/2023-09:14:53] [V] [TRT] Tactic: 0x00000000000003ea Time: 0.00576366
[05/25/2023-09:14:53] [V] [TRT] Tactic: 0x0000000000000000 Time: 0.00222418
[05/25/2023-09:14:53] [V] [TRT] Fastest Tactic: 0x0000000000000000 Time: 0.00222418
[05/25/2023-09:14:53] [V] [TRT] *************** Autotuning Reformat: Float(1:4,1,1) -> Float(64:32,1,1) ***************
[05/25/2023-09:14:53] [V] [TRT] --------------- Timing Runner: Optimizer Reformat(/avgpool/GlobalAveragePool_output_0 -> <out>) (Reformat)
[05/25/2023-09:14:53] [V] [TRT] Tactic: 0x00000000000003e8 Time: 0.00261261
[05/25/2023-09:14:53] [V] [TRT] Tactic: 0x00000000000003ea Time: 0.00592384
[05/25/2023-09:14:53] [V] [TRT] Tactic: 0x0000000000000000 Time: 0.00261527
[05/25/2023-09:14:53] [V] [TRT] Fastest Tactic: 0x00000000000003e8 Time: 0.00261261
[05/25/2023-09:14:53] [V] [TRT] *************** Autotuning Reformat: Float(64:32,1,1) -> Float(64,1,1) ***************
[05/25/2023-09:14:53] [V] [TRT] --------------- Timing Runner: Optimizer Reformat(/avgpool/GlobalAveragePool_output_0 -> <out>) (Reformat)
[05/25/2023-09:14:53] [V] [TRT] Tactic: 0x00000000000003e8 Time: 0.002262
[05/25/2023-09:14:53] [V] [TRT] Tactic: 0x00000000000003ea Time: 0.00575196
[05/25/2023-09:14:53] [V] [TRT] Tactic: 0x0000000000000000 Time: 0.00226093
[05/25/2023-09:14:53] [V] [TRT] Fastest Tactic: 0x0000000000000000 Time: 0.00226093
[05/25/2023-09:14:53] [V] [TRT] *************** Autotuning Reformat: Float(64:32,1,1) -> Float(1,1,1) ***************
[05/25/2023-09:14:53] [V] [TRT] --------------- Timing Runner: Optimizer Reformat(/avgpool/GlobalAveragePool_output_0 -> <out>) (Reformat)
[05/25/2023-09:14:53] [V] [TRT] Tactic: 0x00000000000003e8 Time: 0.00225721
[05/25/2023-09:14:53] [V] [TRT] Tactic: 0x00000000000003ea Time: 0.00577024
[05/25/2023-09:14:53] [V] [TRT] Tactic: 0x0000000000000000 Time: 0.00225943
[05/25/2023-09:14:53] [V] [TRT] Fastest Tactic: 0x00000000000003e8 Time: 0.00225721
[05/25/2023-09:14:53] [V] [TRT] *************** Autotuning Reformat: Float(64:32,1,1) -> Float(1:4,1,1) ***************
[05/25/2023-09:14:53] [V] [TRT] --------------- Timing Runner: Optimizer Reformat(/avgpool/GlobalAveragePool_output_0 -> <out>) (Reformat)
[05/25/2023-09:14:53] [V] [TRT] Tactic: 0x00000000000003e8 Time: 0.00227519
[05/25/2023-09:14:53] [V] [TRT] Tactic: 0x00000000000003ea Time: 0.00595867
[05/25/2023-09:14:53] [V] [TRT] Tactic: 0x0000000000000000 Time: 0.00228434
[05/25/2023-09:14:53] [V] [TRT] Fastest Tactic: 0x00000000000003e8 Time: 0.00227519
[05/25/2023-09:14:53] [V] [TRT] =============== Computing reformatting costs: 
[05/25/2023-09:14:53] [V] [TRT] *************** Autotuning Reformat: Float(64,1,1,1) -> Float(64,1,64,64) ***************
[05/25/2023-09:14:53] [V] [TRT] --------------- Timing Runner: Optimizer Reformat(reshape_before_/head/Gemm_out_tensor -> <out>) (Reformat)
[05/25/2023-09:14:53] [V] [TRT] Tactic: 0x00000000000003e8 Time: 0.00216338
[05/25/2023-09:14:53] [V] [TRT] Tactic: 0x00000000000003ea Time: 0.00555094
[05/25/2023-09:14:53] [V] [TRT] Tactic: 0x0000000000000000 Time: 0.00220652
[05/25/2023-09:14:53] [V] [TRT] Fastest Tactic: 0x00000000000003e8 Time: 0.00216338
[05/25/2023-09:14:53] [V] [TRT] *************** Autotuning Reformat: Float(64,1,1,1) -> Float(16,1:4,16,16) ***************
[05/25/2023-09:14:53] [V] [TRT] --------------- Timing Runner: Optimizer Reformat(reshape_before_/head/Gemm_out_tensor -> <out>) (Reformat)
[05/25/2023-09:14:53] [V] [TRT] Tactic: 0x00000000000003e8 Time: 0.00221623
[05/25/2023-09:14:53] [V] [TRT] Tactic: 0x00000000000003ea Time: 0.00554479
[05/25/2023-09:14:53] [V] [TRT] Tactic: 0x0000000000000000 Time: 0.00222425
[05/25/2023-09:14:53] [V] [TRT] Fastest Tactic: 0x00000000000003e8 Time: 0.00221623
[05/25/2023-09:14:53] [V] [TRT] *************** Autotuning Reformat: Float(64,1,64,64) -> Float(64,1,1,1) ***************
[05/25/2023-09:14:53] [V] [TRT] --------------- Timing Runner: Optimizer Reformat(reshape_before_/head/Gemm_out_tensor -> <out>) (Reformat)
[05/25/2023-09:14:53] [V] [TRT] Tactic: 0x00000000000003e8 Time: 0.00219124
[05/25/2023-09:14:53] [V] [TRT] Tactic: 0x00000000000003ea Time: 0.00555569
[05/25/2023-09:14:53] [V] [TRT] Tactic: 0x0000000000000000 Time: 0.00219512
[05/25/2023-09:14:53] [V] [TRT] Fastest Tactic: 0x00000000000003e8 Time: 0.00219124
[05/25/2023-09:14:53] [V] [TRT] *************** Autotuning Reformat: Float(64,1,64,64) -> Float(16,1:4,16,16) ***************
[05/25/2023-09:14:53] [V] [TRT] --------------- Timing Runner: Optimizer Reformat(reshape_before_/head/Gemm_out_tensor -> <out>) (Reformat)
[05/25/2023-09:14:53] [V] [TRT] Tactic: 0x00000000000003e8 Time: 0.00220884
[05/25/2023-09:14:53] [V] [TRT] Tactic: 0x00000000000003ea Time: 0.00521926
[05/25/2023-09:14:53] [V] [TRT] Tactic: 0x0000000000000000 Time: 0.00221124
[05/25/2023-09:14:53] [V] [TRT] Fastest Tactic: 0x00000000000003e8 Time: 0.00220884
[05/25/2023-09:14:53] [V] [TRT] *************** Autotuning Reformat: Float(16,1:4,16,16) -> Float(64,1,1,1) ***************
[05/25/2023-09:14:53] [V] [TRT] --------------- Timing Runner: Optimizer Reformat(reshape_before_/head/Gemm_out_tensor -> <out>) (Reformat)
[05/25/2023-09:14:53] [V] [TRT] Tactic: 0x00000000000003e8 Time: 0.00220666
[05/25/2023-09:14:53] [V] [TRT] Tactic: 0x00000000000003ea Time: 0.00555851
[05/25/2023-09:14:53] [V] [TRT] Tactic: 0x0000000000000000 Time: 0.00222396
[05/25/2023-09:14:53] [V] [TRT] Fastest Tactic: 0x00000000000003e8 Time: 0.00220666
[05/25/2023-09:14:53] [V] [TRT] *************** Autotuning Reformat: Float(16,1:4,16,16) -> Float(64,1,64,64) ***************
[05/25/2023-09:14:53] [V] [TRT] --------------- Timing Runner: Optimizer Reformat(reshape_before_/head/Gemm_out_tensor -> <out>) (Reformat)
[05/25/2023-09:14:53] [V] [TRT] Tactic: 0x00000000000003e8 Time: 0.00221335
[05/25/2023-09:14:53] [V] [TRT] Tactic: 0x00000000000003ea Time: 0.00523331
[05/25/2023-09:14:53] [V] [TRT] Tactic: 0x0000000000000000 Time: 0.00222249
[05/25/2023-09:14:53] [V] [TRT] Fastest Tactic: 0x00000000000003e8 Time: 0.00221335
[05/25/2023-09:14:53] [V] [TRT] *************** Autotuning Reformat: Float(2,1:32,1,1) -> Float(64,1,1,1) ***************
[05/25/2023-09:14:53] [V] [TRT] --------------- Timing Runner: Optimizer Reformat(reshape_before_/head/Gemm_out_tensor -> <out>) (Reformat)
[05/25/2023-09:14:53] [V] [TRT] Tactic: 0x00000000000003e8 Time: 0.00222333
[05/25/2023-09:14:53] [V] [TRT] Tactic: 0x00000000000003ea Time: 0.00555745
[05/25/2023-09:14:53] [V] [TRT] Tactic: 0x0000000000000000 Time: 0.00220772
[05/25/2023-09:14:53] [V] [TRT] Fastest Tactic: 0x0000000000000000 Time: 0.00220772
[05/25/2023-09:14:53] [V] [TRT] *************** Autotuning Reformat: Float(2,1:32,1,1) -> Float(64,1,64,64) ***************
[05/25/2023-09:14:53] [V] [TRT] --------------- Timing Runner: Optimizer Reformat(reshape_before_/head/Gemm_out_tensor -> <out>) (Reformat)
[05/25/2023-09:14:53] [V] [TRT] Tactic: 0x00000000000003e8 Time: 0.00220547
[05/25/2023-09:14:53] [V] [TRT] Tactic: 0x00000000000003ea Time: 0.00554374
[05/25/2023-09:14:54] [V] [TRT] Tactic: 0x0000000000000000 Time: 0.00221707
[05/25/2023-09:14:54] [V] [TRT] Fastest Tactic: 0x00000000000003e8 Time: 0.00220547
[05/25/2023-09:14:54] [V] [TRT] *************** Autotuning Reformat: Float(2,1:32,1,1) -> Float(16,1:4,16,16) ***************
[05/25/2023-09:14:54] [V] [TRT] --------------- Timing Runner: Optimizer Reformat(reshape_before_/head/Gemm_out_tensor -> <out>) (Reformat)
[05/25/2023-09:14:54] [V] [TRT] Tactic: 0x00000000000003e8 Time: 0.00221588
[05/25/2023-09:14:54] [V] [TRT] Tactic: 0x00000000000003ea Time: 0.00555622
[05/25/2023-09:14:54] [V] [TRT] Tactic: 0x0000000000000000 Time: 0.00226057
[05/25/2023-09:14:54] [V] [TRT] Fastest Tactic: 0x00000000000003e8 Time: 0.00221588
[05/25/2023-09:14:54] [V] [TRT] =============== Computing reformatting costs: 
[05/25/2023-09:14:54] [V] [TRT] *************** Autotuning Reformat: Float(10,1,10,10) -> Float(10,1,1,1) ***************
[05/25/2023-09:14:54] [V] [TRT] --------------- Timing Runner: Optimizer Reformat(/head/Gemm_out_tensor -> <out>) (Reformat)
[05/25/2023-09:14:54] [V] [TRT] Tactic: 0x00000000000003e8 Time: 0.00218611
[05/25/2023-09:14:54] [V] [TRT] Tactic: 0x00000000000003ea Time: 0.00553741
[05/25/2023-09:14:54] [V] [TRT] Tactic: 0x0000000000000000 Time: 0.00220294
[05/25/2023-09:14:54] [V] [TRT] Fastest Tactic: 0x00000000000003e8 Time: 0.00218611
[05/25/2023-09:14:54] [V] [TRT] *************** Autotuning Reformat: Float(3,1:4,3,3) -> Float(10,1,1,1) ***************
[05/25/2023-09:14:54] [V] [TRT] --------------- Timing Runner: Optimizer Reformat(/head/Gemm_out_tensor -> <out>) (Reformat)
[05/25/2023-09:14:54] [V] [TRT] Tactic: 0x00000000000003e8 Time: 0.00220434
[05/25/2023-09:14:54] [V] [TRT] Tactic: 0x00000000000003ea Time: 0.0055527
[05/25/2023-09:14:54] [V] [TRT] Tactic: 0x0000000000000000 Time: 0.00221384
[05/25/2023-09:14:54] [V] [TRT] Fastest Tactic: 0x00000000000003e8 Time: 0.00220434
[05/25/2023-09:14:54] [V] [TRT] =============== Computing costs for 
[05/25/2023-09:14:54] [V] [TRT] *************** Autotuning format combination: Float(12288,4096,64,1) -> Float(61504,3844,62,1) ***************
[05/25/2023-09:14:54] [V] [TRT] --------------- Timing Runner: /conv1/Conv + /act1/Relu (CudaDepthwiseConvolution)
[05/25/2023-09:14:54] [V] [TRT] CudaDepthwiseConvolution has no valid tactics for this config, skipping
[05/25/2023-09:14:54] [V] [TRT] --------------- Timing Runner: /conv1/Conv + /act1/Relu (FusedConvActConvolution)
[05/25/2023-09:14:54] [V] [TRT] Tactic: 0x000000000007ffff Time: 0.00619143
[05/25/2023-09:14:54] [V] [TRT] Fastest Tactic: 0x000000000007ffff Time: 0.00619143
[05/25/2023-09:14:54] [V] [TRT] --------------- Timing Runner: /conv1/Conv + /act1/Relu (CudnnConvolution)
[05/25/2023-09:14:54] [V] [TRT] Tactic: 0x0000000000000000 Time: 0.0103432
[05/25/2023-09:14:54] [V] [TRT] Tactic: 0x0000000000000001 Time: 0.00918857
[05/25/2023-09:14:54] [V] [TRT] Tactic: 0x0000000000000002 Time: 0.0114553
[05/25/2023-09:14:54] [V] [TRT] Tactic: 0x0000000000000004 Time: 0.0298423
[05/25/2023-09:14:54] [V] [TRT] Tactic: 0x0000000000000005 Time: 0.0818468
[05/25/2023-09:14:54] [V] [TRT] Tactic: 0x0000000000000006 Time: 0.0124343
[05/25/2023-09:14:54] [V] [TRT] Tactic: 0x0000000000000038 Time: 0.00918857
[05/25/2023-09:14:54] [V] [TRT] Tactic: 0x0000000000000039 Time: 0.00918857
[05/25/2023-09:14:54] [V] [TRT] Tactic: 0x000000000000003a Time: 0.0114328
[05/25/2023-09:14:54] [V] [TRT] Tactic: 0x000000000000003c Time: 0.0286427
[05/25/2023-09:14:54] [V] [TRT] Tactic: 0x000000000000003d Time: 0.0820663
[05/25/2023-09:14:54] [V] [TRT] Tactic: 0x000000000000003e Time: 0.0124465
[05/25/2023-09:14:54] [V] [TRT] Tactic: 0x0000000000000070 Time: 0.00919771
[05/25/2023-09:14:54] [V] [TRT] Tactic: 0x0000000000000071 Time: 0.00917029
[05/25/2023-09:14:54] [V] [TRT] Tactic: 0x0000000000000072 Time: 0.0114215
[05/25/2023-09:14:54] [V] [TRT] Tactic: 0x0000000000000074 Time: 0.0286427
[05/25/2023-09:14:54] [V] [TRT] Tactic: 0x0000000000000075 Time: 0.08192
[05/25/2023-09:14:54] [V] [TRT] Tactic: 0x0000000000000076 Time: 0.0124465
[05/25/2023-09:14:54] [V] [TRT] Fastest Tactic: 0x0000000000000071 Time: 0.00917029
[05/25/2023-09:14:54] [V] [TRT] --------------- Timing Runner: /conv1/Conv + /act1/Relu (CaskGemmConvolution)
[05/25/2023-09:14:54] [V] [TRT] CaskGemmConvolution has no valid tactics for this config, skipping
[05/25/2023-09:14:54] [V] [TRT] --------------- Timing Runner: /conv1/Conv + /act1/Relu (CaskFlattenConvolution)
[05/25/2023-09:14:54] [V] [TRT] CaskFlattenConvolution has no valid tactics for this config, skipping
[05/25/2023-09:14:54] [V] [TRT] --------------- Timing Runner: /conv1/Conv + /act1/Relu (CaskConvolution)
[05/25/2023-09:14:54] [V] [TRT] /conv1/Conv + /act1/Relu Set Tactic Name: ampere_scudnn_128x32_relu_small_nn_v1 Tactic: 0xa8609adc4e0ceb90
[05/25/2023-09:14:54] [V] [TRT] Tactic: 0xa8609adc4e0ceb90 Time: 0.00861472
[05/25/2023-09:14:54] [V] [TRT] /conv1/Conv + /act1/Relu Set Tactic Name: ampere_scudnn_128x64_relu_xregs_large_nn_v1 Tactic: 0x5deb29b7a8e275f7
[05/25/2023-09:14:54] [V] [TRT] Tactic: 0x5deb29b7a8e275f7 Time: 0.00896857
[05/25/2023-09:14:54] [V] [TRT] /conv1/Conv + /act1/Relu Set Tactic Name: ampere_scudnn_128x64_relu_medium_nn_v1 Tactic: 0xf64396b97c889179
[05/25/2023-09:14:54] [V] [TRT] Tactic: 0xf64396b97c889179 Time: 0.00893886
[05/25/2023-09:14:54] [V] [TRT] /conv1/Conv + /act1/Relu Set Tactic Name: ampere_scudnn_128x128_relu_interior_nn_v1 Tactic: 0xa8ef60e712f8ad24
[05/25/2023-09:14:54] [V] [TRT] Tactic: 0xa8ef60e712f8ad24 Time: 0.0100894
[05/25/2023-09:14:54] [V] [TRT] /conv1/Conv + /act1/Relu Set Tactic Name: ampere_scudnn_128x64_relu_interior_nn_v1 Tactic: 0xc3cf6e1d1c6aff27
[05/25/2023-09:14:54] [V] [TRT] Tactic: 0xc3cf6e1d1c6aff27 Time: 0.00857896
[05/25/2023-09:14:54] [V] [TRT] /conv1/Conv + /act1/Relu Set Tactic Name: ampere_scudnn_128x128_relu_small_nn_v1 Tactic: 0x503619c69ae500ff
[05/25/2023-09:14:54] [V] [TRT] Tactic: 0x503619c69ae500ff Time: 0.0102975
[05/25/2023-09:14:54] [V] [TRT] /conv1/Conv + /act1/Relu Set Tactic Name: ampere_scudnn_128x128_relu_xregs_large_nn_v1 Tactic: 0x5403ad713f811a18
[05/25/2023-09:14:54] [V] [TRT] Tactic: 0x5403ad713f811a18 Time: 0.0104163
[05/25/2023-09:14:54] [V] [TRT] /conv1/Conv + /act1/Relu Set Tactic Name: ampere_scudnn_winograd_128x128_ldg1_ldg4_relu_tile148t_nt_v1 Tactic: 0x94119b4c514b211a
[05/25/2023-09:14:54] [V] [TRT] Tactic: 0x94119b4c514b211a Time: 0.00599486
[05/25/2023-09:14:54] [V] [TRT] /conv1/Conv + /act1/Relu Set Tactic Name: ampere_scudnn_128x32_relu_interior_nn_v1 Tactic: 0x9808072e706def96
[05/25/2023-09:14:54] [V] [TRT] Tactic: 0x9808072e706def96 Time: 0.00843832
[05/25/2023-09:14:54] [V] [TRT] /conv1/Conv + /act1/Relu Set Tactic Name: sm80_xmma_fprop_implicit_gemm_indexed_f32f32_f32f32_f32_nchwkcrs_nchw_tilesize32x32x8_stage3_warpsize1x2x1_g1_ffma_aligna4_alignc4 Tactic: 0xcb8a43f748d8a338
[05/25/2023-09:14:54] [V] [TRT] Tactic: 0xcb8a43f748d8a338 Time: 0.00641729
[05/25/2023-09:14:54] [V] [TRT] /conv1/Conv + /act1/Relu Set Tactic Name: sm80_xmma_fprop_implicit_gemm_indexed_f32f32_f32f32_f32_nchwkcrs_nchw_tilesize64x64x8_stage3_warpsize1x4x1_g1_ffma_aligna4_alignc4 Tactic: 0xd828f024626fa982
[05/25/2023-09:14:54] [V] [TRT] Tactic: 0xd828f024626fa982 Time: 0.00739566
[05/25/2023-09:14:54] [V] [TRT] /conv1/Conv + /act1/Relu Set Tactic Name: sm80_xmma_fprop_implicit_gemm_f32f32_f32f32_f32_nchwkcrs_nchw_tilesize64x64x8_stage3_warpsize1x4x1_g1_ffma_aligna4_alignc4 Tactic: 0xa31d27de74b895ff
[05/25/2023-09:14:54] [V] [TRT] Tactic: 0xa31d27de74b895ff Time: 0.00607086
[05/25/2023-09:14:54] [V] [TRT] /conv1/Conv + /act1/Relu Set Tactic Name: sm80_xmma_fprop_implicit_gemm_indexed_f32f32_f32f32_f32_nchwkcrs_nchw_tilesize128x16x8_stage3_warpsize4x1x1_g1_ffma_aligna4_alignc4 Tactic: 0x40a12e3938221818
[05/25/2023-09:14:54] [V] [TRT] Tactic: 0x40a12e3938221818 Time: 0.00846924
[05/25/2023-09:14:54] [V] [TRT] /conv1/Conv + /act1/Relu Set Tactic Name: sm80_xmma_fprop_implicit_gemm_f32f32_f32f32_f32_nchwkcrs_nchw_tilesize128x64x8_stage3_warpsize2x2x1_g1_ffma_aligna4_alignc4 Tactic: 0x12dbf7d94ee3696d
[05/25/2023-09:14:54] [V] [TRT] Tactic: 0x12dbf7d94ee3696d Time: 0.0102792
[05/25/2023-09:14:54] [V] [TRT] /conv1/Conv + /act1/Relu Set Tactic Name: sm80_xmma_fprop_implicit_gemm_indexed_f32f32_f32f32_f32_nchwkcrs_nchw_tilesize128x32x8_stage3_warpsize2x2x1_g1_ffma_aligna4_alignc4 Tactic: 0xa9366041633a5135
[05/25/2023-09:14:54] [V] [TRT] Tactic: 0xa9366041633a5135 Time: 0.008936
[05/25/2023-09:14:54] [V] [TRT] /conv1/Conv + /act1/Relu Set Tactic Name: sm80_xmma_fprop_implicit_gemm_f32f32_f32f32_f32_nchwkcrs_nchw_tilesize256x128x8_stage3_warpsize4x2x1_g1_ffma_aligna4_alignc4 Tactic: 0xbb8c3889c7eacd30
[05/25/2023-09:14:54] [V] [TRT] Tactic: 0xbb8c3889c7eacd30 Time: 0.0205074
[05/25/2023-09:14:54] [V] [TRT] /conv1/Conv + /act1/Relu Set Tactic Name: sm80_xmma_fprop_implicit_gemm_f32f32_f32f32_f32_nchwkcrs_nchw_tilesize32x32x8_stage3_warpsize1x2x1_g1_ffma_aligna4_alignc4 Tactic: 0xb0bf940d5e0f9f45
[05/25/2023-09:14:54] [V] [TRT] Tactic: 0xb0bf940d5e0f9f45 Time: 0.00537786
[05/25/2023-09:14:54] [V] [TRT] /conv1/Conv + /act1/Relu Set Tactic Name: sm80_xmma_fprop_implicit_gemm_f32f32_f32f32_f32_nchwkcrs_nchw_tilesize64x64x8_stage3_warpsize1x4x1_g1_ffma_t1r3s3_aligna4_alignc4 Tactic: 0x4727434768e46395
[05/25/2023-09:14:54] [V] [TRT] Tactic: 0x4727434768e46395 Time: 0.00591634
[05/25/2023-09:14:54] [V] [TRT] /conv1/Conv + /act1/Relu Set Tactic Name: sm80_xmma_fprop_implicit_gemm_f32f32_f32f32_f32_nchwkcrs_nchw_tilesize128x16x8_stage3_warpsize4x1x1_g1_ffma_aligna4_alignc4 Tactic: 0x9d9fdb5fd9945f64
[05/25/2023-09:14:54] [V] [TRT] Tactic: 0x9d9fdb5fd9945f64 Time: 0.00566576
[05/25/2023-09:14:54] [V] [TRT] /conv1/Conv + /act1/Relu Set Tactic Name: sm80_xmma_fprop_implicit_gemm_f32f32_f32f32_f32_nchwkcrs_nchw_tilesize64x128x8_stage3_warpsize1x4x1_g1_ffma_aligna4_alignc4 Tactic: 0x5aa723e0481da855
[05/25/2023-09:14:54] [V] [TRT] Tactic: 0x5aa723e0481da855 Time: 0.00956709
[05/25/2023-09:14:54] [V] [TRT] /conv1/Conv + /act1/Relu Set Tactic Name: sm80_xmma_fprop_implicit_gemm_f32f32_f32f32_f32_nchwkcrs_nchw_tilesize256x128x8_stage3_warpsize4x2x1_g1_ffma_t1r3s3_aligna4_alignc4 Tactic: 0x4efce38acc876f5c
[05/25/2023-09:14:54] [V] [TRT] Tactic: 0x4efce38acc876f5c Time: 0.019452
[05/25/2023-09:14:54] [V] [TRT] /conv1/Conv + /act1/Relu Set Tactic Name: sm80_xmma_fprop_implicit_gemm_f32f32_f32f32_f32_nchwkcrs_nchw_tilesize32x32x8_stage3_warpsize1x2x1_g1_ffma_t1r3s3_aligna4_alignc4 Tactic: 0x8ad32616b1424be4
[05/25/2023-09:14:54] [V] [TRT] Tactic: 0x8ad32616b1424be4 Time: 0.0051533
[05/25/2023-09:14:54] [V] [TRT] /conv1/Conv + /act1/Relu Set Tactic Name: sm80_xmma_fprop_implicit_gemm_f32f32_f32f32_f32_nchwkcrs_nchw_tilesize64x128x8_stage3_warpsize1x4x1_g1_ffma_t1r3s3_aligna4_alignc4 Tactic: 0x01cf8ce2da913006
[05/25/2023-09:14:54] [V] [TRT] Tactic: 0x01cf8ce2da913006 Time: 0.009216
[05/25/2023-09:14:54] [V] [TRT] /conv1/Conv + /act1/Relu Set Tactic Name: ampere_scudnn_128x64_relu_small_nn_v1 Tactic: 0x3f243c490d502deb
[05/25/2023-09:14:54] [V] [TRT] Tactic: 0x3f243c490d502deb Time: 0.00877203
[05/25/2023-09:14:54] [V] [TRT] /conv1/Conv + /act1/Relu Set Tactic Name: ampere_scudnn_128x128_relu_medium_nn_v1 Tactic: 0xf067e6205da31c2e
[05/25/2023-09:14:54] [V] [TRT] Tactic: 0xf067e6205da31c2e Time: 0.0103549
[05/25/2023-09:14:54] [V] [TRT] Fastest Tactic: 0x8ad32616b1424be4 Time: 0.0051533
[05/25/2023-09:14:54] [V] [TRT] >>>>>>>>>>>>>>> Chose Runner Type: CaskConvolution Tactic: 0x8ad32616b1424be4
[05/25/2023-09:14:54] [V] [TRT] *************** Autotuning format combination: Float(12288,1,192,3) -> Float(61504,1,992,16) ***************
[05/25/2023-09:14:54] [V] [TRT] --------------- Timing Runner: /conv1/Conv + /act1/Relu (CaskFlattenConvolution)
[05/25/2023-09:14:54] [V] [TRT] CaskFlattenConvolution has no valid tactics for this config, skipping
[05/25/2023-09:14:54] [V] [TRT] --------------- Timing Runner: /conv1/Conv + /act1/Relu (CaskConvolution)
[05/25/2023-09:14:54] [V] [TRT] /conv1/Conv + /act1/Relu Set Tactic Name: ampere_scudnn_128x128_relu_exp_interior_nhwc_tn_v1 Tactic: 0x17173deba0b64484
[05/25/2023-09:14:54] [V] [TRT] Tactic: 0x17173deba0b64484 Time: 0.0133216
[05/25/2023-09:14:54] [V] [TRT] /conv1/Conv + /act1/Relu Set Tactic Name: ampere_scudnn_128x128_relu_exp_medium_nhwc_tn_v1 Tactic: 0xd9031472c05adf51
[05/25/2023-09:14:54] [V] [TRT] Tactic: 0xd9031472c05adf51 Time: 0.0136121
[05/25/2023-09:14:54] [V] [TRT] /conv1/Conv + /act1/Relu Set Tactic Name: sm80_xmma_fprop_implicit_gemm_f32f32_f32f32_f32_nhwckrsc_nhwc_tilesize32x32x8_stage3_warpsize1x2x1_g1_ffma_aligna4_alignc4 Tactic: 0x7121ec1db3f80c67
[05/25/2023-09:14:54] [V] [TRT] Tactic: 0x7121ec1db3f80c67 Time: 0.00590574
[05/25/2023-09:14:54] [V] [TRT] /conv1/Conv + /act1/Relu Set Tactic Name: ampere_scudnn_128x128_relu_exp_small_nhwc_tn_v1 Tactic: 0x5030121339a48bf3
[05/25/2023-09:14:54] [V] [TRT] Tactic: 0x5030121339a48bf3 Time: 0.0135751
[05/25/2023-09:14:54] [V] [TRT] /conv1/Conv + /act1/Relu Set Tactic Name: sm80_xmma_fprop_implicit_gemm_f32f32_f32f32_f32_nhwckrsc_nhwc_tilesize32x32x8_stage3_warpsize1x2x1_g1_ffma_t1r3s3_aligna4_alignc4 Tactic: 0x5953bec563d26434
[05/25/2023-09:14:54] [V] [TRT] Tactic: 0x5953bec563d26434 Time: 0.00577006
[05/25/2023-09:14:54] [V] [TRT] /conv1/Conv + /act1/Relu Set Tactic Name: sm80_xmma_fprop_implicit_gemm_indexed_wo_smem_f32f32_tf32f32_f32_nhwckrsc_nhwc_tilesize128x32x64_stage1_warpsize4x1x1_g1_tensor16x8x8_aligna4_alignc8 Tactic: 0x1acd4f006848c62b
[05/25/2023-09:14:54] [V] [TRT] Tactic: 0x1acd4f006848c62b Time: 0.00580334
[05/25/2023-09:14:54] [V] [TRT] /conv1/Conv + /act1/Relu Set Tactic Name: sm80_xmma_fprop_implicit_gemm_indexed_f32f32_f32f32_f32_nhwckrsc_nhwc_tilesize64x64x8_stage3_warpsize1x4x1_g1_ffma_aligna4_alignc4 Tactic: 0x19b688348f983aa0
[05/25/2023-09:14:54] [V] [TRT] Tactic: 0x19b688348f983aa0 Time: 0.00847596
[05/25/2023-09:14:54] [V] [TRT] /conv1/Conv + /act1/Relu Set Tactic Name: sm80_xmma_fprop_implicit_gemm_indexed_f32f32_f32f32_f32_nhwckrsc_nhwc_tilesize32x32x8_stage3_warpsize1x2x1_g1_ffma_aligna4_alignc4 Tactic: 0x0a143be7a52f301a
[05/25/2023-09:14:54] [V] [TRT] Tactic: 0x0a143be7a52f301a Time: 0.00608914
[05/25/2023-09:14:54] [V] [TRT] /conv1/Conv + /act1/Relu Set Tactic Name: sm80_xmma_fprop_implicit_gemm_f32f32_f32f32_f32_nhwckrsc_nhwc_tilesize64x64x8_stage3_warpsize1x4x1_g1_ffma_aligna4_alignc4 Tactic: 0x62835fce994f06dd
[05/25/2023-09:14:54] [V] [TRT] Tactic: 0x62835fce994f06dd Time: 0.0083708
[05/25/2023-09:14:54] [V] [TRT] /conv1/Conv + /act1/Relu Set Tactic Name: sm80_xmma_fprop_implicit_gemm_f32f32_f32f32_f32_nhwckrsc_nhwc_tilesize64x64x8_stage3_warpsize1x4x1_g1_ffma_t1r3s3_aligna4_alignc4 Tactic: 0x94a7db94ba744c45
[05/25/2023-09:14:54] [V] [TRT] Tactic: 0x94a7db94ba744c45 Time: 0.0082494
[05/25/2023-09:14:54] [V] [TRT] /conv1/Conv + /act1/Relu Set Tactic Name: sm80_xmma_fprop_implicit_gemm_f32f32_f32f32_f32_nhwckrsc_nhwc_tilesize128x16x8_stage3_warpsize4x1x1_g1_ffma_aligna4_alignc4 Tactic: 0x92ed3100c35fc43e
[05/25/2023-09:14:54] [V] [TRT] Tactic: 0x92ed3100c35fc43e Time: 0.00642922
[05/25/2023-09:14:54] [V] [TRT] /conv1/Conv + /act1/Relu Set Tactic Name: sm80_xmma_fprop_implicit_gemm_f32f32_f32f32_f32_nhwckrsc_nhwc_tilesize128x16x8_stage3_warpsize4x1x1_g1_ffma_t1r3s3_aligna4_alignc4 Tactic: 0x32059de4888dfdda
[05/25/2023-09:14:54] [V] [TRT] Tactic: 0x32059de4888dfdda Time: 0.00633481
[05/25/2023-09:14:54] [V] [TRT] /conv1/Conv + /act1/Relu Set Tactic Name: sm80_xmma_fprop_implicit_gemm_indexed_wo_smem_f32f32_tf32f32_f32_nhwckrsc_nhwc_tilesize128x16x32_stage1_warpsize4x1x1_g1_tensor16x8x8_aligna4 Tactic: 0xb3e5ce9d1b1da232
[05/25/2023-09:14:54] [V] [TRT] Tactic: 0xb3e5ce9d1b1da232 Time: 0.00414916
[05/25/2023-09:14:54] [V] [TRT] /conv1/Conv + /act1/Relu Set Tactic Name: sm80_xmma_fprop_implicit_gemm_indexed_f32f32_f32f32_f32_nhwckrsc_nhwc_tilesize128x16x8_stage3_warpsize4x1x1_g1_ffma_aligna4_alignc4 Tactic: 0x4fd3c46622e98342
[05/25/2023-09:14:54] [V] [TRT] Tactic: 0x4fd3c46622e98342 Time: 0.00707048
[05/25/2023-09:14:54] [V] [TRT] /conv1/Conv + /act1/Relu Set Tactic Name: sm80_xmma_fprop_implicit_gemm_f32f32_f32f32_f32_nhwckrsc_nhwc_tilesize128x64x8_stage3_warpsize2x2x1_g1_ffma_aligna4_alignc4 Tactic: 0x1da91d865428f237
[05/25/2023-09:14:54] [V] [TRT] Tactic: 0x1da91d865428f237 Time: 0.0111177
[05/25/2023-09:14:54] [V] [TRT] /conv1/Conv + /act1/Relu Set Tactic Name: sm80_xmma_fprop_implicit_gemm_indexed_f32f32_f32f32_f32_nhwckrsc_nhwc_tilesize128x32x8_stage3_warpsize2x2x1_g1_ffma_aligna4_alignc4 Tactic: 0xa6448a1e79f1ca6f
[05/25/2023-09:14:54] [V] [TRT] Tactic: 0xa6448a1e79f1ca6f Time: 0.00793023
[05/25/2023-09:14:54] [V] [TRT] /conv1/Conv + /act1/Relu Set Tactic Name: sm80_xmma_fprop_implicit_gemm_f32f32_f32f32_f32_nhwckrsc_nhwc_tilesize64x256x8_stage3_warpsize1x4x1_g1_ffma_t1r3s3_aligna4_alignc4 Tactic: 0x3f0c846d6379bc98
[05/25/2023-09:14:54] [V] [TRT] Tactic: 0x3f0c846d6379bc98 Time: 0.0271116
[05/25/2023-09:14:54] [V] [TRT] /conv1/Conv + /act1/Relu Set Tactic Name: sm80_xmma_fprop_implicit_gemm_f32f32_f32f32_f32_nhwckrsc_nhwc_tilesize128x64x8_stage3_warpsize2x2x1_g1_ffma_t1r3s3_aligna4_alignc4 Tactic: 0xf48db81f02eca9ee
[05/25/2023-09:14:54] [V] [TRT] Tactic: 0xf48db81f02eca9ee Time: 0.0101437
[05/25/2023-09:14:54] [V] [TRT] /conv1/Conv + /act1/Relu Set Tactic Name: sm80_xmma_fprop_implicit_gemm_indexed_wo_smem_f32f32_tf32f32_f32_nhwckrsc_nhwc_tilesize128x16x32_stage1_warpsize4x1x1_g1_tensor16x8x8_aligna4_alignc4 Tactic: 0xcf8ea142095f02d2
[05/25/2023-09:14:54] [V] [TRT] Tactic: 0xcf8ea142095f02d2 Time: 0.00422037
[05/25/2023-09:14:54] [V] [TRT] /conv1/Conv + /act1/Relu Set Tactic Name: sm80_xmma_fprop_implicit_gemm_indexed_wo_smem_f32f32_tf32f32_f32_nhwckrsc_nhwc_tilesize128x16x64_stage1_warpsize4x1x1_g1_tensor16x8x8_aligna4_alignc8 Tactic: 0x22cadc265a3b2e32
[05/25/2023-09:14:54] [V] [TRT] Tactic: 0x22cadc265a3b2e32 Time: 0.00536906
[05/25/2023-09:14:54] [V] [TRT] /conv1/Conv + /act1/Relu Set Tactic Name: ampere_scudnn_128x128_relu_exp_large_nhwc_tn_v1 Tactic: 0xca7eeb8d9143d738
[05/25/2023-09:14:54] [V] [TRT] Tactic: 0xca7eeb8d9143d738 Time: 0.013802
[05/25/2023-09:14:54] [V] [TRT] /conv1/Conv + /act1/Relu Set Tactic Name: sm80_xmma_fprop_implicit_gemm_f32f32_f32f32_f32_nhwckrsc_nhwc_tilesize64x128x8_stage3_warpsize1x4x1_g1_ffma_t1r3s3_aligna4_alignc4 Tactic: 0xd15dd11d64344e83
[05/25/2023-09:14:54] [V] [TRT] Tactic: 0xd15dd11d64344e83 Time: 0.0100766
[05/25/2023-09:14:54] [V] [TRT] /conv1/Conv + /act1/Relu Set Tactic Name: sm80_xmma_fprop_implicit_gemm_indexed_wo_smem_f32f32_tf32f32_f32_nhwckrsc_nhwc_tilesize128x32x16_stage1_warpsize4x1x1_g1_tensor16x8x8_aligna4_alignc4 Tactic: 0xf231cca3335919a4
[05/25/2023-09:14:54] [V] [TRT] Tactic: 0xf231cca3335919a4 Time: 0.00449129
[05/25/2023-09:14:54] [V] [TRT] /conv1/Conv + /act1/Relu Set Tactic Name: sm80_xmma_fprop_implicit_gemm_indexed_wo_smem_f32f32_tf32f32_f32_nhwckrsc_nhwc_tilesize128x32x16_stage1_warpsize4x1x1_g1_tensor16x8x8_aligna4_alignc8 Tactic: 0x7e40882e33c8fbf1
[05/25/2023-09:14:54] [V] [TRT] Tactic: 0x7e40882e33c8fbf1 Time: 0.00450271
[05/25/2023-09:14:54] [V] [TRT] /conv1/Conv + /act1/Relu Set Tactic Name: sm80_xmma_fprop_implicit_gemm_indexed_wo_smem_f32f32_tf32f32_f32_nhwckrsc_nhwc_tilesize128x32x16_stage1_warpsize4x1x1_g1_tensor16x8x8_aligna4 Tactic: 0x570667f2a28165a0
[05/25/2023-09:14:54] [V] [TRT] Tactic: 0x570667f2a28165a0 Time: 0.00444426
[05/25/2023-09:14:54] [V] [TRT] /conv1/Conv + /act1/Relu Set Tactic Name: sm80_xmma_fprop_implicit_gemm_indexed_wo_smem_f32f32_tf32f32_f32_nhwckrsc_nhwc_tilesize128x16x32_stage1_warpsize4x1x1_g1_tensor16x8x8_aligna4_alignc8 Tactic: 0x43ffe5cf09cee087
[05/25/2023-09:14:54] [V] [TRT] Tactic: 0x43ffe5cf09cee087 Time: 0.00416418
[05/25/2023-09:14:54] [V] [TRT] /conv1/Conv + /act1/Relu Set Tactic Name: sm80_xmma_fprop_implicit_gemm_f32f32_f32f32_f32_nhwckrsc_nhwc_tilesize256x64x8_stage3_warpsize2x2x1_g1_ffma_aligna4_alignc4 Tactic: 0x8014228ec08b4d49
[05/25/2023-09:14:54] [V] [TRT] Tactic: 0x8014228ec08b4d49 Time: 0.0198217
[05/25/2023-09:14:54] [V] [TRT] Fastest Tactic: 0xb3e5ce9d1b1da232 Time: 0.00414916
[05/25/2023-09:14:54] [V] [TRT] >>>>>>>>>>>>>>> Chose Runner Type: CaskConvolution Tactic: 0xb3e5ce9d1b1da232
[05/25/2023-09:14:54] [V] [TRT] *************** Autotuning format combination: Float(4096,1:4,64,1) -> Float(15376,1:4,248,4) ***************
[05/25/2023-09:14:54] [V] [TRT] --------------- Timing Runner: /conv1/Conv + /act1/Relu (CudaDepthwiseConvolution)
[05/25/2023-09:14:54] [V] [TRT] CudaDepthwiseConvolution has no valid tactics for this config, skipping
[05/25/2023-09:14:54] [V] [TRT] --------------- Timing Runner: /conv1/Conv + /act1/Relu (CaskGemmConvolution)
[05/25/2023-09:14:54] [V] [TRT] CaskGemmConvolution has no valid tactics for this config, skipping
[05/25/2023-09:14:54] [V] [TRT] --------------- Timing Runner: /conv1/Conv + /act1/Relu (CaskFlattenConvolution)
[05/25/2023-09:14:54] [V] [TRT] CaskFlattenConvolution has no valid tactics for this config, skipping
[05/25/2023-09:14:54] [V] [TRT] --------------- Timing Runner: /conv1/Conv + /act1/Relu (CaskConvolution)
[05/25/2023-09:14:54] [V] [TRT] /conv1/Conv + /act1/Relu Set Tactic Name: ampere_scudnn_128x128_relu_exp_interior_nhwc_tn_v1 Tactic: 0x17173deba0b64484
[05/25/2023-09:14:54] [V] [TRT] Tactic: 0x17173deba0b64484 Time: 0.0133648
[05/25/2023-09:14:54] [V] [TRT] /conv1/Conv + /act1/Relu Set Tactic Name: ampere_scudnn_128x32_sliced1x4_ldg4_relu_exp_small_nhwc_tn_v1 Tactic: 0x3e2b881168d9689d
[05/25/2023-09:14:54] [V] [TRT] Tactic: 0x3e2b881168d9689d Time: 0.0148887
[05/25/2023-09:14:54] [V] [TRT] /conv1/Conv + /act1/Relu Set Tactic Name: ampere_scudnn_128x128_ldg4_relu_exp_small_nhwc_tn_v1 Tactic: 0xf90060ce8193b811
[05/25/2023-09:14:54] [V] [TRT] Tactic: 0xf90060ce8193b811 Time: 0.0133253
[05/25/2023-09:14:54] [V] [TRT] /conv1/Conv + /act1/Relu Set Tactic Name: ampere_scudnn_128x128_relu_exp_medium_nhwc_tn_v1 Tactic: 0xd9031472c05adf51
[05/25/2023-09:14:54] [V] [TRT] Tactic: 0xd9031472c05adf51 Time: 0.0136233
[05/25/2023-09:14:54] [V] [TRT] /conv1/Conv + /act1/Relu Set Tactic Name: ampere_scudnn_128x128_ldg4_relu_exp_interior_nhwc_tn_v1 Tactic: 0xe47307053a42b3e4
[05/25/2023-09:14:54] [V] [TRT] Tactic: 0xe47307053a42b3e4 Time: 0.013201
[05/25/2023-09:14:54] [V] [TRT] /conv1/Conv + /act1/Relu Set Tactic Name: ampere_scudnn_128x64_sliced1x2_ldg4_relu_exp_large_nhwc_tn_v1 Tactic: 0xbdfdef6b84f7ccc9
[05/25/2023-09:14:54] [V] [TRT] Tactic: 0xbdfdef6b84f7ccc9 Time: 0.0144087
[05/25/2023-09:14:54] [V] [TRT] /conv1/Conv + /act1/Relu Set Tactic Name: ampere_scudnn_128x64_sliced1x2_ldg4_relu_exp_medium_nhwc_tn_v1 Tactic: 0x412c44dfeaf9161d
[05/25/2023-09:14:54] [V] [TRT] Tactic: 0x412c44dfeaf9161d Time: 0.0143653
[05/25/2023-09:14:54] [V] [TRT] /conv1/Conv + /act1/Relu Set Tactic Name: ampere_scudnn_128x64_sliced1x2_ldg4_relu_exp_small_nhwc_tn_v1 Tactic: 0x27b316f52c109002
[05/25/2023-09:14:54] [V] [TRT] Tactic: 0x27b316f52c109002 Time: 0.0148352
[05/25/2023-09:14:54] [V] [TRT] /conv1/Conv + /act1/Relu Set Tactic Name: ampere_scudnn_128x64_sliced1x2_ldg4_relu_exp_interior_nhwc_tn_v1 Tactic: 0xae0c89d047932ba3
[05/25/2023-09:14:54] [V] [TRT] Tactic: 0xae0c89d047932ba3 Time: 0.0133336
[05/25/2023-09:14:54] [V] [TRT] /conv1/Conv + /act1/Relu Set Tactic Name: ampere_scudnn_128x128_ldg4_relu_exp_medium_nhwc_tn_v1 Tactic: 0x7bc32c782b800c48
[05/25/2023-09:14:54] [V] [TRT] Tactic: 0x7bc32c782b800c48 Time: 0.0133482
[05/25/2023-09:14:54] [V] [TRT] /conv1/Conv + /act1/Relu Set Tactic Name: sm80_xmma_fprop_implicit_gemm_indexed_wo_smem_f32f32_tf32f32_f32_nhwckrsc_nhwc_tilesize128x32x16_stage1_warpsize4x1x1_g1_tensor16x8x8_aligna8_alignc4 Tactic: 0xf78ec258f27b3e23
[05/25/2023-09:14:54] [V] [TRT] Tactic: 0xf78ec258f27b3e23 Time: 0.00483474
[05/25/2023-09:14:54] [V] [TRT] /conv1/Conv + /act1/Relu Set Tactic Name: sm80_xmma_fprop_implicit_gemm_f32f32_f32f32_f32_nhwckrsc_nhwc_tilesize32x32x8_stage3_warpsize1x2x1_g1_ffma_aligna4_alignc4 Tactic: 0x7121ec1db3f80c67
[05/25/2023-09:14:54] [V] [TRT] Tactic: 0x7121ec1db3f80c67 Time: 0.0058315
[05/25/2023-09:14:54] [V] [TRT] /conv1/Conv + /act1/Relu Set Tactic Name: ampere_scudnn_128x128_relu_exp_small_nhwc_tn_v1 Tactic: 0x5030121339a48bf3
[05/25/2023-09:14:54] [V] [TRT] Tactic: 0x5030121339a48bf3 Time: 0.0135389
[05/25/2023-09:14:54] [V] [TRT] /conv1/Conv + /act1/Relu Set Tactic Name: sm80_xmma_fprop_implicit_gemm_f32f32_f32f32_f32_nhwckrsc_nhwc_tilesize32x32x8_stage3_warpsize1x2x1_g1_ffma_t1r3s3_aligna4_alignc4 Tactic: 0x5953bec563d26434
[05/25/2023-09:14:54] [V] [TRT] Tactic: 0x5953bec563d26434 Time: 0.00569002
[05/25/2023-09:14:54] [V] [TRT] /conv1/Conv + /act1/Relu Set Tactic Name: sm80_xmma_fprop_implicit_gemm_indexed_wo_smem_f32f32_tf32f32_f32_nhwckrsc_nhwc_tilesize128x32x64_stage1_warpsize4x1x1_g1_tensor16x8x8_aligna4_alignc8 Tactic: 0x1acd4f006848c62b
[05/25/2023-09:14:54] [V] [TRT] Tactic: 0x1acd4f006848c62b Time: 0.00576311
[05/25/2023-09:14:54] [V] [TRT] /conv1/Conv + /act1/Relu Set Tactic Name: sm80_xmma_fprop_implicit_gemm_indexed_f32f32_f32f32_f32_nhwckrsc_nhwc_tilesize64x64x8_stage3_warpsize1x4x1_g1_ffma_aligna4_alignc4 Tactic: 0x19b688348f983aa0
[05/25/2023-09:14:54] [V] [TRT] Tactic: 0x19b688348f983aa0 Time: 0.00750971
[05/25/2023-09:14:54] [V] [TRT] /conv1/Conv + /act1/Relu Set Tactic Name: sm80_xmma_fprop_implicit_gemm_indexed_f32f32_f32f32_f32_nhwckrsc_nhwc_tilesize32x32x8_stage3_warpsize1x2x1_g1_ffma_aligna4_alignc4 Tactic: 0x0a143be7a52f301a
[05/25/2023-09:14:54] [V] [TRT] Tactic: 0x0a143be7a52f301a Time: 0.00611733
[05/25/2023-09:14:54] [V] [TRT] /conv1/Conv + /act1/Relu Set Tactic Name: sm80_xmma_fprop_implicit_gemm_f32f32_f32f32_f32_nhwckrsc_nhwc_tilesize64x64x8_stage3_warpsize1x4x1_g1_ffma_aligna4_alignc4 Tactic: 0x62835fce994f06dd
[05/25/2023-09:14:54] [V] [TRT] Tactic: 0x62835fce994f06dd Time: 0.00757534
[05/25/2023-09:14:54] [V] [TRT] /conv1/Conv + /act1/Relu Set Tactic Name: sm80_xmma_fprop_implicit_gemm_f32f32_f32f32_f32_nhwckrsc_nhwc_tilesize64x64x8_stage3_warpsize1x4x1_g1_ffma_t1r3s3_aligna4_alignc4 Tactic: 0x94a7db94ba744c45
[05/25/2023-09:14:54] [V] [TRT] Tactic: 0x94a7db94ba744c45 Time: 0.00752
[05/25/2023-09:14:54] [V] [TRT] /conv1/Conv + /act1/Relu Set Tactic Name: ampere_scudnn_128x32_sliced1x4_ldg4_relu_exp_interior_nhwc_tn_v1 Tactic: 0xc7feb33970feefa7
[05/25/2023-09:14:54] [V] [TRT] Tactic: 0xc7feb33970feefa7 Time: 0.0146263
[05/25/2023-09:14:54] [V] [TRT] /conv1/Conv + /act1/Relu Set Tactic Name: sm80_xmma_fprop_implicit_gemm_indexed_wo_smem_f32f32_tf32f32_f32_nhwckrsc_nhwc_tilesize128x16x64_stage1_warpsize4x1x1_g1_tensor16x8x8_alignc4 Tactic: 0xcc46f0f5cee60677
[05/25/2023-09:14:54] [V] [TRT] Tactic: 0xcc46f0f5cee60677 Time: 0.00394564
[05/25/2023-09:14:54] [V] [TRT] /conv1/Conv + /act1/Relu Set Tactic Name: sm80_xmma_fprop_implicit_gemm_f32f32_f32f32_f32_nhwckrsc_nhwc_tilesize128x16x8_stage3_warpsize4x1x1_g1_ffma_aligna4_alignc4 Tactic: 0x92ed3100c35fc43e
[05/25/2023-09:14:54] [V] [TRT] Tactic: 0x92ed3100c35fc43e Time: 0.00644989
[05/25/2023-09:14:54] [V] [TRT] /conv1/Conv + /act1/Relu Set Tactic Name: sm80_xmma_fprop_implicit_gemm_f32f32_f32f32_f32_nhwckrsc_nhwc_tilesize128x16x8_stage3_warpsize4x1x1_g1_ffma_t1r3s3_aligna4_alignc4 Tactic: 0x32059de4888dfdda
[05/25/2023-09:14:54] [V] [TRT] Tactic: 0x32059de4888dfdda Time: 0.00632209
[05/25/2023-09:14:54] [V] [TRT] /conv1/Conv + /act1/Relu Set Tactic Name: sm80_xmma_fprop_implicit_gemm_indexed_wo_smem_f32f32_tf32f32_f32_nhwckrsc_nhwc_tilesize128x32x64_stage1_warpsize4x1x1_g1_tensor16x8x8_aligna8_alignc4 Tactic: 0x93030576a9fb03f9
[05/25/2023-09:14:54] [V] [TRT] Tactic: 0x93030576a9fb03f9 Time: 0.00492674
[05/25/2023-09:14:54] [V] [TRT] /conv1/Conv + /act1/Relu Set Tactic Name: sm80_xmma_fprop_implicit_gemm_indexed_wo_smem_f32f32_tf32f32_f32_nhwckrsc_nhwc_tilesize128x32x16_stage1_warpsize4x1x1_g1_tensor16x8x8_aligna8 Tactic: 0xdb77237fa21087f5
[05/25/2023-09:14:54] [V] [TRT] Tactic: 0xdb77237fa21087f5 Time: 0.00485394
[05/25/2023-09:14:54] [V] [TRT] /conv1/Conv + /act1/Relu Set Tactic Name: sm80_xmma_fprop_implicit_gemm_indexed_wo_smem_f32f32_tf32f32_f32_nhwckrsc_nhwc_tilesize128x16x32_stage1_warpsize4x1x1_g1_tensor16x8x8_aligna4 Tactic: 0xb3e5ce9d1b1da232
[05/25/2023-09:14:54] [V] [TRT] Tactic: 0xb3e5ce9d1b1da232 Time: 0.00538463
[05/25/2023-09:14:54] [V] [TRT] /conv1/Conv + /act1/Relu Set Tactic Name: sm80_xmma_fprop_implicit_gemm_indexed_f32f32_f32f32_f32_nhwckrsc_nhwc_tilesize128x16x8_stage3_warpsize4x1x1_g1_ffma_aligna4_alignc4 Tactic: 0x4fd3c46622e98342
[05/25/2023-09:14:54] [V] [TRT] Tactic: 0x4fd3c46622e98342 Time: 0.0070646
[05/25/2023-09:14:54] [V] [TRT] /conv1/Conv + /act1/Relu Set Tactic Name: sm80_xmma_fprop_implicit_gemm_indexed_f32f32_tf32f32_f32_nhwckrsc_nhwc_tilesize128x128x16_stage4_warpsize2x2x1_g1_tensor16x8x8 Tactic: 0x65e41d81f093b482
[05/25/2023-09:14:54] [V] [TRT] Tactic: 0x65e41d81f093b482 Time: 0.0156677
[05/25/2023-09:14:54] [V] [TRT] /conv1/Conv + /act1/Relu Set Tactic Name: sm80_xmma_fprop_implicit_gemm_indexed_wo_smem_f32f32_tf32f32_f32_nhwckrsc_nhwc_tilesize128x32x64_stage1_warpsize4x1x1_g1_tensor16x8x8_alignc8 Tactic: 0x3a8712b17741b582
[05/25/2023-09:14:54] [V] [TRT] Tactic: 0x3a8712b17741b582 Time: 0.00455486
[05/25/2023-09:14:54] [V] [TRT] /conv1/Conv + /act1/Relu Set Tactic Name: sm80_xmma_fprop_implicit_gemm_f32f32_f32f32_f32_nhwckrsc_nhwc_tilesize128x64x8_stage3_warpsize2x2x1_g1_ffma_aligna4_alignc4 Tactic: 0x1da91d865428f237
[05/25/2023-09:14:54] [V] [TRT] Tactic: 0x1da91d865428f237 Time: 0.0111406
[05/25/2023-09:14:54] [V] [TRT] /conv1/Conv + /act1/Relu Set Tactic Name: sm80_xmma_fprop_implicit_gemm_indexed_f32f32_f32f32_f32_nhwckrsc_nhwc_tilesize128x32x8_stage3_warpsize2x2x1_g1_ffma_aligna4_alignc4 Tactic: 0xa6448a1e79f1ca6f
[05/25/2023-09:14:54] [V] [TRT] Tactic: 0xa6448a1e79f1ca6f Time: 0.00793913
[05/25/2023-09:14:54] [V] [TRT] /conv1/Conv + /act1/Relu Set Tactic Name: sm80_xmma_fprop_implicit_gemm_f32f32_tf32f32_f32_nhwckrsc_nhwc_tilesize128x128x16_stage4_warpsize2x2x1_g1_tensor16x8x8_t1r3s3 Tactic: 0x999e005e3b016ea6
[05/25/2023-09:14:54] [V] [TRT] Tactic: 0x999e005e3b016ea6 Time: 0.0153563
[05/25/2023-09:14:54] [V] [TRT] /conv1/Conv + /act1/Relu Set Tactic Name: sm80_xmma_fprop_implicit_gemm_indexed_wo_smem_f32f32_tf32f32_f32_nhwckrsc_nhwc_tilesize128x32x64_stage1_warpsize4x1x1_g1_tensor16x8x8 Tactic: 0xb33296dda7141c64
[05/25/2023-09:14:54] [V] [TRT] Tactic: 0xb33296dda7141c64 Time: 0.00455786
[05/25/2023-09:14:54] [V] [TRT] /conv1/Conv + /act1/Relu Set Tactic Name: sm80_xmma_fprop_implicit_gemm_f32f32_f32f32_f32_nhwckrsc_nhwc_tilesize64x256x8_stage3_warpsize1x4x1_g1_ffma_t1r3s3_aligna4_alignc4 Tactic: 0x3f0c846d6379bc98
[05/25/2023-09:14:54] [V] [TRT] Tactic: 0x3f0c846d6379bc98 Time: 0.0275261
[05/25/2023-09:14:54] [V] [TRT] /conv1/Conv + /act1/Relu Set Tactic Name: sm80_xmma_fprop_implicit_gemm_f32f32_f32f32_f32_nhwckrsc_nhwc_tilesize128x64x8_stage3_warpsize2x2x1_g1_ffma_t1r3s3_aligna4_alignc4 Tactic: 0xf48db81f02eca9ee
[05/25/2023-09:14:54] [V] [TRT] Tactic: 0xf48db81f02eca9ee Time: 0.0101611
[05/25/2023-09:14:54] [V] [TRT] /conv1/Conv + /act1/Relu Set Tactic Name: sm80_xmma_fprop_implicit_gemm_indexed_wo_smem_f32f32_tf32f32_f32_nhwckrsc_nhwc_tilesize128x32x16_stage1_warpsize4x1x1_g1_tensor16x8x8_aligna8_alignc8 Tactic: 0x7bff86d5f2eadc76
[05/25/2023-09:14:54] [V] [TRT] Tactic: 0x7bff86d5f2eadc76 Time: 0.00482118
[05/25/2023-09:14:54] [V] [TRT] /conv1/Conv + /act1/Relu Set Tactic Name: sm80_xmma_fprop_implicit_gemm_indexed_wo_smem_f32f32_tf32f32_f32_nhwckrsc_nhwc_tilesize128x16x32_stage1_warpsize4x1x1_g1_tensor16x8x8_aligna4_alignc4 Tactic: 0xcf8ea142095f02d2
[05/25/2023-09:14:54] [V] [TRT] Tactic: 0xcf8ea142095f02d2 Time: 0.00549113
[05/25/2023-09:14:54] [V] [TRT] /conv1/Conv + /act1/Relu Set Tactic Name: sm80_xmma_fprop_implicit_gemm_indexed_wo_smem_f32f32_tf32f32_f32_nhwckrsc_nhwc_tilesize128x16x64_stage1_warpsize4x1x1_g1_tensor16x8x8_aligna4_alignc8 Tactic: 0x22cadc265a3b2e32
[05/25/2023-09:14:54] [V] [TRT] Tactic: 0x22cadc265a3b2e32 Time: 0.00545558
[05/25/2023-09:14:54] [V] [TRT] /conv1/Conv + /act1/Relu Set Tactic Name: ampere_scudnn_128x128_relu_exp_large_nhwc_tn_v1 Tactic: 0xca7eeb8d9143d738
[05/25/2023-09:14:54] [V] [TRT] Tactic: 0xca7eeb8d9143d738 Time: 0.0138036
[05/25/2023-09:14:54] [V] [TRT] /conv1/Conv + /act1/Relu Set Tactic Name: sm80_xmma_fprop_implicit_gemm_indexed_wo_smem_f32f32_tf32f32_f32_nhwckrsc_nhwc_tilesize128x16x64_stage1_warpsize4x1x1_g1_tensor16x8x8_aligna8_alignc4 Tactic: 0xab0496509b88ebe0
[05/25/2023-09:14:54] [V] [TRT] Tactic: 0xab0496509b88ebe0 Time: 0.004562
[05/25/2023-09:14:54] [V] [TRT] /conv1/Conv + /act1/Relu Set Tactic Name: sm80_xmma_fprop_implicit_gemm_f32f32_f32f32_f32_nhwckrsc_nhwc_tilesize64x128x8_stage3_warpsize1x4x1_g1_ffma_t1r3s3_aligna4_alignc4 Tactic: 0xd15dd11d64344e83
[05/25/2023-09:14:54] [V] [TRT] Tactic: 0xd15dd11d64344e83 Time: 0.0100635
[05/25/2023-09:14:54] [V] [TRT] /conv1/Conv + /act1/Relu Set Tactic Name: ampere_scudnn_128x128_ldg4_relu_exp_large_nhwc_tn_v1 Tactic: 0x634e99502974e4da
[05/25/2023-09:14:54] [V] [TRT] Tactic: 0x634e99502974e4da Time: 0.0134583
[05/25/2023-09:14:54] [V] [TRT] /conv1/Conv + /act1/Relu Set Tactic Name: sm80_xmma_fprop_implicit_gemm_indexed_wo_smem_f32f32_tf32f32_f32_nhwckrsc_nhwc_tilesize128x16x32_stage1_warpsize4x1x1_g1_tensor16x8x8 Tactic: 0xae48d3ccfe1edfcd
[05/25/2023-09:14:54] [V] [TRT] Tactic: 0xae48d3ccfe1edfcd Time: 0.00436876
[05/25/2023-09:14:54] [V] [TRT] /conv1/Conv + /act1/Relu Set Tactic Name: sm80_xmma_fprop_implicit_gemm_f32f32_tf32f32_f32_nhwckrsc_nhwc_tilesize128x128x16_stage4_warpsize2x2x1_g1_tensor16x8x8 Tactic: 0xb443c221fcb1565b
[05/25/2023-09:14:54] [V] [TRT] Tactic: 0xb443c221fcb1565b Time: 0.0154437
[05/25/2023-09:14:54] [V] [TRT] /conv1/Conv + /act1/Relu Set Tactic Name: sm80_xmma_fprop_implicit_gemm_indexed_wo_smem_f32f32_tf32f32_f32_nhwckrsc_nhwc_tilesize128x32x16_stage1_warpsize4x1x1_g1_tensor16x8x8_alignc4 Tactic: 0xfed494d61b2087ba
[05/25/2023-09:14:54] [V] [TRT] Tactic: 0xfed494d61b2087ba Time: 0.00469353
[05/25/2023-09:14:54] [V] [TRT] /conv1/Conv + /act1/Relu Set Tactic Name: sm80_xmma_fprop_implicit_gemm_indexed_wo_smem_f32f32_tf32f32_f32_nhwckrsc_nhwc_tilesize128x16x32_stage1_warpsize4x1x1_g1_tensor16x8x8_alignc4 Tactic: 0x1a373db9a2bc4028
[05/25/2023-09:14:54] [V] [TRT] Tactic: 0x1a373db9a2bc4028 Time: 0.0042837
[05/25/2023-09:14:54] [V] [TRT] /conv1/Conv + /act1/Relu Set Tactic Name: sm80_xmma_fprop_implicit_gemm_indexed_wo_smem_f32f32_tf32f32_f32_nhwckrsc_nhwc_tilesize128x16x64_stage1_warpsize4x1x1_g1_tensor16x8x8_aligna8 Tactic: 0xe9e5475c77d60638
[05/25/2023-09:14:54] [V] [TRT] Tactic: 0xe9e5475c77d60638 Time: 0.00450971
[05/25/2023-09:14:54] [V] [TRT] /conv1/Conv + /act1/Relu Set Tactic Name: sm80_xmma_fprop_implicit_gemm_indexed_wo_smem_f32f32_tf32f32_f32_nhwckrsc_nhwc_tilesize128x32x16_stage1_warpsize4x1x1_g1_tensor16x8x8_alignc8 Tactic: 0x72a5d05b1bb165ef
[05/25/2023-09:14:54] [V] [TRT] Tactic: 0x72a5d05b1bb165ef Time: 0.00468203
[05/25/2023-09:14:54] [V] [TRT] /conv1/Conv + /act1/Relu Set Tactic Name: sm80_xmma_fprop_implicit_gemm_indexed_wo_smem_f32f32_tf32f32_f32_nhwckrsc_nhwc_tilesize128x16x32_stage1_warpsize4x1x1_g1_tensor16x8x8_alignc8 Tactic: 0x96467934a22da27d
[05/25/2023-09:14:54] [V] [TRT] Tactic: 0x96467934a22da27d Time: 0.00425802
[05/25/2023-09:14:54] [V] [TRT] /conv1/Conv + /act1/Relu Set Tactic Name: sm80_xmma_fprop_implicit_gemm_indexed_wo_smem_f32f32_tf32f32_f32_nhwckrsc_nhwc_tilesize128x16x64_stage1_warpsize4x1x1_g1_tensor16x8x8 Tactic: 0x10383a0781d24dde
[05/25/2023-09:14:54] [V] [TRT] Tactic: 0x10383a0781d24dde Time: 0.00387768
[05/25/2023-09:14:54] [V] [TRT] /conv1/Conv + /act1/Relu Set Tactic Name: sm80_xmma_fprop_implicit_gemm_indexed_wo_smem_f32f32_tf32f32_f32_nhwckrsc_nhwc_tilesize128x16x64_stage1_warpsize4x1x1_g1_tensor16x8x8_alignc8 Tactic: 0x4037b478ce77e422
[05/25/2023-09:14:54] [V] [TRT] Tactic: 0x4037b478ce77e422 Time: 0.00396851
[05/25/2023-09:14:54] [V] [TRT] /conv1/Conv + /act1/Relu Set Tactic Name: sm80_xmma_fprop_implicit_gemm_indexed_wo_smem_f32f32_tf32f32_f32_nhwckrsc_nhwc_tilesize128x16x32_stage1_warpsize4x1x1_g1_tensor16x8x8_aligna8 Tactic: 0x3f948a101b8c4067
[05/25/2023-09:14:54] [V] [TRT] Tactic: 0x3f948a101b8c4067 Time: 0.0046748
[05/25/2023-09:14:54] [V] [TRT] /conv1/Conv + /act1/Relu Set Tactic Name: sm80_xmma_fprop_implicit_gemm_indexed_wo_smem_f32f32_tf32f32_f32_nhwckrsc_nhwc_tilesize128x32x16_stage1_warpsize4x1x1_g1_tensor16x8x8 Tactic: 0x9cb304e2edbc1221
[05/25/2023-09:14:54] [V] [TRT] Tactic: 0x9cb304e2edbc1221 Time: 0.0046776
[05/25/2023-09:14:54] [V] [TRT] /conv1/Conv + /act1/Relu Set Tactic Name: sm80_xmma_fprop_implicit_gemm_indexed_wo_smem_f32f32_tf32f32_f32_nhwckrsc_nhwc_tilesize128x32x16_stage1_warpsize4x1x1_g1_tensor16x8x8_aligna4_alignc4 Tactic: 0xf231cca3335919a4
[05/25/2023-09:14:54] [V] [TRT] Tactic: 0xf231cca3335919a4 Time: 0.00527886
[05/25/2023-09:14:54] [V] [TRT] /conv1/Conv + /act1/Relu Set Tactic Name: sm80_xmma_fprop_implicit_gemm_indexed_wo_smem_f32f32_tf32f32_f32_nhwckrsc_nhwc_tilesize128x32x64_stage1_warpsize4x1x1_g1_tensor16x8x8_aligna8 Tactic: 0x9355e195cee05798
[05/25/2023-09:14:54] [V] [TRT] Tactic: 0x9355e195cee05798 Time: 0.00481631
