5.1-trtexec/models/log/vgg16/build/build.log
[05/26/2023-15:30:23] [V] [TRT] *************** Autotuning Reformat: Float(150528,50176,224,1) -> Float(150528,1,672,3) ***************
[05/26/2023-15:30:23] [V] [TRT] --------------- Timing Runner: Optimizer Reformat(input0 -> <out>) (Reformat)
[05/26/2023-15:30:23] [V] [TRT] Tactic: 0x00000000000003e8 Time: 0.00385083
[05/26/2023-15:30:23] [V] [TRT] Tactic: 0x00000000000003ea Time: 0.00513943
[05/26/2023-15:30:23] [V] [TRT] Tactic: 0x0000000000000000 Time: 0.00385937
[05/26/2023-15:30:23] [V] [TRT] Fastest Tactic: 0x00000000000003e8 Time: 0.00385083
[05/26/2023-15:30:23] [V] [TRT] *************** Autotuning Reformat: Float(150528,50176,224,1) -> Float(50176,1:4,224,1) ***************
[05/26/2023-15:30:23] [V] [TRT] --------------- Timing Runner: Optimizer Reformat(input0 -> <out>) (Reformat)
[05/26/2023-15:30:23] [V] [TRT] Tactic: 0x00000000000003e8 Time: 0.00567086
[05/26/2023-15:30:23] [V] [TRT] Tactic: 0x00000000000003ea Time: 0.00497104
[05/26/2023-15:30:23] [V] [TRT] Tactic: 0x0000000000000000 Time: 0.00565626
[05/26/2023-15:30:23] [V] [TRT] Fastest Tactic: 0x00000000000003ea Time: 0.00497104
[05/26/2023-15:30:23] [V] [TRT] =============== Computing reformatting costs: 
[05/26/2023-15:30:23] [V] [TRT] *************** Autotuning Reformat: Float(3211264,50176,224,1) -> Float(3211264,1,14336,64) ***************
[05/26/2023-15:30:23] [V] [TRT] --------------- Timing Runner: Optimizer Reformat(/features/features.1/Relu_output_0 -> <out>) (Reformat)
[05/26/2023-15:30:23] [V] [TRT] Tactic: 0x00000000000003e8 Time: 0.0490651
[05/26/2023-15:30:23] [V] [TRT] Tactic: 0x00000000000003ea Time: 0.0427154
[05/26/2023-15:30:23] [V] [TRT] Tactic: 0x0000000000000000 Time: 0.0492008
[05/26/2023-15:30:23] [V] [TRT] Fastest Tactic: 0x00000000000003ea Time: 0.0427154
[05/26/2023-15:30:23] [V] [TRT] *************** Autotuning Reformat: Float(3211264,50176,224,1) -> Float(802816,1:4,3584,16) ***************
[05/26/2023-15:30:23] [V] [TRT] --------------- Timing Runner: Optimizer Reformat(/features/features.1/Relu_output_0 -> <out>) (Reformat)
[05/26/2023-15:30:23] [V] [TRT] Tactic: 0x00000000000003e8 Time: 0.0497859
[05/26/2023-15:30:23] [V] [TRT] Tactic: 0x00000000000003ea Time: 0.04276
[05/26/2023-15:30:23] [V] [TRT] Tactic: 0x0000000000000000 Time: 0.0498347
[05/26/2023-15:30:23] [V] [TRT] Fastest Tactic: 0x00000000000003ea Time: 0.04276
[05/26/2023-15:30:23] [V] [TRT] *************** Autotuning Reformat: Float(3211264,1,14336,64) -> Float(3211264,50176,224,1) ***************
[05/26/2023-15:30:23] [V] [TRT] --------------- Timing Runner: Optimizer Reformat(/features/features.1/Relu_output_0 -> <out>) (Reformat)
[05/26/2023-15:30:23] [V] [TRT] Tactic: 0x00000000000003e8 Time: 0.134437
[05/26/2023-15:30:23] [V] [TRT] Tactic: 0x00000000000003ea Time: 0.0434834
[05/26/2023-15:30:23] [V] [TRT] Tactic: 0x0000000000000000 Time: 0.133339
[05/26/2023-15:30:23] [V] [TRT] Fastest Tactic: 0x00000000000003ea Time: 0.0434834
[05/26/2023-15:30:23] [V] [TRT] *************** Autotuning Reformat: Float(3211264,1,14336,64) -> Float(802816,1:4,3584,16) ***************
[05/26/2023-15:30:23] [V] [TRT] --------------- Timing Runner: Optimizer Reformat(/features/features.1/Relu_output_0 -> <out>) (Reformat)
[05/26/2023-15:30:23] [V] [TRT] Tactic: 0x00000000000003e8 Time: 0.0416549
[05/26/2023-15:30:23] [V] [TRT] Tactic: 0x00000000000003ea Time: 0.0426149
[05/26/2023-15:30:23] [V] [TRT] Tactic: 0x0000000000000000 Time: 0.0415817
[05/26/2023-15:30:23] [V] [TRT] Fastest Tactic: 0x0000000000000000 Time: 0.0415817
[05/26/2023-15:30:23] [V] [TRT] *************** Autotuning Reformat: Float(802816,1:4,3584,16) -> Float(3211264,50176,224,1) ***************
[05/26/2023-15:30:23] [V] [TRT] --------------- Timing Runner: Optimizer Reformat(/features/features.1/Relu_output_0 -> <out>) (Reformat)
[05/26/2023-15:30:23] [V] [TRT] Tactic: 0x00000000000003e8 Time: 0.135314
[05/26/2023-15:30:23] [V] [TRT] Tactic: 0x00000000000003ea Time: 0.0436297
[05/26/2023-15:30:23] [V] [TRT] Tactic: 0x0000000000000000 Time: 0.136213
[05/26/2023-15:30:23] [V] [TRT] Fastest Tactic: 0x00000000000003ea Time: 0.0436297
[05/26/2023-15:30:23] [V] [TRT] *************** Autotuning Reformat: Float(802816,1:4,3584,16) -> Float(3211264,1,14336,64) ***************
[05/26/2023-15:30:23] [V] [TRT] --------------- Timing Runner: Optimizer Reformat(/features/features.1/Relu_output_0 -> <out>) (Reformat)
[05/26/2023-15:30:23] [V] [TRT] Tactic: 0x00000000000003e8 Time: 0.0415463
[05/26/2023-15:30:23] [V] [TRT] Tactic: 0x00000000000003ea Time: 0.0426423
[05/26/2023-15:30:23] [V] [TRT] Tactic: 0x0000000000000000 Time: 0.0415817
[05/26/2023-15:30:23] [V] [TRT] Fastest Tactic: 0x00000000000003e8 Time: 0.0415463
[05/26/2023-15:30:23] [V] [TRT] =============== Computing reformatting costs: 
[05/26/2023-15:30:23] [V] [TRT] *************** Autotuning Reformat: Float(3211264,50176,224,1) -> Float(802816,1:4,3584,16) ***************
[05/26/2023-15:30:23] [V] [TRT] *************** Autotuning Reformat: Float(3211264,1,14336,64) -> Float(3211264,50176,224,1) ***************
[05/26/2023-15:30:23] [V] [TRT] *************** Autotuning Reformat: Float(3211264,1,14336,64) -> Float(802816,1:4,3584,16) ***************
[05/26/2023-15:30:23] [V] [TRT] *************** Autotuning Reformat: Float(802816,1:4,3584,16) -> Float(3211264,50176,224,1) ***************
[05/26/2023-15:30:23] [V] [TRT] =============== Computing reformatting costs: 
[05/26/2023-15:30:23] [V] [TRT] *************** Autotuning Reformat: Float(802816,12544,112,1) -> Float(802816,1,7168,64) ***************
[05/26/2023-15:30:23] [V] [TRT] --------------- Timing Runner: Optimizer Reformat(/features/features.4/MaxPool_output_0 -> <out>) (Reformat)
[05/26/2023-15:30:23] [V] [TRT] Tactic: 0x00000000000003e8 Time: 0.0149984
[05/26/2023-15:30:23] [V] [TRT] Tactic: 0x00000000000003ea Time: 0.011655
[05/26/2023-15:30:23] [V] [TRT] Tactic: 0x0000000000000000 Time: 0.0149486
[05/26/2023-15:30:23] [V] [TRT] Fastest Tactic: 0x00000000000003ea Time: 0.011655
[05/26/2023-15:30:23] [V] [TRT] *************** Autotuning Reformat: Float(802816,12544,112,1) -> Float(200704,1:4,1792,16) ***************
[05/26/2023-15:30:23] [V] [TRT] --------------- Timing Runner: Optimizer Reformat(/features/features.4/MaxPool_output_0 -> <out>) (Reformat)
[05/26/2023-15:30:23] [V] [TRT] Tactic: 0x00000000000003e8 Time: 0.0151406
[05/26/2023-15:30:23] [V] [TRT] Tactic: 0x00000000000003ea Time: 0.0117795
[05/26/2023-15:30:23] [V] [TRT] Tactic: 0x0000000000000000 Time: 0.0151561
[05/26/2023-15:30:23] [V] [TRT] Fastest Tactic: 0x00000000000003ea Time: 0.0117795
[05/26/2023-15:30:23] [V] [TRT] *************** Autotuning Reformat: Float(802816,1,7168,64) -> Float(802816,12544,112,1) ***************
[05/26/2023-15:30:23] [V] [TRT] --------------- Timing Runner: Optimizer Reformat(/features/features.4/MaxPool_output_0 -> <out>) (Reformat)
[05/26/2023-15:30:23] [V] [TRT] Tactic: 0x00000000000003e8 Time: 0.016191
[05/26/2023-15:30:23] [V] [TRT] Tactic: 0x00000000000003ea Time: 0.0140975
[05/26/2023-15:30:23] [V] [TRT] Tactic: 0x0000000000000000 Time: 0.0162006
[05/26/2023-15:30:23] [V] [TRT] Fastest Tactic: 0x00000000000003ea Time: 0.0140975
[05/26/2023-15:30:23] [V] [TRT] *************** Autotuning Reformat: Float(802816,1,7168,64) -> Float(200704,1:4,1792,16) ***************
[05/26/2023-15:30:23] [V] [TRT] --------------- Timing Runner: Optimizer Reformat(/features/features.4/MaxPool_output_0 -> <out>) (Reformat)
[05/26/2023-15:30:23] [V] [TRT] Tactic: 0x00000000000003e8 Time: 0.0130581
[05/26/2023-15:30:23] [V] [TRT] Tactic: 0x00000000000003ea Time: 0.0116951
[05/26/2023-15:30:23] [V] [TRT] Tactic: 0x0000000000000000 Time: 0.0130701
[05/26/2023-15:30:23] [V] [TRT] Fastest Tactic: 0x00000000000003ea Time: 0.0116951
[05/26/2023-15:30:23] [V] [TRT] *************** Autotuning Reformat: Float(200704,1:4,1792,16) -> Float(802816,12544,112,1) ***************
[05/26/2023-15:30:23] [V] [TRT] --------------- Timing Runner: Optimizer Reformat(/features/features.4/MaxPool_output_0 -> <out>) (Reformat)
[05/26/2023-15:30:23] [V] [TRT] Tactic: 0x00000000000003e8 Time: 0.0162042
[05/26/2023-15:30:23] [V] [TRT] Tactic: 0x00000000000003ea Time: 0.0140825
[05/26/2023-15:30:23] [V] [TRT] Tactic: 0x0000000000000000 Time: 0.0161194
[05/26/2023-15:30:23] [V] [TRT] Fastest Tactic: 0x00000000000003ea Time: 0.0140825
[05/26/2023-15:30:23] [V] [TRT] *************** Autotuning Reformat: Float(200704,1:4,1792,16) -> Float(802816,1,7168,64) ***************
[05/26/2023-15:30:23] [V] [TRT] --------------- Timing Runner: Optimizer Reformat(/features/features.4/MaxPool_output_0 -> <out>) (Reformat)
[05/26/2023-15:30:23] [V] [TRT] Tactic: 0x00000000000003e8 Time: 0.013014
[05/26/2023-15:30:23] [V] [TRT] Tactic: 0x00000000000003ea Time: 0.0118256
[05/26/2023-15:30:23] [V] [TRT] Tactic: 0x0000000000000000 Time: 0.013046
[05/26/2023-15:30:23] [V] [TRT] Fastest Tactic: 0x00000000000003ea Time: 0.0118256
[05/26/2023-15:30:23] [V] [TRT] =============== Computing reformatting costs: 
[05/26/2023-15:30:23] [V] [TRT] *************** Autotuning Reformat: Float(1605632,12544,112,1) -> Float(1605632,1,14336,128) ***************
[05/26/2023-15:30:23] [V] [TRT] --------------- Timing Runner: Optimizer Reformat(/features/features.6/Relu_output_0 -> <out>) (Reformat)
[05/26/2023-15:30:23] [V] [TRT] Tactic: 0x00000000000003e8 Time: 0.0321518
[05/26/2023-15:30:23] [V] [TRT] Tactic: 0x00000000000003ea Time: 0.0246987
[05/26/2023-15:30:23] [V] [TRT] Tactic: 0x0000000000000000 Time: 0.0322633
[05/26/2023-15:30:23] [V] [TRT] Fastest Tactic: 0x00000000000003ea Time: 0.0246987
[05/26/2023-15:30:23] [V] [TRT] *************** Autotuning Reformat: Float(1605632,12544,112,1) -> Float(401408,1:4,3584,32) ***************
[05/26/2023-15:30:23] [V] [TRT] --------------- Timing Runner: Optimizer Reformat(/features/features.6/Relu_output_0 -> <out>) (Reformat)
[05/26/2023-15:30:23] [V] [TRT] Tactic: 0x00000000000003e8 Time: 0.0323054
[05/26/2023-15:30:23] [V] [TRT] Tactic: 0x00000000000003ea Time: 0.0247223
[05/26/2023-15:30:23] [V] [TRT] Tactic: 0x0000000000000000 Time: 0.0322642
[05/26/2023-15:30:23] [V] [TRT] Fastest Tactic: 0x00000000000003ea Time: 0.0247223
[05/26/2023-15:30:23] [V] [TRT] *************** Autotuning Reformat: Float(1605632,1,14336,128) -> Float(1605632,12544,112,1) ***************
[05/26/2023-15:30:23] [V] [TRT] --------------- Timing Runner: Optimizer Reformat(/features/features.6/Relu_output_0 -> <out>) (Reformat)
[05/26/2023-15:30:23] [V] [TRT] Tactic: 0x00000000000003e8 Time: 0.0347191
[05/26/2023-15:30:23] [V] [TRT] Tactic: 0x00000000000003ea Time: 0.0249417
[05/26/2023-15:30:23] [V] [TRT] Tactic: 0x0000000000000000 Time: 0.0347575
[05/26/2023-15:30:23] [V] [TRT] Fastest Tactic: 0x00000000000003ea Time: 0.0249417
[05/26/2023-15:30:23] [V] [TRT] *************** Autotuning Reformat: Float(1605632,1,14336,128) -> Float(401408,1:4,3584,32) ***************
[05/26/2023-15:30:23] [V] [TRT] --------------- Timing Runner: Optimizer Reformat(/features/features.6/Relu_output_0 -> <out>) (Reformat)
[05/26/2023-15:30:23] [V] [TRT] Tactic: 0x00000000000003e8 Time: 0.0225548
[05/26/2023-15:30:23] [V] [TRT] Tactic: 0x00000000000003ea Time: 0.0246248
[05/26/2023-15:30:24] [V] [TRT] Tactic: 0x0000000000000000 Time: 0.0225287
[05/26/2023-15:30:24] [V] [TRT] Fastest Tactic: 0x0000000000000000 Time: 0.0225287
[05/26/2023-15:30:24] [V] [TRT] *************** Autotuning Reformat: Float(401408,1:4,3584,32) -> Float(1605632,12544,112,1) ***************
[05/26/2023-15:30:24] [V] [TRT] --------------- Timing Runner: Optimizer Reformat(/features/features.6/Relu_output_0 -> <out>) (Reformat)
[05/26/2023-15:30:24] [V] [TRT] Tactic: 0x00000000000003e8 Time: 0.0349842
[05/26/2023-15:30:24] [V] [TRT] Tactic: 0x00000000000003ea Time: 0.0249158
[05/26/2023-15:30:24] [V] [TRT] Tactic: 0x0000000000000000 Time: 0.0351735
[05/26/2023-15:30:24] [V] [TRT] Fastest Tactic: 0x00000000000003ea Time: 0.0249158
[05/26/2023-15:30:24] [V] [TRT] *************** Autotuning Reformat: Float(401408,1:4,3584,32) -> Float(1605632,1,14336,128) ***************
[05/26/2023-15:30:24] [V] [TRT] --------------- Timing Runner: Optimizer Reformat(/features/features.6/Relu_output_0 -> <out>) (Reformat)
[05/26/2023-15:30:24] [V] [TRT] Tactic: 0x00000000000003e8 Time: 0.0225254
[05/26/2023-15:30:24] [V] [TRT] Tactic: 0x00000000000003ea Time: 0.0244785
[05/26/2023-15:30:24] [V] [TRT] Tactic: 0x0000000000000000 Time: 0.0224856
[05/26/2023-15:30:24] [V] [TRT] Fastest Tactic: 0x0000000000000000 Time: 0.0224856
[05/26/2023-15:30:24] [V] [TRT] =============== Computing reformatting costs: 
[05/26/2023-15:30:24] [V] [TRT] *************** Autotuning Reformat: Float(1605632,12544,112,1) -> Float(401408,1:4,3584,32) ***************
[05/26/2023-15:30:24] [V] [TRT] *************** Autotuning Reformat: Float(1605632,1,14336,128) -> Float(1605632,12544,112,1) ***************
[05/26/2023-15:30:24] [V] [TRT] *************** Autotuning Reformat: Float(1605632,1,14336,128) -> Float(401408,1:4,3584,32) ***************
[05/26/2023-15:30:24] [V] [TRT] *************** Autotuning Reformat: Float(401408,1:4,3584,32) -> Float(1605632,12544,112,1) ***************
[05/26/2023-15:30:24] [V] [TRT] =============== Computing reformatting costs: 
[05/26/2023-15:30:24] [V] [TRT] *************** Autotuning Reformat: Float(401408,3136,56,1) -> Float(401408,1,7168,128) ***************
[05/26/2023-15:30:24] [V] [TRT] --------------- Timing Runner: Optimizer Reformat(/features/features.9/MaxPool_output_0 -> <out>) (Reformat)
[05/26/2023-15:30:24] [V] [TRT] Tactic: 0x00000000000003e8 Time: 0.00971398
[05/26/2023-15:30:24] [V] [TRT] Tactic: 0x00000000000003ea Time: 0.00707135
[05/26/2023-15:30:24] [V] [TRT] Tactic: 0x0000000000000000 Time: 0.00971307
[05/26/2023-15:30:24] [V] [TRT] Fastest Tactic: 0x00000000000003ea Time: 0.00707135
[05/26/2023-15:30:24] [V] [TRT] *************** Autotuning Reformat: Float(401408,3136,56,1) -> Float(100352,1:4,1792,32) ***************
[05/26/2023-15:30:24] [V] [TRT] --------------- Timing Runner: Optimizer Reformat(/features/features.9/MaxPool_output_0 -> <out>) (Reformat)
[05/26/2023-15:30:24] [V] [TRT] Tactic: 0x00000000000003e8 Time: 0.00989288
[05/26/2023-15:30:24] [V] [TRT] Tactic: 0x00000000000003ea Time: 0.00705023
[05/26/2023-15:30:24] [V] [TRT] Tactic: 0x0000000000000000 Time: 0.00985112
[05/26/2023-15:30:24] [V] [TRT] Fastest Tactic: 0x00000000000003ea Time: 0.00705023
[05/26/2023-15:30:24] [V] [TRT] *************** Autotuning Reformat: Float(401408,1,7168,128) -> Float(401408,3136,56,1) ***************
[05/26/2023-15:30:24] [V] [TRT] --------------- Timing Runner: Optimizer Reformat(/features/features.9/MaxPool_output_0 -> <out>) (Reformat)
[05/26/2023-15:30:24] [V] [TRT] Tactic: 0x00000000000003e8 Time: 0.0100474
[05/26/2023-15:30:24] [V] [TRT] Tactic: 0x00000000000003ea Time: 0.00769323
[05/26/2023-15:30:24] [V] [TRT] Tactic: 0x0000000000000000 Time: 0.0100358
[05/26/2023-15:30:24] [V] [TRT] Fastest Tactic: 0x00000000000003ea Time: 0.00769323
[05/26/2023-15:30:24] [V] [TRT] *************** Autotuning Reformat: Float(401408,1,7168,128) -> Float(100352,1:4,1792,32) ***************
[05/26/2023-15:30:24] [V] [TRT] --------------- Timing Runner: Optimizer Reformat(/features/features.9/MaxPool_output_0 -> <out>) (Reformat)
[05/26/2023-15:30:24] [V] [TRT] Tactic: 0x00000000000003e8 Time: 0.00657247
[05/26/2023-15:30:24] [V] [TRT] Tactic: 0x00000000000003ea Time: 0.00657475
[05/26/2023-15:30:24] [V] [TRT] Tactic: 0x0000000000000000 Time: 0.00657247
[05/26/2023-15:30:24] [V] [TRT] Fastest Tactic: 0x00000000000003e8 Time: 0.00657247
[05/26/2023-15:30:24] [V] [TRT] *************** Autotuning Reformat: Float(100352,1:4,1792,32) -> Float(401408,3136,56,1) ***************
[05/26/2023-15:30:24] [V] [TRT] --------------- Timing Runner: Optimizer Reformat(/features/features.9/MaxPool_output_0 -> <out>) (Reformat)
[05/26/2023-15:30:24] [V] [TRT] Tactic: 0x00000000000003e8 Time: 0.0101196
[05/26/2023-15:30:24] [V] [TRT] Tactic: 0x00000000000003ea Time: 0.00769371
[05/26/2023-15:30:24] [V] [TRT] Tactic: 0x0000000000000000 Time: 0.0100794
[05/26/2023-15:30:24] [V] [TRT] Fastest Tactic: 0x00000000000003ea Time: 0.00769371
[05/26/2023-15:30:24] [V] [TRT] *************** Autotuning Reformat: Float(100352,1:4,1792,32) -> Float(401408,1,7168,128) ***************
[05/26/2023-15:30:24] [V] [TRT] --------------- Timing Runner: Optimizer Reformat(/features/features.9/MaxPool_output_0 -> <out>) (Reformat)
[05/26/2023-15:30:24] [V] [TRT] Tactic: 0x00000000000003e8 Time: 0.00603352
[05/26/2023-15:30:24] [V] [TRT] Tactic: 0x00000000000003ea Time: 0.00601676
[05/26/2023-15:30:24] [V] [TRT] Tactic: 0x0000000000000000 Time: 0.00601581
[05/26/2023-15:30:24] [V] [TRT] Fastest Tactic: 0x0000000000000000 Time: 0.00601581
[05/26/2023-15:30:24] [V] [TRT] =============== Computing reformatting costs: 
[05/26/2023-15:30:24] [V] [TRT] *************** Autotuning Reformat: Float(802816,3136,56,1) -> Float(802816,1,14336,256) ***************
[05/26/2023-15:30:24] [V] [TRT] --------------- Timing Runner: Optimizer Reformat(/features/features.11/Relu_output_0 -> <out>) (Reformat)
[05/26/2023-15:30:24] [V] [TRT] Tactic: 0x00000000000003e8 Time: 0.0177747
[05/26/2023-15:30:24] [V] [TRT] Tactic: 0x00000000000003ea Time: 0.0111406
[05/26/2023-15:30:24] [V] [TRT] Tactic: 0x0000000000000000 Time: 0.0176239
[05/26/2023-15:30:24] [V] [TRT] Fastest Tactic: 0x00000000000003ea Time: 0.0111406
[05/26/2023-15:30:24] [V] [TRT] *************** Autotuning Reformat: Float(802816,3136,56,1) -> Float(200704,1:4,3584,64) ***************
[05/26/2023-15:30:24] [V] [TRT] --------------- Timing Runner: Optimizer Reformat(/features/features.11/Relu_output_0 -> <out>) (Reformat)
[05/26/2023-15:30:24] [V] [TRT] Tactic: 0x00000000000003e8 Time: 0.017789
[05/26/2023-15:30:24] [V] [TRT] Tactic: 0x00000000000003ea Time: 0.0111258
[05/26/2023-15:30:24] [V] [TRT] Tactic: 0x0000000000000000 Time: 0.0177183
[05/26/2023-15:30:24] [V] [TRT] Fastest Tactic: 0x00000000000003ea Time: 0.0111258
[05/26/2023-15:30:24] [V] [TRT] *************** Autotuning Reformat: Float(802816,1,14336,256) -> Float(802816,3136,56,1) ***************
[05/26/2023-15:30:24] [V] [TRT] --------------- Timing Runner: Optimizer Reformat(/features/features.11/Relu_output_0 -> <out>) (Reformat)
[05/26/2023-15:30:24] [V] [TRT] Tactic: 0x00000000000003e8 Time: 0.0165506
[05/26/2023-15:30:24] [V] [TRT] Tactic: 0x00000000000003ea Time: 0.0134437
[05/26/2023-15:30:24] [V] [TRT] Tactic: 0x0000000000000000 Time: 0.0163703
[05/26/2023-15:30:24] [V] [TRT] Fastest Tactic: 0x00000000000003ea Time: 0.0134437
[05/26/2023-15:30:24] [V] [TRT] *************** Autotuning Reformat: Float(802816,1,14336,256) -> Float(200704,1:4,3584,64) ***************
[05/26/2023-15:30:24] [V] [TRT] --------------- Timing Runner: Optimizer Reformat(/features/features.11/Relu_output_0 -> <out>) (Reformat)
[05/26/2023-15:30:24] [V] [TRT] Tactic: 0x00000000000003e8 Time: 0.0124838
[05/26/2023-15:30:24] [V] [TRT] Tactic: 0x00000000000003ea Time: 0.0110636
[05/26/2023-15:30:24] [V] [TRT] Tactic: 0x0000000000000000 Time: 0.0124621
[05/26/2023-15:30:24] [V] [TRT] Fastest Tactic: 0x00000000000003ea Time: 0.0110636
[05/26/2023-15:30:24] [V] [TRT] *************** Autotuning Reformat: Float(200704,1:4,3584,64) -> Float(802816,3136,56,1) ***************
[05/26/2023-15:30:24] [V] [TRT] --------------- Timing Runner: Optimizer Reformat(/features/features.11/Relu_output_0 -> <out>) (Reformat)
[05/26/2023-15:30:24] [V] [TRT] Tactic: 0x00000000000003e8 Time: 0.0165191
[05/26/2023-15:30:24] [V] [TRT] Tactic: 0x00000000000003ea Time: 0.0134117
[05/26/2023-15:30:24] [V] [TRT] Tactic: 0x0000000000000000 Time: 0.0165877
[05/26/2023-15:30:24] [V] [TRT] Fastest Tactic: 0x00000000000003ea Time: 0.0134117
[05/26/2023-15:30:24] [V] [TRT] *************** Autotuning Reformat: Float(200704,1:4,3584,64) -> Float(802816,1,14336,256) ***************
[05/26/2023-15:30:24] [V] [TRT] --------------- Timing Runner: Optimizer Reformat(/features/features.11/Relu_output_0 -> <out>) (Reformat)
[05/26/2023-15:30:24] [V] [TRT] Tactic: 0x00000000000003e8 Time: 0.012448
[05/26/2023-15:30:24] [V] [TRT] Tactic: 0x00000000000003ea Time: 0.0110396
[05/26/2023-15:30:24] [V] [TRT] Tactic: 0x0000000000000000 Time: 0.0124465
[05/26/2023-15:30:24] [V] [TRT] Fastest Tactic: 0x00000000000003ea Time: 0.0110396
[05/26/2023-15:30:24] [V] [TRT] =============== Computing reformatting costs: 
[05/26/2023-15:30:24] [V] [TRT] *************** Autotuning Reformat: Float(802816,3136,56,1) -> Float(802816,1,14336,256) ***************
[05/26/2023-15:30:24] [V] [TRT] *************** Autotuning Reformat: Float(802816,3136,56,1) -> Float(200704,1:4,3584,64) ***************
[05/26/2023-15:30:24] [V] [TRT] *************** Autotuning Reformat: Float(802816,1,14336,256) -> Float(802816,3136,56,1) ***************
[05/26/2023-15:30:24] [V] [TRT] *************** Autotuning Reformat: Float(802816,1,14336,256) -> Float(200704,1:4,3584,64) ***************
[05/26/2023-15:30:24] [V] [TRT] *************** Autotuning Reformat: Float(200704,1:4,3584,64) -> Float(802816,3136,56,1) ***************
[05/26/2023-15:30:24] [V] [TRT] *************** Autotuning Reformat: Float(200704,1:4,3584,64) -> Float(802816,1,14336,256) ***************
[05/26/2023-15:30:24] [V] [TRT] =============== Computing reformatting costs: 
[05/26/2023-15:30:24] [V] [TRT] *************** Autotuning Reformat: Float(802816,3136,56,1) -> Float(200704,1:4,3584,64) ***************
[05/26/2023-15:30:24] [V] [TRT] *************** Autotuning Reformat: Float(802816,1,14336,256) -> Float(802816,3136,56,1) ***************
[05/26/2023-15:30:24] [V] [TRT] *************** Autotuning Reformat: Float(802816,1,14336,256) -> Float(200704,1:4,3584,64) ***************
[05/26/2023-15:30:24] [V] [TRT] *************** Autotuning Reformat: Float(200704,1:4,3584,64) -> Float(802816,3136,56,1) ***************
[05/26/2023-15:30:24] [V] [TRT] =============== Computing reformatting costs: 
[05/26/2023-15:30:24] [V] [TRT] *************** Autotuning Reformat: Float(200704,784,28,1) -> Float(200704,1,7168,256) ***************
[05/26/2023-15:30:24] [V] [TRT] --------------- Timing Runner: Optimizer Reformat(/features/features.16/MaxPool_output_0 -> <out>) (Reformat)
[05/26/2023-15:30:24] [V] [TRT] Tactic: 0x00000000000003e8 Time: 0.00602724
[05/26/2023-15:30:24] [V] [TRT] Tactic: 0x00000000000003ea Time: 0.00589239
[05/26/2023-15:30:24] [V] [TRT] Tactic: 0x0000000000000000 Time: 0.00605219
[05/26/2023-15:30:24] [V] [TRT] Fastest Tactic: 0x00000000000003ea Time: 0.00589239
[05/26/2023-15:30:24] [V] [TRT] *************** Autotuning Reformat: Float(200704,784,28,1) -> Float(50176,1:4,1792,64) ***************
[05/26/2023-15:30:24] [V] [TRT] --------------- Timing Runner: Optimizer Reformat(/features/features.16/MaxPool_output_0 -> <out>) (Reformat)
[05/26/2023-15:30:24] [V] [TRT] Tactic: 0x00000000000003e8 Time: 0.00615352
[05/26/2023-15:30:24] [V] [TRT] Tactic: 0x00000000000003ea Time: 0.00587922
[05/26/2023-15:30:24] [V] [TRT] Tactic: 0x0000000000000000 Time: 0.00614514
[05/26/2023-15:30:24] [V] [TRT] Fastest Tactic: 0x00000000000003ea Time: 0.00587922
[05/26/2023-15:30:24] [V] [TRT] *************** Autotuning Reformat: Float(200704,1,7168,256) -> Float(200704,784,28,1) ***************
[05/26/2023-15:30:24] [V] [TRT] --------------- Timing Runner: Optimizer Reformat(/features/features.16/MaxPool_output_0 -> <out>) (Reformat)
[05/26/2023-15:30:24] [V] [TRT] Tactic: 0x00000000000003e8 Time: 0.00564132
[05/26/2023-15:30:24] [V] [TRT] Tactic: 0x00000000000003ea Time: 0.00673475
[05/26/2023-15:30:24] [V] [TRT] Tactic: 0x0000000000000000 Time: 0.00564659
[05/26/2023-15:30:24] [V] [TRT] Fastest Tactic: 0x00000000000003e8 Time: 0.00564132
[05/26/2023-15:30:24] [V] [TRT] *************** Autotuning Reformat: Float(200704,1,7168,256) -> Float(50176,1:4,1792,64) ***************
[05/26/2023-15:30:24] [V] [TRT] --------------- Timing Runner: Optimizer Reformat(/features/features.16/MaxPool_output_0 -> <out>) (Reformat)
[05/26/2023-15:30:24] [V] [TRT] Tactic: 0x00000000000003e8 Time: 0.00407479
[05/26/2023-15:30:24] [V] [TRT] Tactic: 0x00000000000003ea Time: 0.0057062
[05/26/2023-15:30:24] [V] [TRT] Tactic: 0x0000000000000000 Time: 0.00410606
[05/26/2023-15:30:24] [V] [TRT] Fastest Tactic: 0x00000000000003e8 Time: 0.00407479
[05/26/2023-15:30:24] [V] [TRT] *************** Autotuning Reformat: Float(50176,1:4,1792,64) -> Float(200704,784,28,1) ***************
[05/26/2023-15:30:24] [V] [TRT] --------------- Timing Runner: Optimizer Reformat(/features/features.16/MaxPool_output_0 -> <out>) (Reformat)
[05/26/2023-15:30:24] [V] [TRT] Tactic: 0x00000000000003e8 Time: 0.00565574
[05/26/2023-15:30:24] [V] [TRT] Tactic: 0x00000000000003ea Time: 0.00672416
[05/26/2023-15:30:24] [V] [TRT] Tactic: 0x0000000000000000 Time: 0.00566488
[05/26/2023-15:30:24] [V] [TRT] Fastest Tactic: 0x00000000000003e8 Time: 0.00565574
[05/26/2023-15:30:24] [V] [TRT] *************** Autotuning Reformat: Float(50176,1:4,1792,64) -> Float(200704,1,7168,256) ***************
[05/26/2023-15:30:24] [V] [TRT] --------------- Timing Runner: Optimizer Reformat(/features/features.16/MaxPool_output_0 -> <out>) (Reformat)
[05/26/2023-15:30:24] [V] [TRT] Tactic: 0x00000000000003e8 Time: 0.00412173
[05/26/2023-15:30:24] [V] [TRT] Tactic: 0x00000000000003ea Time: 0.00569776
[05/26/2023-15:30:24] [V] [TRT] Tactic: 0x0000000000000000 Time: 0.00409352
[05/26/2023-15:30:24] [V] [TRT] Fastest Tactic: 0x0000000000000000 Time: 0.00409352
[05/26/2023-15:30:24] [V] [TRT] =============== Computing reformatting costs: 
[05/26/2023-15:30:24] [V] [TRT] *************** Autotuning Reformat: Float(401408,784,28,1) -> Float(401408,1,14336,512) ***************
[05/26/2023-15:30:24] [V] [TRT] --------------- Timing Runner: Optimizer Reformat(/features/features.18/Relu_output_0 -> <out>) (Reformat)
[05/26/2023-15:30:24] [V] [TRT] Tactic: 0x00000000000003e8 Time: 0.00932486
[05/26/2023-15:30:24] [V] [TRT] Tactic: 0x00000000000003ea Time: 0.00642325
[05/26/2023-15:30:24] [V] [TRT] Tactic: 0x0000000000000000 Time: 0.00934743
[05/26/2023-15:30:24] [V] [TRT] Fastest Tactic: 0x00000000000003ea Time: 0.00642325
[05/26/2023-15:30:24] [V] [TRT] *************** Autotuning Reformat: Float(401408,784,28,1) -> Float(100352,1:4,3584,128) ***************
[05/26/2023-15:30:24] [V] [TRT] --------------- Timing Runner: Optimizer Reformat(/features/features.18/Relu_output_0 -> <out>) (Reformat)
[05/26/2023-15:30:24] [V] [TRT] Tactic: 0x00000000000003e8 Time: 0.00942686
[05/26/2023-15:30:24] [V] [TRT] Tactic: 0x00000000000003ea Time: 0.00642047
[05/26/2023-15:30:24] [V] [TRT] Tactic: 0x0000000000000000 Time: 0.009444
[05/26/2023-15:30:24] [V] [TRT] Fastest Tactic: 0x00000000000003ea Time: 0.00642047
[05/26/2023-15:30:24] [V] [TRT] *************** Autotuning Reformat: Float(401408,1,14336,512) -> Float(401408,784,28,1) ***************
[05/26/2023-15:30:24] [V] [TRT] --------------- Timing Runner: Optimizer Reformat(/features/features.18/Relu_output_0 -> <out>) (Reformat)
[05/26/2023-15:30:24] [V] [TRT] Tactic: 0x00000000000003e8 Time: 0.00904114
[05/26/2023-15:30:24] [V] [TRT] Tactic: 0x00000000000003ea Time: 0.00753516
[05/26/2023-15:30:24] [V] [TRT] Tactic: 0x0000000000000000 Time: 0.00898743
[05/26/2023-15:30:24] [V] [TRT] Fastest Tactic: 0x00000000000003ea Time: 0.00753516
[05/26/2023-15:30:24] [V] [TRT] *************** Autotuning Reformat: Float(401408,1,14336,512) -> Float(100352,1:4,3584,128) ***************
[05/26/2023-15:30:24] [V] [TRT] --------------- Timing Runner: Optimizer Reformat(/features/features.18/Relu_output_0 -> <out>) (Reformat)
[05/26/2023-15:30:24] [V] [TRT] Tactic: 0x00000000000003e8 Time: 0.00583717
[05/26/2023-15:30:24] [V] [TRT] Tactic: 0x00000000000003ea Time: 0.00618
[05/26/2023-15:30:24] [V] [TRT] Tactic: 0x0000000000000000 Time: 0.0058496
[05/26/2023-15:30:24] [V] [TRT] Fastest Tactic: 0x00000000000003e8 Time: 0.00583717
[05/26/2023-15:30:24] [V] [TRT] *************** Autotuning Reformat: Float(100352,1:4,3584,128) -> Float(401408,784,28,1) ***************
[05/26/2023-15:30:24] [V] [TRT] --------------- Timing Runner: Optimizer Reformat(/features/features.18/Relu_output_0 -> <out>) (Reformat)
[05/26/2023-15:30:24] [V] [TRT] Tactic: 0x00000000000003e8 Time: 0.009102
[05/26/2023-15:30:24] [V] [TRT] Tactic: 0x00000000000003ea Time: 0.00756114
[05/26/2023-15:30:24] [V] [TRT] Tactic: 0x0000000000000000 Time: 0.00909714
[05/26/2023-15:30:24] [V] [TRT] Fastest Tactic: 0x00000000000003ea Time: 0.00756114
[05/26/2023-15:30:24] [V] [TRT] *************** Autotuning Reformat: Float(100352,1:4,3584,128) -> Float(401408,1,14336,512) ***************
[05/26/2023-15:30:24] [V] [TRT] --------------- Timing Runner: Optimizer Reformat(/features/features.18/Relu_output_0 -> <out>) (Reformat)
[05/26/2023-15:30:24] [V] [TRT] Tactic: 0x00000000000003e8 Time: 0.00584064
[05/26/2023-15:30:24] [V] [TRT] Tactic: 0x00000000000003ea Time: 0.00619962
[05/26/2023-15:30:24] [V] [TRT] Tactic: 0x0000000000000000 Time: 0.00584558
[05/26/2023-15:30:24] [V] [TRT] Fastest Tactic: 0x00000000000003e8 Time: 0.00584064
[05/26/2023-15:30:24] [V] [TRT] =============== Computing reformatting costs: 
[05/26/2023-15:30:24] [V] [TRT] *************** Autotuning Reformat: Float(401408,784,28,1) -> Float(401408,1,14336,512) ***************
[05/26/2023-15:30:24] [V] [TRT] *************** Autotuning Reformat: Float(401408,784,28,1) -> Float(100352,1:4,3584,128) ***************
[05/26/2023-15:30:24] [V] [TRT] *************** Autotuning Reformat: Float(401408,1,14336,512) -> Float(401408,784,28,1) ***************
[05/26/2023-15:30:24] [V] [TRT] *************** Autotuning Reformat: Float(401408,1,14336,512) -> Float(100352,1:4,3584,128) ***************
[05/26/2023-15:30:24] [V] [TRT] *************** Autotuning Reformat: Float(100352,1:4,3584,128) -> Float(401408,784,28,1) ***************
[05/26/2023-15:30:24] [V] [TRT] *************** Autotuning Reformat: Float(100352,1:4,3584,128) -> Float(401408,1,14336,512) ***************
[05/26/2023-15:30:24] [V] [TRT] =============== Computing reformatting costs: 
[05/26/2023-15:30:24] [V] [TRT] *************** Autotuning Reformat: Float(401408,784,28,1) -> Float(100352,1:4,3584,128) ***************
[05/26/2023-15:30:24] [V] [TRT] *************** Autotuning Reformat: Float(401408,1,14336,512) -> Float(401408,784,28,1) ***************
[05/26/2023-15:30:24] [V] [TRT] *************** Autotuning Reformat: Float(401408,1,14336,512) -> Float(100352,1:4,3584,128) ***************
[05/26/2023-15:30:24] [V] [TRT] *************** Autotuning Reformat: Float(100352,1:4,3584,128) -> Float(401408,784,28,1) ***************
[05/26/2023-15:30:24] [V] [TRT] =============== Computing reformatting costs: 
[05/26/2023-15:30:24] [V] [TRT] *************** Autotuning Reformat: Float(100352,196,14,1) -> Float(100352,1,7168,512) ***************
[05/26/2023-15:30:24] [V] [TRT] --------------- Timing Runner: Optimizer Reformat(/features/features.23/MaxPool_output_0 -> <out>) (Reformat)
[05/26/2023-15:30:24] [V] [TRT] Tactic: 0x00000000000003e8 Time: 0.00409926
[05/26/2023-15:30:24] [V] [TRT] Tactic: 0x00000000000003ea Time: 0.00586386
[05/26/2023-15:30:24] [V] [TRT] Tactic: 0x0000000000000000 Time: 0.00406921
[05/26/2023-15:30:24] [V] [TRT] Fastest Tactic: 0x0000000000000000 Time: 0.00406921
[05/26/2023-15:30:24] [V] [TRT] *************** Autotuning Reformat: Float(100352,196,14,1) -> Float(25088,1:4,1792,128) ***************
[05/26/2023-15:30:24] [V] [TRT] --------------- Timing Runner: Optimizer Reformat(/features/features.23/MaxPool_output_0 -> <out>) (Reformat)
[05/26/2023-15:30:24] [V] [TRT] Tactic: 0x00000000000003e8 Time: 0.00414733
[05/26/2023-15:30:24] [V] [TRT] Tactic: 0x00000000000003ea Time: 0.00585088
[05/26/2023-15:30:24] [V] [TRT] Tactic: 0x0000000000000000 Time: 0.00416757
[05/26/2023-15:30:24] [V] [TRT] Fastest Tactic: 0x00000000000003e8 Time: 0.00414733
[05/26/2023-15:30:24] [V] [TRT] *************** Autotuning Reformat: Float(100352,1,7168,512) -> Float(100352,196,14,1) ***************
[05/26/2023-15:30:24] [V] [TRT] --------------- Timing Runner: Optimizer Reformat(/features/features.23/MaxPool_output_0 -> <out>) (Reformat)
[05/26/2023-15:30:24] [V] [TRT] Tactic: 0x00000000000003e8 Time: 0.00380848
[05/26/2023-15:30:24] [V] [TRT] Tactic: 0x00000000000003ea Time: 0.0064803
[05/26/2023-15:30:24] [V] [TRT] Tactic: 0x0000000000000000 Time: 0.00381281
[05/26/2023-15:30:24] [V] [TRT] Fastest Tactic: 0x00000000000003e8 Time: 0.00380848
[05/26/2023-15:30:24] [V] [TRT] *************** Autotuning Reformat: Float(100352,1,7168,512) -> Float(25088,1:4,1792,128) ***************
[05/26/2023-15:30:24] [V] [TRT] --------------- Timing Runner: Optimizer Reformat(/features/features.23/MaxPool_output_0 -> <out>) (Reformat)
[05/26/2023-15:30:24] [V] [TRT] Tactic: 0x00000000000003e8 Time: 0.00304185
[05/26/2023-15:30:24] [V] [TRT] Tactic: 0x00000000000003ea Time: 0.00574025
[05/26/2023-15:30:24] [V] [TRT] Tactic: 0x0000000000000000 Time: 0.00304331
[05/26/2023-15:30:24] [V] [TRT] Fastest Tactic: 0x00000000000003e8 Time: 0.00304185
[05/26/2023-15:30:24] [V] [TRT] *************** Autotuning Reformat: Float(25088,1:4,1792,128) -> Float(100352,196,14,1) ***************
[05/26/2023-15:30:24] [V] [TRT] --------------- Timing Runner: Optimizer Reformat(/features/features.23/MaxPool_output_0 -> <out>) (Reformat)
[05/26/2023-15:30:24] [V] [TRT] Tactic: 0x00000000000003e8 Time: 0.00385167
[05/26/2023-15:30:24] [V] [TRT] Tactic: 0x00000000000003ea Time: 0.00638986
[05/26/2023-15:30:24] [V] [TRT] Tactic: 0x0000000000000000 Time: 0.00382785
[05/26/2023-15:30:24] [V] [TRT] Fastest Tactic: 0x0000000000000000 Time: 0.00382785
[05/26/2023-15:30:24] [V] [TRT] *************** Autotuning Reformat: Float(25088,1:4,1792,128) -> Float(100352,1,7168,512) ***************
[05/26/2023-15:30:24] [V] [TRT] --------------- Timing Runner: Optimizer Reformat(/features/features.23/MaxPool_output_0 -> <out>) (Reformat)
[05/26/2023-15:30:24] [V] [TRT] Tactic: 0x00000000000003e8 Time: 0.0030684
[05/26/2023-15:30:24] [V] [TRT] Tactic: 0x00000000000003ea Time: 0.00572873
[05/26/2023-15:30:24] [V] [TRT] Tactic: 0x0000000000000000 Time: 0.00307122
[05/26/2023-15:30:24] [V] [TRT] Fastest Tactic: 0x00000000000003e8 Time: 0.0030684
[05/26/2023-15:30:24] [V] [TRT] =============== Computing reformatting costs: 
[05/26/2023-15:30:24] [V] [TRT] *************** Autotuning Reformat: Float(100352,196,14,1) -> Float(100352,1,7168,512) ***************
[05/26/2023-15:30:24] [V] [TRT] *************** Autotuning Reformat: Float(100352,196,14,1) -> Float(25088,1:4,1792,128) ***************
[05/26/2023-15:30:24] [V] [TRT] *************** Autotuning Reformat: Float(100352,1,7168,512) -> Float(100352,196,14,1) ***************
[05/26/2023-15:30:24] [V] [TRT] *************** Autotuning Reformat: Float(100352,1,7168,512) -> Float(25088,1:4,1792,128) ***************
[05/26/2023-15:30:24] [V] [TRT] *************** Autotuning Reformat: Float(25088,1:4,1792,128) -> Float(100352,196,14,1) ***************
[05/26/2023-15:30:24] [V] [TRT] *************** Autotuning Reformat: Float(25088,1:4,1792,128) -> Float(100352,1,7168,512) ***************
[05/26/2023-15:30:24] [V] [TRT] =============== Computing reformatting costs: 
[05/26/2023-15:30:24] [V] [TRT] *************** Autotuning Reformat: Float(100352,196,14,1) -> Float(100352,1,7168,512) ***************
[05/26/2023-15:30:24] [V] [TRT] *************** Autotuning Reformat: Float(100352,196,14,1) -> Float(25088,1:4,1792,128) ***************
[05/26/2023-15:30:24] [V] [TRT] *************** Autotuning Reformat: Float(100352,1,7168,512) -> Float(100352,196,14,1) ***************
[05/26/2023-15:30:24] [V] [TRT] *************** Autotuning Reformat: Float(100352,1,7168,512) -> Float(25088,1:4,1792,128) ***************
[05/26/2023-15:30:24] [V] [TRT] *************** Autotuning Reformat: Float(25088,1:4,1792,128) -> Float(100352,196,14,1) ***************
[05/26/2023-15:30:24] [V] [TRT] *************** Autotuning Reformat: Float(25088,1:4,1792,128) -> Float(100352,1,7168,512) ***************
[05/26/2023-15:30:24] [V] [TRT] =============== Computing reformatting costs: 
[05/26/2023-15:30:24] [V] [TRT] *************** Autotuning Reformat: Float(100352,196,14,1) -> Float(25088,1:4,1792,128) ***************
[05/26/2023-15:30:24] [V] [TRT] *************** Autotuning Reformat: Float(100352,1,7168,512) -> Float(100352,196,14,1) ***************
[05/26/2023-15:30:24] [V] [TRT] *************** Autotuning Reformat: Float(100352,1,7168,512) -> Float(25088,1:4,1792,128) ***************
[05/26/2023-15:30:24] [V] [TRT] *************** Autotuning Reformat: Float(25088,1:4,1792,128) -> Float(100352,196,14,1) ***************
[05/26/2023-15:30:24] [V] [TRT] =============== Computing reformatting costs: 
[05/26/2023-15:30:24] [V] [TRT] *************** Autotuning Reformat: Float(25088,49,7,1) -> Float(6272,1:4,896,128) ***************
[05/26/2023-15:30:24] [V] [TRT] --------------- Timing Runner: Optimizer Reformat(/features/features.30/MaxPool_output_0 -> <out>) (Reformat)
[05/26/2023-15:30:24] [V] [TRT] Tactic: 0x00000000000003e8 Time: 0.00278567
[05/26/2023-15:30:24] [V] [TRT] Tactic: 0x00000000000003ea Time: 0.00579675
[05/26/2023-15:30:24] [V] [TRT] Tactic: 0x0000000000000000 Time: 0.00279895
[05/26/2023-15:30:24] [V] [TRT] Fastest Tactic: 0x00000000000003e8 Time: 0.00278567
[05/26/2023-15:30:24] [V] [TRT] *************** Autotuning Reformat: Float(6272,1:4,896,128) -> Float(25088,49,7,1) ***************
[05/26/2023-15:30:24] [V] [TRT] --------------- Timing Runner: Optimizer Reformat(/features/features.30/MaxPool_output_0 -> <out>) (Reformat)
[05/26/2023-15:30:24] [V] [TRT] Tactic: 0x00000000000003e8 Time: 0.00267166
[05/26/2023-15:30:24] [V] [TRT] Tactic: 0x00000000000003ea Time: 0.00590574
[05/26/2023-15:30:24] [V] [TRT] Tactic: 0x0000000000000000 Time: 0.00266117
[05/26/2023-15:30:24] [V] [TRT] Fastest Tactic: 0x0000000000000000 Time: 0.00266117
[05/26/2023-15:30:24] [V] [TRT] =============== Computing reformatting costs: 
[05/26/2023-15:30:24] [V] [TRT] *************** Autotuning Reformat: Float(25088,49,7,1) -> Float(25088,1,3584,512) ***************
[05/26/2023-15:30:24] [V] [TRT] --------------- Timing Runner: Optimizer Reformat(/avgpool/AveragePool_output_0 -> <out>) (Reformat)
[05/26/2023-15:30:24] [V] [TRT] Tactic: 0x00000000000003e8 Time: 0.00275613
[05/26/2023-15:30:24] [V] [TRT] Tactic: 0x00000000000003ea Time: 0.00582601
[05/26/2023-15:30:24] [V] [TRT] Tactic: 0x0000000000000000 Time: 0.00275789
[05/26/2023-15:30:24] [V] [TRT] Fastest Tactic: 0x00000000000003e8 Time: 0.00275613
[05/26/2023-15:30:24] [V] [TRT] *************** Autotuning Reformat: Float(25088,49,7,1) -> Float(6272,1:4,896,128) ***************
[05/26/2023-15:30:24] [V] [TRT] *************** Autotuning Reformat: Float(25088,49,7,1) -> Float(784,49:32,7,1) ***************
[05/26/2023-15:30:24] [V] [TRT] --------------- Timing Runner: Optimizer Reformat(/avgpool/AveragePool_output_0 -> <out>) (Reformat)
[05/26/2023-15:30:24] [V] [TRT] Tactic: 0x00000000000003e8 Time: 0.00310589
[05/26/2023-15:30:24] [V] [TRT] Tactic: 0x00000000000003ea Time: 0.00580827
[05/26/2023-15:30:24] [V] [TRT] Tactic: 0x0000000000000000 Time: 0.00308814
[05/26/2023-15:30:24] [V] [TRT] Fastest Tactic: 0x0000000000000000 Time: 0.00308814
[05/26/2023-15:30:24] [V] [TRT] *************** Autotuning Reformat: Float(25088,1,3584,512) -> Float(25088,49,7,1) ***************
[05/26/2023-15:30:24] [V] [TRT] --------------- Timing Runner: Optimizer Reformat(/avgpool/AveragePool_output_0 -> <out>) (Reformat)
[05/26/2023-15:30:24] [V] [TRT] Tactic: 0x00000000000003e8 Time: 0.00263946
[05/26/2023-15:30:24] [V] [TRT] Tactic: 0x00000000000003ea Time: 0.00593335
[05/26/2023-15:30:24] [V] [TRT] Tactic: 0x0000000000000000 Time: 0.00262974
[05/26/2023-15:30:24] [V] [TRT] Fastest Tactic: 0x0000000000000000 Time: 0.00262974
[05/26/2023-15:30:24] [V] [TRT] *************** Autotuning Reformat: Float(25088,1,3584,512) -> Float(6272,1:4,896,128) ***************
[05/26/2023-15:30:24] [V] [TRT] --------------- Timing Runner: Optimizer Reformat(/avgpool/AveragePool_output_0 -> <out>) (Reformat)
[05/26/2023-15:30:24] [V] [TRT] Tactic: 0x00000000000003e8 Time: 0.00247204
[05/26/2023-15:30:24] [V] [TRT] Tactic: 0x00000000000003ea Time: 0.00549282
[05/26/2023-15:30:24] [V] [TRT] Tactic: 0x0000000000000000 Time: 0.00250097
[05/26/2023-15:30:24] [V] [TRT] Fastest Tactic: 0x00000000000003e8 Time: 0.00247204
[05/26/2023-15:30:24] [V] [TRT] *************** Autotuning Reformat: Float(25088,1,3584,512) -> Float(784,49:32,7,1) ***************
[05/26/2023-15:30:24] [V] [TRT] --------------- Timing Runner: Optimizer Reformat(/avgpool/AveragePool_output_0 -> <out>) (Reformat)
[05/26/2023-15:30:24] [V] [TRT] Tactic: 0x00000000000003e8 Time: 0.00317948
[05/26/2023-15:30:24] [V] [TRT] Tactic: 0x00000000000003ea Time: 0.00545591
[05/26/2023-15:30:24] [V] [TRT] Tactic: 0x0000000000000000 Time: 0.00316194
[05/26/2023-15:30:24] [V] [TRT] Fastest Tactic: 0x0000000000000000 Time: 0.00316194
[05/26/2023-15:30:24] [V] [TRT] *************** Autotuning Reformat: Float(6272,1:4,896,128) -> Float(25088,49,7,1) ***************
[05/26/2023-15:30:24] [V] [TRT] *************** Autotuning Reformat: Float(6272,1:4,896,128) -> Float(25088,1,3584,512) ***************
[05/26/2023-15:30:24] [V] [TRT] --------------- Timing Runner: Optimizer Reformat(/avgpool/AveragePool_output_0 -> <out>) (Reformat)
[05/26/2023-15:30:24] [V] [TRT] Tactic: 0x00000000000003e8 Time: 0.00247409
[05/26/2023-15:30:24] [V] [TRT] Tactic: 0x00000000000003ea Time: 0.00546066
[05/26/2023-15:30:24] [V] [TRT] Tactic: 0x0000000000000000 Time: 0.00250262
[05/26/2023-15:30:24] [V] [TRT] Fastest Tactic: 0x00000000000003e8 Time: 0.00247409
[05/26/2023-15:30:24] [V] [TRT] *************** Autotuning Reformat: Float(6272,1:4,896,128) -> Float(784,49:32,7,1) ***************
[05/26/2023-15:30:24] [V] [TRT] --------------- Timing Runner: Optimizer Reformat(/avgpool/AveragePool_output_0 -> <out>) (Reformat)
[05/26/2023-15:30:24] [V] [TRT] Tactic: 0x00000000000003e8 Time: 0.00317436
[05/26/2023-15:30:24] [V] [TRT] Tactic: 0x00000000000003ea Time: 0.00550734
[05/26/2023-15:30:24] [V] [TRT] Tactic: 0x0000000000000000 Time: 0.00319197
[05/26/2023-15:30:24] [V] [TRT] Fastest Tactic: 0x00000000000003e8 Time: 0.00317436
[05/26/2023-15:30:24] [V] [TRT] *************** Autotuning Reformat: Float(784,49:32,7,1) -> Float(25088,49,7,1) ***************
[05/26/2023-15:30:24] [V] [TRT] --------------- Timing Runner: Optimizer Reformat(/avgpool/AveragePool_output_0 -> <out>) (Reformat)
[05/26/2023-15:30:24] [V] [TRT] Tactic: 0x00000000000003e8 Time: 0.00268775
[05/26/2023-15:30:24] [V] [TRT] Tactic: 0x00000000000003ea Time: 0.00593207
[05/26/2023-15:30:24] [V] [TRT] Tactic: 0x0000000000000000 Time: 0.00269096
[05/26/2023-15:30:24] [V] [TRT] Fastest Tactic: 0x00000000000003e8 Time: 0.00268775
[05/26/2023-15:30:24] [V] [TRT] *************** Autotuning Reformat: Float(784,49:32,7,1) -> Float(25088,1,3584,512) ***************
[05/26/2023-15:30:24] [V] [TRT] --------------- Timing Runner: Optimizer Reformat(/avgpool/AveragePool_output_0 -> <out>) (Reformat)
[05/26/2023-15:30:24] [V] [TRT] Tactic: 0x00000000000003e8 Time: 0.00248646
[05/26/2023-15:30:24] [V] [TRT] Tactic: 0x00000000000003ea Time: 0.00549164
[05/26/2023-15:30:24] [V] [TRT] Tactic: 0x0000000000000000 Time: 0.00247945
[05/26/2023-15:30:24] [V] [TRT] Fastest Tactic: 0x0000000000000000 Time: 0.00247945
[05/26/2023-15:30:24] [V] [TRT] *************** Autotuning Reformat: Float(784,49:32,7,1) -> Float(6272,1:4,896,128) ***************
[05/26/2023-15:30:24] [V] [TRT] --------------- Timing Runner: Optimizer Reformat(/avgpool/AveragePool_output_0 -> <out>) (Reformat)
[05/26/2023-15:30:24] [V] [TRT] Tactic: 0x00000000000003e8 Time: 0.00252247
[05/26/2023-15:30:24] [V] [TRT] Tactic: 0x00000000000003ea Time: 0.00550945
[05/26/2023-15:30:24] [V] [TRT] Tactic: 0x0000000000000000 Time: 0.00250875
[05/26/2023-15:30:24] [V] [TRT] Fastest Tactic: 0x0000000000000000 Time: 0.00250875
[05/26/2023-15:30:24] [V] [TRT] =============== Computing reformatting costs: 
[05/26/2023-15:30:24] [V] [TRT] *************** Autotuning Reformat: Float(4096,1,1,1) -> Float(4096,1,4096,4096) ***************
[05/26/2023-15:30:24] [V] [TRT] --------------- Timing Runner: Optimizer Reformat(<in> -> unsqueeze_tensor_after_(Unnamed Layer* 36) [Shuffle]_(Unnamed Layer* 36) [Shuffle]_output_out_tensor) (Reformat)
[05/26/2023-15:30:24] [V] [TRT] Tactic: 0x00000000000003e8 Time: 0.00227265
[05/26/2023-15:30:24] [V] [TRT] Tactic: 0x00000000000003ea Time: 0.00402133
[05/26/2023-15:30:24] [V] [TRT] Tactic: 0x0000000000000000 Time: 0.00225214
[05/26/2023-15:30:24] [V] [TRT] Fastest Tactic: 0x0000000000000000 Time: 0.00225214
[05/26/2023-15:30:24] [V] [TRT] *************** Autotuning Reformat: Float(4096,1,1,1) -> Float(1024,1:4,1024,1024) ***************
[05/26/2023-15:30:24] [V] [TRT] --------------- Timing Runner: Optimizer Reformat(<in> -> unsqueeze_tensor_after_(Unnamed Layer* 36) [Shuffle]_(Unnamed Layer* 36) [Shuffle]_output_out_tensor) (Reformat)
[05/26/2023-15:30:24] [V] [TRT] Tactic: 0x00000000000003e8 Time: 0.00228013
[05/26/2023-15:30:24] [V] [TRT] Tactic: 0x00000000000003ea Time: 0.00566136
[05/26/2023-15:30:24] [V] [TRT] Tactic: 0x0000000000000000 Time: 0.002261
[05/26/2023-15:30:24] [V] [TRT] Fastest Tactic: 0x0000000000000000 Time: 0.002261
[05/26/2023-15:30:24] [V] [TRT] =============== Computing reformatting costs: 
[05/26/2023-15:30:24] [V] [TRT] *************** Autotuning Reformat: Float(25088,1,1,1) -> Float(25088,1,25088,25088) ***************
[05/26/2023-15:30:24] [V] [TRT] --------------- Timing Runner: Optimizer Reformat(reshape_before_/classifier/classifier.0/Gemm_out_tensor -> <out>) (Reformat)
[05/26/2023-15:30:24] [V] [TRT] Tactic: 0x00000000000003e8 Time: 0.00242394
[05/26/2023-15:30:24] [V] [TRT] Tactic: 0x00000000000003ea Time: 0.00408503
[05/26/2023-15:30:24] [V] [TRT] Tactic: 0x0000000000000000 Time: 0.00241867
[05/26/2023-15:30:24] [V] [TRT] Fastest Tactic: 0x0000000000000000 Time: 0.00241867
[05/26/2023-15:30:24] [V] [TRT] *************** Autotuning Reformat: Float(25088,1,1,1) -> Float(6272,1:4,6272,6272) ***************
[05/26/2023-15:30:24] [V] [TRT] --------------- Timing Runner: Optimizer Reformat(reshape_before_/classifier/classifier.0/Gemm_out_tensor -> <out>) (Reformat)
[05/26/2023-15:30:24] [V] [TRT] Tactic: 0x00000000000003e8 Time: 0.00246329
[05/26/2023-15:30:24] [V] [TRT] Tactic: 0x00000000000003ea Time: 0.0122888
[05/26/2023-15:30:24] [V] [TRT] Tactic: 0x0000000000000000 Time: 0.00246245
[05/26/2023-15:30:24] [V] [TRT] Fastest Tactic: 0x0000000000000000 Time: 0.00246245
[05/26/2023-15:30:24] [V] [TRT] *************** Autotuning Reformat: Float(25088,1,25088,25088) -> Float(25088,1,1,1) ***************
[05/26/2023-15:30:24] [V] [TRT] --------------- Timing Runner: Optimizer Reformat(reshape_before_/classifier/classifier.0/Gemm_out_tensor -> <out>) (Reformat)
[05/26/2023-15:30:24] [V] [TRT] Tactic: 0x00000000000003e8 Time: 0.00241478
[05/26/2023-15:30:24] [V] [TRT] Tactic: 0x00000000000003ea Time: 0.00400876
[05/26/2023-15:30:24] [V] [TRT] Tactic: 0x0000000000000000 Time: 0.00242906
[05/26/2023-15:30:24] [V] [TRT] Fastest Tactic: 0x00000000000003e8 Time: 0.00241478
[05/26/2023-15:30:24] [V] [TRT] *************** Autotuning Reformat: Float(25088,1,25088,25088) -> Float(6272,1:4,6272,6272) ***************
[05/26/2023-15:30:24] [V] [TRT] --------------- Timing Runner: Optimizer Reformat(reshape_before_/classifier/classifier.0/Gemm_out_tensor -> <out>) (Reformat)
[05/26/2023-15:30:24] [V] [TRT] Tactic: 0x00000000000003e8 Time: 0.00247708
[05/26/2023-15:30:24] [V] [TRT] Tactic: 0x00000000000003ea Time: 0.0116128
[05/26/2023-15:30:24] [V] [TRT] Tactic: 0x0000000000000000 Time: 0.00247039
[05/26/2023-15:30:24] [V] [TRT] Fastest Tactic: 0x0000000000000000 Time: 0.00247039
[05/26/2023-15:30:24] [V] [TRT] *************** Autotuning Reformat: Float(6272,1:4,6272,6272) -> Float(25088,1,1,1) ***************
[05/26/2023-15:30:24] [V] [TRT] --------------- Timing Runner: Optimizer Reformat(reshape_before_/classifier/classifier.0/Gemm_out_tensor -> <out>) (Reformat)
[05/26/2023-15:30:24] [V] [TRT] Tactic: 0x00000000000003e8 Time: 0.00247086
[05/26/2023-15:30:24] [V] [TRT] Tactic: 0x00000000000003ea Time: 0.0123128
[05/26/2023-15:30:24] [V] [TRT] Tactic: 0x0000000000000000 Time: 0.00248
[05/26/2023-15:30:24] [V] [TRT] Fastest Tactic: 0x00000000000003e8 Time: 0.00247086
[05/26/2023-15:30:24] [V] [TRT] *************** Autotuning Reformat: Float(6272,1:4,6272,6272) -> Float(25088,1,25088,25088) ***************
[05/26/2023-15:30:24] [V] [TRT] --------------- Timing Runner: Optimizer Reformat(reshape_before_/classifier/classifier.0/Gemm_out_tensor -> <out>) (Reformat)
[05/26/2023-15:30:24] [V] [TRT] Tactic: 0x00000000000003e8 Time: 0.00245277
[05/26/2023-15:30:24] [V] [TRT] Tactic: 0x00000000000003ea Time: 0.011635
[05/26/2023-15:30:24] [V] [TRT] Tactic: 0x0000000000000000 Time: 0.00247976
[05/26/2023-15:30:24] [V] [TRT] Fastest Tactic: 0x00000000000003e8 Time: 0.00245277
[05/26/2023-15:30:24] [V] [TRT] *************** Autotuning Reformat: Float(784,1:32,1,1) -> Float(25088,1,1,1) ***************
[05/26/2023-15:30:24] [V] [TRT] --------------- Timing Runner: Optimizer Reformat(reshape_before_/classifier/classifier.0/Gemm_out_tensor -> <out>) (Reformat)
[05/26/2023-15:30:24] [V] [TRT] Tactic: 0x00000000000003e8 Time: 0.00245927
[05/26/2023-15:30:24] [V] [TRT] Tactic: 0x00000000000003ea Time: 0.0122987
[05/26/2023-15:30:24] [V] [TRT] Tactic: 0x0000000000000000 Time: 0.00248
[05/26/2023-15:30:24] [V] [TRT] Fastest Tactic: 0x00000000000003e8 Time: 0.00245927
[05/26/2023-15:30:24] [V] [TRT] *************** Autotuning Reformat: Float(784,1:32,1,1) -> Float(25088,1,25088,25088) ***************
[05/26/2023-15:30:24] [V] [TRT] --------------- Timing Runner: Optimizer Reformat(reshape_before_/classifier/classifier.0/Gemm_out_tensor -> <out>) (Reformat)
[05/26/2023-15:30:24] [V] [TRT] Tactic: 0x00000000000003e8 Time: 0.00246952
[05/26/2023-15:30:24] [V] [TRT] Tactic: 0x00000000000003ea Time: 0.0122891
[05/26/2023-15:30:24] [V] [TRT] Tactic: 0x0000000000000000 Time: 0.00245772
[05/26/2023-15:30:24] [V] [TRT] Fastest Tactic: 0x0000000000000000 Time: 0.00245772
[05/26/2023-15:30:24] [V] [TRT] *************** Autotuning Reformat: Float(784,1:32,1,1) -> Float(6272,1:4,6272,6272) ***************
[05/26/2023-15:30:24] [V] [TRT] --------------- Timing Runner: Optimizer Reformat(reshape_before_/classifier/classifier.0/Gemm_out_tensor -> <out>) (Reformat)
[05/26/2023-15:30:24] [V] [TRT] Tactic: 0x00000000000003e8 Time: 0.00249837
[05/26/2023-15:30:24] [V] [TRT] Tactic: 0x00000000000003ea Time: 0.0122766
[05/26/2023-15:30:24] [V] [TRT] Tactic: 0x0000000000000000 Time: 0.00253121
[05/26/2023-15:30:24] [V] [TRT] Fastest Tactic: 0x00000000000003e8 Time: 0.00249837
[05/26/2023-15:30:24] [V] [TRT] =============== Computing reformatting costs: 
[05/26/2023-15:30:24] [V] [TRT] *************** Autotuning Reformat: Float(4096,1,1,1) -> Float(4096,1,4096,4096) ***************
[05/26/2023-15:30:24] [V] [TRT] --------------- Timing Runner: Optimizer Reformat(unsqueeze_tensor_after_(Unnamed Layer* 36) [Shuffle]_(Unnamed Layer* 36) [Shuffle]_output_out_tensor -> <out>) (Reformat)
[05/26/2023-15:30:24] [V] [TRT] Tactic: 0x00000000000003e8 Time: 0.00226214
[05/26/2023-15:30:24] [V] [TRT] Tactic: 0x00000000000003ea Time: 0.00405282
[05/26/2023-15:30:24] [V] [TRT] Tactic: 0x0000000000000000 Time: 0.00226171
[05/26/2023-15:30:24] [V] [TRT] Fastest Tactic: 0x0000000000000000 Time: 0.00226171
[05/26/2023-15:30:24] [V] [TRT] *************** Autotuning Reformat: Float(4096,1,1,1) -> Float(1024,1:4,1024,1024) ***************
[05/26/2023-15:30:24] [V] [TRT] --------------- Timing Runner: Optimizer Reformat(unsqueeze_tensor_after_(Unnamed Layer* 36) [Shuffle]_(Unnamed Layer* 36) [Shuffle]_output_out_tensor -> <out>) (Reformat)
[05/26/2023-15:30:24] [V] [TRT] Tactic: 0x00000000000003e8 Time: 0.00230088
[05/26/2023-15:30:24] [V] [TRT] Tactic: 0x00000000000003ea Time: 0.00564941
[05/26/2023-15:30:24] [V] [TRT] Tactic: 0x0000000000000000 Time: 0.00226386
[05/26/2023-15:30:24] [V] [TRT] Fastest Tactic: 0x0000000000000000 Time: 0.00226386
[05/26/2023-15:30:24] [V] [TRT] *************** Autotuning Reformat: Float(4096,1,4096,4096) -> Float(4096,1,1,1) ***************
[05/26/2023-15:30:24] [V] [TRT] --------------- Timing Runner: Optimizer Reformat(unsqueeze_tensor_after_(Unnamed Layer* 36) [Shuffle]_(Unnamed Layer* 36) [Shuffle]_output_out_tensor -> <out>) (Reformat)
[05/26/2023-15:30:24] [V] [TRT] Tactic: 0x00000000000003e8 Time: 0.00224621
[05/26/2023-15:30:24] [V] [TRT] Tactic: 0x00000000000003ea Time: 0.00402286
[05/26/2023-15:30:24] [V] [TRT] Tactic: 0x0000000000000000 Time: 0.00225886
[05/26/2023-15:30:24] [V] [TRT] Fastest Tactic: 0x00000000000003e8 Time: 0.00224621
[05/26/2023-15:30:24] [V] [TRT] *************** Autotuning Reformat: Float(4096,1,4096,4096) -> Float(1024,1:4,1024,1024) ***************
[05/26/2023-15:30:24] [V] [TRT] --------------- Timing Runner: Optimizer Reformat(unsqueeze_tensor_after_(Unnamed Layer* 36) [Shuffle]_(Unnamed Layer* 36) [Shuffle]_output_out_tensor -> <out>) (Reformat)
[05/26/2023-15:30:24] [V] [TRT] Tactic: 0x00000000000003e8 Time: 0.00226864
[05/26/2023-15:30:24] [V] [TRT] Tactic: 0x00000000000003ea Time: 0.00534789
[05/26/2023-15:30:24] [V] [TRT] Tactic: 0x0000000000000000 Time: 0.00228005
[05/26/2023-15:30:24] [V] [TRT] Fastest Tactic: 0x00000000000003e8 Time: 0.00226864
[05/26/2023-15:30:24] [V] [TRT] *************** Autotuning Reformat: Float(1024,1:4,1024,1024) -> Float(4096,1,1,1) ***************
[05/26/2023-15:30:24] [V] [TRT] --------------- Timing Runner: Optimizer Reformat(unsqueeze_tensor_after_(Unnamed Layer* 36) [Shuffle]_(Unnamed Layer* 36) [Shuffle]_output_out_tensor -> <out>) (Reformat)
[05/26/2023-15:30:24] [V] [TRT] Tactic: 0x00000000000003e8 Time: 0.00225157
[05/26/2023-15:30:24] [V] [TRT] Tactic: 0x00000000000003ea Time: 0.00563358
[05/26/2023-15:30:24] [V] [TRT] Tactic: 0x0000000000000000 Time: 0.00228361
[05/26/2023-15:30:24] [V] [TRT] Fastest Tactic: 0x00000000000003e8 Time: 0.00225157
[05/26/2023-15:30:24] [V] [TRT] *************** Autotuning Reformat: Float(1024,1:4,1024,1024) -> Float(4096,1,4096,4096) ***************
[05/26/2023-15:30:24] [V] [TRT] --------------- Timing Runner: Optimizer Reformat(unsqueeze_tensor_after_(Unnamed Layer* 36) [Shuffle]_(Unnamed Layer* 36) [Shuffle]_output_out_tensor -> <out>) (Reformat)
[05/26/2023-15:30:24] [V] [TRT] Tactic: 0x00000000000003e8 Time: 0.00225907
[05/26/2023-15:30:24] [V] [TRT] Tactic: 0x00000000000003ea Time: 0.00532588
[05/26/2023-15:30:24] [V] [TRT] Tactic: 0x0000000000000000 Time: 0.00227701
[05/26/2023-15:30:24] [V] [TRT] Fastest Tactic: 0x00000000000003e8 Time: 0.00225907
[05/26/2023-15:30:24] [V] [TRT] =============== Computing reformatting costs: 
[05/26/2023-15:30:24] [V] [TRT] *************** Autotuning Reformat: Float(4096,1,1,1) -> Float(4096,1,4096,4096) ***************
[05/26/2023-15:30:24] [V] [TRT] *************** Autotuning Reformat: Float(4096,1,1,1) -> Float(1024,1:4,1024,1024) ***************
[05/26/2023-15:30:24] [V] [TRT] *************** Autotuning Reformat: Float(4096,1,4096,4096) -> Float(4096,1,1,1) ***************
[05/26/2023-15:30:24] [V] [TRT] *************** Autotuning Reformat: Float(4096,1,4096,4096) -> Float(1024,1:4,1024,1024) ***************
[05/26/2023-15:30:24] [V] [TRT] *************** Autotuning Reformat: Float(1024,1:4,1024,1024) -> Float(4096,1,1,1) ***************
[05/26/2023-15:30:24] [V] [TRT] *************** Autotuning Reformat: Float(1024,1:4,1024,1024) -> Float(4096,1,4096,4096) ***************
[05/26/2023-15:30:24] [V] [TRT] =============== Computing reformatting costs: 
[05/26/2023-15:30:24] [V] [TRT] *************** Autotuning Reformat: Float(4096,1,1,1) -> Float(4096,1,4096,4096) ***************
[05/26/2023-15:30:24] [V] [TRT] *************** Autotuning Reformat: Float(4096,1,1,1) -> Float(1024,1:4,1024,1024) ***************
[05/26/2023-15:30:24] [V] [TRT] *************** Autotuning Reformat: Float(4096,1,4096,4096) -> Float(4096,1,1,1) ***************
[05/26/2023-15:30:24] [V] [TRT] *************** Autotuning Reformat: Float(4096,1,4096,4096) -> Float(1024,1:4,1024,1024) ***************
[05/26/2023-15:30:24] [V] [TRT] *************** Autotuning Reformat: Float(1024,1:4,1024,1024) -> Float(4096,1,1,1) ***************
[05/26/2023-15:30:24] [V] [TRT] *************** Autotuning Reformat: Float(1024,1:4,1024,1024) -> Float(4096,1,4096,4096) ***************
[05/26/2023-15:30:24] [V] [TRT] =============== Computing reformatting costs: 
[05/26/2023-15:30:24] [V] [TRT] *************** Autotuning Reformat: Float(1000,1,1000,1000) -> Float(1000,1,1,1) ***************
[05/26/2023-15:30:24] [V] [TRT] --------------- Timing Runner: Optimizer Reformat(/classifier/classifier.6/Gemm_out_tensor -> <out>) (Reformat)
[05/26/2023-15:30:24] [V] [TRT] Tactic: 0x00000000000003e8 Time: 0.00225943
[05/26/2023-15:30:24] [V] [TRT] Tactic: 0x00000000000003ea Time: 0.00403543
[05/26/2023-15:30:24] [V] [TRT] Tactic: 0x0000000000000000 Time: 0.00227156
[05/26/2023-15:30:24] [V] [TRT] Fastest Tactic: 0x00000000000003e8 Time: 0.00225943
[05/26/2023-15:30:24] [V] [TRT] *************** Autotuning Reformat: Float(250,1:4,250,250) -> Float(1000,1,1,1) ***************
[05/26/2023-15:30:24] [V] [TRT] --------------- Timing Runner: Optimizer Reformat(/classifier/classifier.6/Gemm_out_tensor -> <out>) (Reformat)
[05/26/2023-15:30:24] [V] [TRT] Tactic: 0x00000000000003e8 Time: 0.00230444
[05/26/2023-15:30:24] [V] [TRT] Tactic: 0x00000000000003ea Time: 0.00555024
[05/26/2023-15:30:24] [V] [TRT] Tactic: 0x0000000000000000 Time: 0.00225864
[05/26/2023-15:30:24] [V] [TRT] Fastest Tactic: 0x0000000000000000 Time: 0.00225864
[05/26/2023-15:30:24] [V] [TRT] =============== Computing costs for 
[05/26/2023-15:30:24] [V] [TRT] *************** Autotuning format combination: Float(150528,50176,224,1) -> Float(3211264,50176,224,1) ***************
[05/26/2023-15:30:24] [V] [TRT] --------------- Timing Runner: /features/features.0/Conv + /features/features.1/Relu (CudaDepthwiseConvolution)
[05/26/2023-15:30:24] [V] [TRT] CudaDepthwiseConvolution has no valid tactics for this config, skipping
[05/26/2023-15:30:24] [V] [TRT] --------------- Timing Runner: /features/features.0/Conv + /features/features.1/Relu (FusedConvActConvolution)
[05/26/2023-15:30:24] [V] [TRT] Tactic: 0x000000000007ffff Time: 0.126318
[05/26/2023-15:30:24] [V] [TRT] Fastest Tactic: 0x000000000007ffff Time: 0.126318
[05/26/2023-15:30:24] [V] [TRT] --------------- Timing Runner: /features/features.0/Conv + /features/features.1/Relu (CudnnConvolution)
[05/26/2023-15:30:24] [V] [TRT] Tactic: 0x0000000000000000 Time: 0.120759
[05/26/2023-15:30:24] [V] [TRT] Tactic: 0x0000000000000001 Time: 0.11403
[05/26/2023-15:30:24] [V] [TRT] Tactic: 0x0000000000000002 Time: 0.141225
[05/26/2023-15:30:24] [V] [TRT] Tactic: 0x0000000000000004 Time: 0.731575
[05/26/2023-15:30:24] [V] [TRT] Tactic: 0x0000000000000005 Time: 0.630491
[05/26/2023-15:30:24] [V] [TRT] Tactic: 0x0000000000000006 Time: 0.124855
[05/26/2023-15:30:24] [V] [TRT] Tactic: 0x0000000000000038 Time: 0.120832
[05/26/2023-15:30:24] [V] [TRT] Tactic: 0x0000000000000039 Time: 0.11403
[05/26/2023-15:30:24] [V] [TRT] Tactic: 0x000000000000003a Time: 0.141312
[05/26/2023-15:30:24] [V] [TRT] Tactic: 0x000000000000003c Time: 0.73216
[05/26/2023-15:30:24] [V] [TRT] Tactic: 0x000000000000003d Time: 0.631205
[05/26/2023-15:30:24] [V] [TRT] Tactic: 0x000000000000003e Time: 0.125221
[05/26/2023-15:30:24] [V] [TRT] Tactic: 0x0000000000000070 Time: 0.121061
[05/26/2023-15:30:24] [V] [TRT] Tactic: 0x0000000000000071 Time: 0.114176
[05/26/2023-15:30:24] [V] [TRT] Tactic: 0x0000000000000072 Time: 0.141536
[05/26/2023-15:30:24] [V] [TRT] Tactic: 0x0000000000000074 Time: 0.732014
[05/26/2023-15:30:24] [V] [TRT] Tactic: 0x0000000000000075 Time: 0.631808
[05/26/2023-15:30:24] [V] [TRT] Tactic: 0x0000000000000076 Time: 0.124928
[05/26/2023-15:30:24] [V] [TRT] Fastest Tactic: 0x0000000000000001 Time: 0.11403
[05/26/2023-15:30:24] [V] [TRT] --------------- Timing Runner: /features/features.0/Conv + /features/features.1/Relu (CaskGemmConvolution)
[05/26/2023-15:30:24] [V] [TRT] CaskGemmConvolution has no valid tactics for this config, skipping
[05/26/2023-15:30:24] [V] [TRT] --------------- Timing Runner: /features/features.0/Conv + /features/features.1/Relu (CaskFlattenConvolution)
[05/26/2023-15:30:24] [V] [TRT] CaskFlattenConvolution has no valid tactics for this config, skipping
[05/26/2023-15:30:24] [V] [TRT] --------------- Timing Runner: /features/features.0/Conv + /features/features.1/Relu (CaskConvolution)
[05/26/2023-15:30:24] [V] [TRT] /features/features.0/Conv + /features/features.1/Relu Set Tactic Name: ampere_scudnn_128x32_relu_small_nn_v1 Tactic: 0xa8609adc4e0ceb90
[05/26/2023-15:30:24] [V] [TRT] Tactic: 0xa8609adc4e0ceb90 Time: 0.0326034
[05/26/2023-15:30:24] [V] [TRT] /features/features.0/Conv + /features/features.1/Relu Set Tactic Name: ampere_scudnn_128x64_relu_xregs_large_nn_v1 Tactic: 0x5deb29b7a8e275f7
[05/26/2023-15:30:24] [V] [TRT] Tactic: 0x5deb29b7a8e275f7 Time: 0.033675
[05/26/2023-15:30:24] [V] [TRT] /features/features.0/Conv + /features/features.1/Relu Set Tactic Name: ampere_scudnn_128x64_relu_medium_nn_v1 Tactic: 0xf64396b97c889179
[05/26/2023-15:30:24] [V] [TRT] Tactic: 0xf64396b97c889179 Time: 0.0318135
[05/26/2023-15:30:24] [V] [TRT] /features/features.0/Conv + /features/features.1/Relu Set Tactic Name: ampere_scudnn_128x128_relu_small_nn_v1 Tactic: 0x503619c69ae500ff
[05/26/2023-15:30:24] [V] [TRT] Tactic: 0x503619c69ae500ff Time: 0.0443977
[05/26/2023-15:30:24] [V] [TRT] /features/features.0/Conv + /features/features.1/Relu Set Tactic Name: ampere_scudnn_128x128_relu_xregs_large_nn_v1 Tactic: 0x5403ad713f811a18
[05/26/2023-15:30:24] [V] [TRT] Tactic: 0x5403ad713f811a18 Time: 0.0557714
[05/26/2023-15:30:24] [V] [TRT] /features/features.0/Conv + /features/features.1/Relu Set Tactic Name: ampere_scudnn_winograd_128x128_ldg1_ldg4_relu_tile148t_nt_v1 Tactic: 0x94119b4c514b211a
[05/26/2023-15:30:24] [V] [TRT] Tactic: 0x94119b4c514b211a Time: 0.0424
[05/26/2023-15:30:24] [V] [TRT] /features/features.0/Conv + /features/features.1/Relu Set Tactic Name: sm80_xmma_fprop_implicit_gemm_indexed_f32f32_f32f32_f32_nchwkcrs_nchw_tilesize32x32x8_stage3_warpsize1x2x1_g1_ffma_aligna4_alignc4 Tactic: 0xcb8a43f748d8a338
[05/26/2023-15:30:24] [V] [TRT] Tactic: 0xcb8a43f748d8a338 Time: 0.0498255
[05/26/2023-15:30:24] [V] [TRT] /features/features.0/Conv + /features/features.1/Relu Set Tactic Name: sm80_xmma_fprop_implicit_gemm_indexed_f32f32_f32f32_f32_nchwkcrs_nchw_tilesize64x64x8_stage3_warpsize1x4x1_g1_ffma_aligna4_alignc4 Tactic: 0xd828f024626fa982
[05/26/2023-15:30:24] [V] [TRT] Tactic: 0xd828f024626fa982 Time: 0.04096
[05/26/2023-15:30:24] [V] [TRT] /features/features.0/Conv + /features/features.1/Relu Set Tactic Name: sm80_xmma_fprop_implicit_gemm_f32f32_f32f32_f32_nchwkcrs_nchw_tilesize64x64x8_stage3_warpsize1x4x1_g1_ffma_aligna4_alignc4 Tactic: 0xa31d27de74b895ff
[05/26/2023-15:30:24] [V] [TRT] Tactic: 0xa31d27de74b895ff Time: 0.0380069
[05/26/2023-15:30:24] [V] [TRT] /features/features.0/Conv + /features/features.1/Relu Set Tactic Name: sm80_xmma_fprop_implicit_gemm_indexed_f32f32_f32f32_f32_nchwkcrs_nchw_tilesize128x16x8_stage3_warpsize4x1x1_g1_ffma_aligna4_alignc4 Tactic: 0x40a12e3938221818
[05/26/2023-15:30:24] [V] [TRT] Tactic: 0x40a12e3938221818 Time: 0.069632
