5.2-load-model/models/log/sample/build/build.log
[05/26/2023-18:06:01] [V] [TRT] *************** Autotuning Reformat: Float(10,1,1,1) -> Float(10,1,10,10) ***************
[05/26/2023-18:06:01] [V] [TRT] --------------- Timing Runner: Optimizer Reformat(<in> -> reshape_before_/linear/MatMul_out_tensor) (Reformat)
[05/26/2023-18:06:01] [V] [TRT] Tactic: 0x00000000000003e8 Time: 0.00246013
[05/26/2023-18:06:01] [V] [TRT] Tactic: 0x00000000000003ea Time: 0.00625212
[05/26/2023-18:06:01] [V] [TRT] Tactic: 0x0000000000000000 Time: 0.0024492
[05/26/2023-18:06:01] [V] [TRT] Fastest Tactic: 0x0000000000000000 Time: 0.0024492
[05/26/2023-18:06:01] [V] [TRT] *************** Autotuning Reformat: Float(10,1,1,1) -> Float(3,1:4,3,3) ***************
[05/26/2023-18:06:01] [V] [TRT] --------------- Timing Runner: Optimizer Reformat(<in> -> reshape_before_/linear/MatMul_out_tensor) (Reformat)
[05/26/2023-18:06:01] [V] [TRT] Tactic: 0x00000000000003e8 Time: 0.00260821
[05/26/2023-18:06:01] [V] [TRT] Tactic: 0x00000000000003ea Time: 0.00624934
[05/26/2023-18:06:01] [V] [TRT] Tactic: 0x0000000000000000 Time: 0.00260729
[05/26/2023-18:06:01] [V] [TRT] Fastest Tactic: 0x0000000000000000 Time: 0.00260729
[05/26/2023-18:06:01] [V] [TRT] =============== Computing reformatting costs: 
[05/26/2023-18:06:01] [V] [TRT] *************** Autotuning Reformat: Float(10,1,1,1) -> Float(10,1,10,10) ***************
[05/26/2023-18:06:01] [V] [TRT] --------------- Timing Runner: Optimizer Reformat(reshape_before_/linear/MatMul_out_tensor -> <out>) (Reformat)
[05/26/2023-18:06:01] [V] [TRT] Tactic: 0x00000000000003e8 Time: 0.00245827
[05/26/2023-18:06:01] [V] [TRT] Tactic: 0x00000000000003ea Time: 0.00624974
[05/26/2023-18:06:01] [V] [TRT] Tactic: 0x0000000000000000 Time: 0.00244897
[05/26/2023-18:06:01] [V] [TRT] Fastest Tactic: 0x0000000000000000 Time: 0.00244897
[05/26/2023-18:06:01] [V] [TRT] *************** Autotuning Reformat: Float(10,1,1,1) -> Float(3,1:4,3,3) ***************
[05/26/2023-18:06:01] [V] [TRT] --------------- Timing Runner: Optimizer Reformat(reshape_before_/linear/MatMul_out_tensor -> <out>) (Reformat)
[05/26/2023-18:06:01] [V] [TRT] Tactic: 0x00000000000003e8 Time: 0.00259527
[05/26/2023-18:06:01] [V] [TRT] Tactic: 0x00000000000003ea Time: 0.00625053
[05/26/2023-18:06:01] [V] [TRT] Tactic: 0x0000000000000000 Time: 0.00261037
[05/26/2023-18:06:01] [V] [TRT] Fastest Tactic: 0x00000000000003e8 Time: 0.00259527
[05/26/2023-18:06:01] [V] [TRT] *************** Autotuning Reformat: Float(10,1,10,10) -> Float(10,1,1,1) ***************
[05/26/2023-18:06:01] [V] [TRT] --------------- Timing Runner: Optimizer Reformat(reshape_before_/linear/MatMul_out_tensor -> <out>) (Reformat)
[05/26/2023-18:06:01] [V] [TRT] Tactic: 0x00000000000003e8 Time: 0.00244068
[05/26/2023-18:06:01] [V] [TRT] Tactic: 0x00000000000003ea Time: 0.00627021
[05/26/2023-18:06:01] [V] [TRT] Tactic: 0x0000000000000000 Time: 0.00244099
[05/26/2023-18:06:01] [V] [TRT] Fastest Tactic: 0x00000000000003e8 Time: 0.00244068
[05/26/2023-18:06:01] [V] [TRT] *************** Autotuning Reformat: Float(10,1,10,10) -> Float(3,1:4,3,3) ***************
[05/26/2023-18:06:01] [V] [TRT] --------------- Timing Runner: Optimizer Reformat(reshape_before_/linear/MatMul_out_tensor -> <out>) (Reformat)
[05/26/2023-18:06:01] [V] [TRT] Tactic: 0x00000000000003e8 Time: 0.00262533
[05/26/2023-18:06:01] [V] [TRT] Tactic: 0x00000000000003ea Time: 0.00592091
[05/26/2023-18:06:01] [V] [TRT] Tactic: 0x0000000000000000 Time: 0.00260555
[05/26/2023-18:06:01] [V] [TRT] Fastest Tactic: 0x0000000000000000 Time: 0.00260555
[05/26/2023-18:06:01] [V] [TRT] *************** Autotuning Reformat: Float(3,1:4,3,3) -> Float(10,1,1,1) ***************
[05/26/2023-18:06:01] [V] [TRT] --------------- Timing Runner: Optimizer Reformat(reshape_before_/linear/MatMul_out_tensor -> <out>) (Reformat)
[05/26/2023-18:06:01] [V] [TRT] Tactic: 0x00000000000003e8 Time: 0.00247645
[05/26/2023-18:06:01] [V] [TRT] Tactic: 0x00000000000003ea Time: 0.00626286
[05/26/2023-18:06:01] [V] [TRT] Tactic: 0x0000000000000000 Time: 0.00245494
[05/26/2023-18:06:01] [V] [TRT] Fastest Tactic: 0x0000000000000000 Time: 0.00245494
[05/26/2023-18:06:01] [V] [TRT] *************** Autotuning Reformat: Float(3,1:4,3,3) -> Float(10,1,10,10) ***************
[05/26/2023-18:06:01] [V] [TRT] --------------- Timing Runner: Optimizer Reformat(reshape_before_/linear/MatMul_out_tensor -> <out>) (Reformat)
[05/26/2023-18:06:01] [V] [TRT] Tactic: 0x00000000000003e8 Time: 0.00247921
[05/26/2023-18:06:01] [V] [TRT] Tactic: 0x00000000000003ea Time: 0.00588361
[05/26/2023-18:06:01] [V] [TRT] Tactic: 0x0000000000000000 Time: 0.00246818
[05/26/2023-18:06:01] [V] [TRT] Fastest Tactic: 0x0000000000000000 Time: 0.00246818
[05/26/2023-18:06:01] [V] [TRT] =============== Computing reformatting costs: 
[05/26/2023-18:06:01] [V] [TRT] *************** Autotuning Reformat: Float(5,1,5,5) -> Float(5,1,1,1) ***************
[05/26/2023-18:06:01] [V] [TRT] --------------- Timing Runner: Optimizer Reformat(/linear/MatMul_out_tensor -> <out>) (Reformat)
[05/26/2023-18:06:01] [V] [TRT] Tactic: 0x00000000000003e8 Time: 0.00244881
[05/26/2023-18:06:01] [V] [TRT] Tactic: 0x00000000000003ea Time: 0.00626266
[05/26/2023-18:06:01] [V] [TRT] Tactic: 0x0000000000000000 Time: 0.00245726
[05/26/2023-18:06:01] [V] [TRT] Fastest Tactic: 0x00000000000003e8 Time: 0.00244881
[05/26/2023-18:06:01] [V] [TRT] *************** Autotuning Reformat: Float(2,1:4,2,2) -> Float(5,1,1,1) ***************
[05/26/2023-18:06:01] [V] [TRT] --------------- Timing Runner: Optimizer Reformat(/linear/MatMul_out_tensor -> <out>) (Reformat)
[05/26/2023-18:06:01] [V] [TRT] Tactic: 0x00000000000003e8 Time: 0.00246889
[05/26/2023-18:06:01] [V] [TRT] Tactic: 0x00000000000003ea Time: 0.00627498
[05/26/2023-18:06:01] [V] [TRT] Tactic: 0x0000000000000000 Time: 0.00246912
[05/26/2023-18:06:01] [V] [TRT] Fastest Tactic: 0x00000000000003e8 Time: 0.00246889
[05/26/2023-18:06:01] [V] [TRT] =============== Computing costs for 
[05/26/2023-18:06:01] [V] [TRT] *************** Autotuning format combination: Float(10,1) -> Float(10,1,1,1) ***************
[05/26/2023-18:06:01] [V] [TRT] --------------- Timing Runner: reshape_before_/linear/MatMul (Shuffle)
[05/26/2023-18:06:01] [V] [TRT] Tactic: 0x0000000000000000 Time: 0.00244974
[05/26/2023-18:06:01] [V] [TRT] Tactic: 0x0000000000000001 Time: 0.00948486
[05/26/2023-18:06:01] [V] [TRT] Fastest Tactic: 0x0000000000000000 Time: 0.00244974
[05/26/2023-18:06:01] [V] [TRT] >>>>>>>>>>>>>>> Chose Runner Type: Shuffle Tactic: 0x0000000000000000
[05/26/2023-18:06:01] [V] [TRT] =============== Computing costs for 
[05/26/2023-18:06:01] [V] [TRT] *************** Autotuning format combination: Float(10,1,1,1) -> Float(5,1,1,1) ***************
[05/26/2023-18:06:01] [V] [TRT] --------------- Timing Runner: /linear/MatMul (CudaDepthwiseConvolution)
[05/26/2023-18:06:01] [V] [TRT] CudaDepthwiseConvolution has no valid tactics for this config, skipping
[05/26/2023-18:06:01] [V] [TRT] --------------- Timing Runner: /linear/MatMul (FusedConvActConvolution)
[05/26/2023-18:06:01] [V] [TRT] FusedConvActConvolution has no valid tactics for this config, skipping
[05/26/2023-18:06:01] [V] [TRT] --------------- Timing Runner: /linear/MatMul (CudnnConvolution)
[05/26/2023-18:06:02] [V] [TRT] Tactic: 0x0000000000000000 Time: 0.00369231
[05/26/2023-18:06:02] [V] [TRT] Tactic: 0x0000000000000001 Time: 0.00259135
[05/26/2023-18:06:02] [V] [TRT] Tactic: 0x0000000000000002 Time: 0.00405105
[05/26/2023-18:06:02] [V] [TRT] Tactic: 0x0000000000000004 Time: 0.011309
[05/26/2023-18:06:02] [V] [TRT] Tactic: 0x0000000000000005 Time: 0.0130913
[05/26/2023-18:06:02] [V] [TRT] Tactic: 0x0000000000000038 Time: 0.00321828
[05/26/2023-18:06:02] [V] [TRT] Tactic: 0x0000000000000039 Time: 0.00259396
[05/26/2023-18:06:02] [V] [TRT] Tactic: 0x000000000000003a Time: 0.00405905
[05/26/2023-18:06:02] [V] [TRT] Tactic: 0x000000000000003c Time: 0.0112865
[05/26/2023-18:06:02] [V] [TRT] Tactic: 0x000000000000003d Time: 0.0130959
[05/26/2023-18:06:02] [V] [TRT] Tactic: 0x0000000000000070 Time: 0.00321828
[05/26/2023-18:06:02] [V] [TRT] Tactic: 0x0000000000000071 Time: 0.00322154
[05/26/2023-18:06:02] [V] [TRT] Tactic: 0x0000000000000072 Time: 0.00399441
[05/26/2023-18:06:02] [V] [TRT] Tactic: 0x0000000000000074 Time: 0.011264
[05/26/2023-18:06:02] [V] [TRT] Tactic: 0x0000000000000075 Time: 0.0130602
[05/26/2023-18:06:02] [V] [TRT] Fastest Tactic: 0x0000000000000001 Time: 0.00259135
[05/26/2023-18:06:02] [V] [TRT] --------------- Timing Runner: /linear/MatMul (CublasConvolution)
[05/26/2023-18:06:02] [V] [TRT] Tactic: 0x0000000000000000 Time: 0.00412447
[05/26/2023-18:06:02] [V] [TRT] Tactic: 0x0000000000000001 Time: 0.00346895
[05/26/2023-18:06:02] [V] [TRT] Tactic: 0x0000000000000002 Time: 0.00346014
[05/26/2023-18:06:02] [V] [TRT] Tactic: 0x0000000000000003 Time: 0.00345535
[05/26/2023-18:06:02] [V] [TRT] Fastest Tactic: 0x0000000000000003 Time: 0.00345535
[05/26/2023-18:06:02] [V] [TRT] Unrecognized MMA instruction source format or shape: sm50_xmma_cublas_gemvx_f32f32_f32_f32_tn_n_int32_unit_n_launch_param64x2x1_strided_copyx_unit_stride
[05/26/2023-18:06:02] [V] [TRT] Unrecognized MMA instruction source format or shape: sm50_xmma_cublas_gemvx_f32f32_f32_f32_tn_n_int32_unit_n_launch_param64x2x1_strided_unit_stride
[05/26/2023-18:06:02] [V] [TRT] Unrecognized MMA instruction source format or shape: sm50_xmma_cublas_gemvx_f32f32_f32_f32_tn_n_int32_unit_n_launch_param4x32x32_strided_copyx_unit_stride
[05/26/2023-18:06:02] [V] [TRT] Unrecognized MMA instruction source format or shape: sm50_xmma_cublas_gemvx_f32f32_f32_f32_tn_n_int32_unit_n_launch_param16x32x32_strided_copyx_unit_stride
[05/26/2023-18:06:02] [V] [TRT] Unrecognized MMA instruction source format or shape: sm50_xmma_cublas_gemvx_f32f32_f32_f32_tn_n_int32_unit_n_launch_param4x32x32_strided_unit_stride
[05/26/2023-18:06:02] [V] [TRT] Unrecognized MMA instruction source format or shape: sm50_xmma_cublas_gemvx_f32f32_f32_f32_tn_n_int32_unit_n_launch_param8x32x32_strided_unit_stride
[05/26/2023-18:06:02] [V] [TRT] Unrecognized MMA instruction source format or shape: sm70_xmma_gemm_as_conv1x1_f32f32_f32_f32_tn_n_simt_small_batch_bias_relu
[05/26/2023-18:06:02] [V] [TRT] Unrecognized MMA instruction source format or shape: sm50_xmma_cublas_gemvx_f32f32_f32_f32_tn_n_int32_unit_n_launch_param8x32x32_strided_copyx_unit_stride
[05/26/2023-18:06:02] [V] [TRT] Unrecognized MMA instruction source format or shape: sm50_xmma_cublas_gemvx_f32f32_f32_f32_tn_n_int32_unit_n_launch_param16x32x32_strided_unit_stride
[05/26/2023-18:06:02] [V] [TRT] /linear/MatMul: 24 available tactics, 24 unparsable, 0 pruned, 24 remaining after tactic pruning.
[05/26/2023-18:06:02] [V] [TRT] --------------- Timing Runner: /linear/MatMul (CaskGemmConvolution)
[05/26/2023-18:06:02] [V] [TRT] Set Tactic Name: sm50_xmma_cublas_gemvx_f32f32_f32_f32_tn_n_int32_unit_n_launch_param4x32x32_strided_copyx_unit_stride Tactic: 0x000000000002044a numSplitK: 1 numBuffers: 0 numKernels: 1
[05/26/2023-18:06:02] [V] [TRT] Tactic: 0x000000000002044a Time: 0.00342552
[05/26/2023-18:06:02] [V] [TRT] Set Tactic Name: ampere_sgemm_32x32_sliced1x4_relu_nn_v1 Tactic: 0x00000000000206cc numSplitK: 1 numBuffers: 0 numKernels: 1
[05/26/2023-18:06:02] [V] [TRT] Tactic: 0x00000000000206cc Time: 0.00468586
[05/26/2023-18:06:02] [V] [TRT] Set Tactic Name: ampere_sgemm_128x32_sliced1x4_relu_nn_v1 Tactic: 0x00000000000206aa numSplitK: 1 numBuffers: 0 numKernels: 1
[05/26/2023-18:06:02] [V] [TRT] Tactic: 0x00000000000206aa Time: 0.00637873
[05/26/2023-18:06:02] [V] [TRT] Set Tactic Name: sm50_xmma_cublas_gemvx_f32f32_f32_f32_tn_n_int32_unit_n_launch_param16x32x32_strided_unit_stride Tactic: 0x000000000002068d numSplitK: 1 numBuffers: 0 numKernels: 1
[05/26/2023-18:06:02] [V] [TRT] Tactic: 0x000000000002068d Time: 0.00322225
[05/26/2023-18:06:02] [V] [TRT] Set Tactic Name: ampere_sgemm_32x32_sliced1x4_tn_v1 Tactic: 0x0000000000020688 numSplitK: 1 numBuffers: 0 numKernels: 1
[05/26/2023-18:06:02] [V] [TRT] Tactic: 0x0000000000020688 Time: 0.00434701
[05/26/2023-18:06:02] [V] [TRT] Set Tactic Name: sm80_xmma_gemm_f32f32_f32f32_f32_tn_n_tilesize32x32x8_stage3_warpsize1x2x1_ffma_aligna4_alignc4 Tactic: 0x000000000002065c numSplitK: 1 numBuffers: 0 numKernels: 1
[05/26/2023-18:06:02] [V] [TRT] Tactic: 0x000000000002065c Time: 0.00356427
[05/26/2023-18:06:02] [V] [TRT] Set Tactic Name: sm50_xmma_cublas_gemvx_f32f32_f32_f32_tn_n_int32_unit_n_launch_param8x32x32_strided_copyx_unit_stride Tactic: 0x0000000000020639 numSplitK: 1 numBuffers: 0 numKernels: 1
[05/26/2023-18:06:02] [V] [TRT] Tactic: 0x0000000000020639 Time: 0.00348532
[05/26/2023-18:06:02] [V] [TRT] Set Tactic Name: ampere_sgemm_64x32_sliced1x4_relu_nn_v1 Tactic: 0x0000000000020601 numSplitK: 1 numBuffers: 0 numKernels: 1
[05/26/2023-18:06:02] [V] [TRT] Tactic: 0x0000000000020601 Time: 0.00514824
[05/26/2023-18:06:02] [V] [TRT] Set Tactic Name: sm70_xmma_gemm_as_conv1x1_f32f32_f32_f32_tn_n_simt_small_batch_bias_relu Tactic: 0x00000000000205c0 numSplitK: 1 numBuffers: 0 numKernels: 1
[05/26/2023-18:06:02] [V] [TRT] Tactic: 0x00000000000205c0 Time: 0.0025994
[05/26/2023-18:06:02] [V] [TRT] Set Tactic Name: sm50_xmma_cublas_gemvx_f32f32_f32_f32_tn_n_int32_unit_n_launch_param8x32x32_strided_unit_stride Tactic: 0x00000000000204b2 numSplitK: 1 numBuffers: 0 numKernels: 1
[05/26/2023-18:06:02] [V] [TRT] Tactic: 0x00000000000204b2 Time: 0.00308085
[05/26/2023-18:06:02] [V] [TRT] Set Tactic Name: sm50_xmma_cublas_gemvx_f32f32_f32_f32_tn_n_int32_unit_n_launch_param4x32x32_strided_unit_stride Tactic: 0x0000000000020460 numSplitK: 1 numBuffers: 0 numKernels: 1
[05/26/2023-18:06:02] [V] [TRT] Tactic: 0x0000000000020460 Time: 0.00301448
[05/26/2023-18:06:02] [V] [TRT] Set Tactic Name: sm50_xmma_cublas_gemvx_f32f32_f32_f32_tn_n_int32_unit_n_launch_param16x32x32_strided_copyx_unit_stride Tactic: 0x000000000002045e numSplitK: 1 numBuffers: 0 numKernels: 1
[05/26/2023-18:06:02] [V] [TRT] Tactic: 0x000000000002045e Time: 0.00385636
[05/26/2023-18:06:02] [V] [TRT] Set Tactic Name: ampere_sgemm_64x32_sliced1x4_nn_v1 Tactic: 0x00000000000200b1 numSplitK: 1 numBuffers: 0 numKernels: 1
[05/26/2023-18:06:02] [V] [TRT] Tactic: 0x00000000000200b1 Time: 0.0046689
[05/26/2023-18:06:02] [V] [TRT] Set Tactic Name: sm50_xmma_cublas_gemvx_f32f32_f32_f32_tn_n_int32_unit_n_launch_param64x2x1_strided_unit_stride Tactic: 0x000000000002042a numSplitK: 1 numBuffers: 0 numKernels: 1
[05/26/2023-18:06:02] [V] [TRT] Tactic: 0x000000000002042a Time: 0.00275165
[05/26/2023-18:06:02] [V] [TRT] Set Tactic Name: sm50_xmma_cublas_gemvx_f32f32_f32_f32_tn_n_int32_unit_n_launch_param64x2x1_strided_copyx_unit_stride Tactic: 0x0000000000020419 numSplitK: 1 numBuffers: 0 numKernels: 1
[05/26/2023-18:06:02] [V] [TRT] Tactic: 0x0000000000020419 Time: 0.0030897
[05/26/2023-18:06:02] [V] [TRT] Set Tactic Name: ampere_sgemm_128x32_sliced1x4_tn_v1 Tactic: 0x0000000000020375 numSplitK: 1 numBuffers: 0 numKernels: 1
[05/26/2023-18:06:02] [V] [TRT] Tactic: 0x0000000000020375 Time: 0.00640457
[05/26/2023-18:06:02] [V] [TRT] Set Tactic Name: sm80_xmma_gemm_f32f32_f32f32_f32_tn_n_tilesize128x32x8_stage3_warpsize2x2x1_ffma_aligna4_alignc4 Tactic: 0x000000000002030f numSplitK: 1 numBuffers: 0 numKernels: 1
[05/26/2023-18:06:02] [V] [TRT] Tactic: 0x000000000002030f Time: 0.00432403
[05/26/2023-18:06:02] [V] [TRT] Set Tactic Name: sm80_xmma_gemm_f32f32_f32f32_f32_tn_n_tilesize64x32x8_stage3_warpsize1x2x1_ffma_aligna4_alignc4 Tactic: 0x00000000000202e7 numSplitK: 1 numBuffers: 0 numKernels: 1
[05/26/2023-18:06:02] [V] [TRT] Tactic: 0x00000000000202e7 Time: 0.00397346
[05/26/2023-18:06:02] [V] [TRT] Set Tactic Name: ampere_sgemm_128x32_sliced1x4_nn_v1 Tactic: 0x000000000002021a numSplitK: 1 numBuffers: 0 numKernels: 1
[05/26/2023-18:06:02] [V] [TRT] Tactic: 0x000000000002021a Time: 0.0059581
[05/26/2023-18:06:02] [V] [TRT] Set Tactic Name: ampere_sgemm_32x32_sliced1x4_nn_v1 Tactic: 0x0000000000020201 numSplitK: 1 numBuffers: 0 numKernels: 1
[05/26/2023-18:06:02] [V] [TRT] Tactic: 0x0000000000020201 Time: 0.00434313
[05/26/2023-18:06:02] [V] [TRT] Set Tactic Name: ampere_sgemm_64x32_sliced1x4_tn_v1 Tactic: 0x000000000002019b numSplitK: 1 numBuffers: 0 numKernels: 1
[05/26/2023-18:06:02] [V] [TRT] Tactic: 0x000000000002019b Time: 0.00484968
[05/26/2023-18:06:02] [V] [TRT] Set Tactic Name: ampere_sgemm_64x32_sliced1x4_relu_tn_v1 Tactic: 0x0000000000020174 numSplitK: 1 numBuffers: 0 numKernels: 1
[05/26/2023-18:06:02] [V] [TRT] Tactic: 0x0000000000020174 Time: 0.00529812
[05/26/2023-18:06:02] [V] [TRT] Set Tactic Name: ampere_sgemm_32x32_sliced1x4_relu_tn_v1 Tactic: 0x000000000002014d numSplitK: 1 numBuffers: 0 numKernels: 1
[05/26/2023-18:06:02] [V] [TRT] Tactic: 0x000000000002014d Time: 0.00468321
[05/26/2023-18:06:02] [V] [TRT] Set Tactic Name: ampere_sgemm_128x32_sliced1x4_relu_tn_v1 Tactic: 0x0000000000020145 numSplitK: 1 numBuffers: 0 numKernels: 1
[05/26/2023-18:06:02] [V] [TRT] Tactic: 0x0000000000020145 Time: 0.00677569
[05/26/2023-18:06:02] [V] [TRT] Fastest Tactic: 0x00000000000205c0 Time: 0.0025994
[05/26/2023-18:06:02] [V] [TRT] --------------- Timing Runner: /linear/MatMul (CaskFlattenConvolution)
[05/26/2023-18:06:02] [V] [TRT] CaskFlattenConvolution has no valid tactics for this config, skipping
[05/26/2023-18:06:02] [V] [TRT] --------------- Timing Runner: /linear/MatMul (CaskConvolution)
[05/26/2023-18:06:02] [V] [TRT] /linear/MatMul Set Tactic Name: ampere_scudnn_128x32_relu_small_nn_v1 Tactic: 0xa8609adc4e0ceb90
[05/26/2023-18:06:02] [V] [TRT] Tactic: 0xa8609adc4e0ceb90 Time: 0.00760565
[05/26/2023-18:06:02] [V] [TRT] /linear/MatMul Set Tactic Name: ampere_scudnn_128x64_relu_medium_nn_v1 Tactic: 0xf64396b97c889179
[05/26/2023-18:06:02] [V] [TRT] Tactic: 0xf64396b97c889179 Time: 0.00843939
[05/26/2023-18:06:02] [V] [TRT] /linear/MatMul Set Tactic Name: ampere_scudnn_128x128_relu_interior_nn_v1 Tactic: 0xa8ef60e712f8ad24
[05/26/2023-18:06:02] [V] [TRT] Tactic: 0xa8ef60e712f8ad24 Time: 0.00934
[05/26/2023-18:06:02] [V] [TRT] /linear/MatMul Set Tactic Name: ampere_scudnn_128x64_relu_interior_nn_v1 Tactic: 0xc3cf6e1d1c6aff27
[05/26/2023-18:06:02] [V] [TRT] Tactic: 0xc3cf6e1d1c6aff27 Time: 0.00814095
[05/26/2023-18:06:02] [V] [TRT] /linear/MatMul Set Tactic Name: ampere_scudnn_128x128_relu_small_nn_v1 Tactic: 0x503619c69ae500ff
[05/26/2023-18:06:02] [V] [TRT] Tactic: 0x503619c69ae500ff Time: 0.00946886
[05/26/2023-18:06:02] [V] [TRT] /linear/MatMul Set Tactic Name: ampere_scudnn_128x32_relu_interior_nn_v1 Tactic: 0x9808072e706def96
[05/26/2023-18:06:02] [V] [TRT] Tactic: 0x9808072e706def96 Time: 0.00741417
[05/26/2023-18:06:02] [V] [TRT] /linear/MatMul Set Tactic Name: sm80_xmma_fprop_implicit_gemm_indexed_f32f32_f32f32_f32_nchwkcrs_nchw_tilesize32x32x8_stage3_warpsize1x2x1_g1_ffma_aligna4_alignc4 Tactic: 0xcb8a43f748d8a338
[05/26/2023-18:06:02] [V] [TRT] Tactic: 0xcb8a43f748d8a338 Time: 0.00555921
[05/26/2023-18:06:02] [V] [TRT] /linear/MatMul Set Tactic Name: sm80_xmma_fprop_implicit_gemm_indexed_f32f32_f32f32_f32_nchwkcrs_nchw_tilesize64x64x8_stage3_warpsize1x4x1_g1_ffma_aligna4_alignc4 Tactic: 0xd828f024626fa982
[05/26/2023-18:06:02] [V] [TRT] Tactic: 0xd828f024626fa982 Time: 0.00647811
[05/26/2023-18:06:02] [V] [TRT] /linear/MatMul Set Tactic Name: sm80_xmma_fprop_implicit_gemm_f32f32_f32f32_f32_nchwkcrs_nchw_tilesize64x64x8_stage3_warpsize1x4x1_g1_ffma_aligna4_alignc4 Tactic: 0xa31d27de74b895ff
[05/26/2023-18:06:02] [V] [TRT] Tactic: 0xa31d27de74b895ff Time: 0.00551279
[05/26/2023-18:06:02] [V] [TRT] /linear/MatMul Set Tactic Name: sm70_xmma_fprop_conv1x1_f32f32_f32_f32_nchwkcrs_nchw_simt_small_batch_bias_relu Tactic: 0xaa0953b1a73b0b9b
[05/26/2023-18:06:02] [V] [TRT] Tactic: 0xaa0953b1a73b0b9b Time: 0.00259094
[05/26/2023-18:06:02] [V] [TRT] /linear/MatMul Set Tactic Name: sm80_xmma_fprop_implicit_gemm_f32f32_f32f32_f32_nchwkcrs_nchw_tilesize256x128x8_stage3_warpsize4x2x1_g1_ffma_simple_t1r1s1_aligna4_alignc4 Tactic: 0xfff46c7893896eb1
[05/26/2023-18:06:02] [V] [TRT] Tactic: 0xfff46c7893896eb1 Time: 0.0169732
[05/26/2023-18:06:02] [V] [TRT] /linear/MatMul Set Tactic Name: sm80_xmma_fprop_implicit_gemm_indexed_f32f32_f32f32_f32_nchwkcrs_nchw_tilesize128x16x8_stage3_warpsize4x1x1_g1_ffma_aligna4_alignc4 Tactic: 0x40a12e3938221818
[05/26/2023-18:06:02] [V] [TRT] Tactic: 0x40a12e3938221818 Time: 0.00702868
[05/26/2023-18:06:02] [V] [TRT] /linear/MatMul Set Tactic Name: sm80_xmma_fprop_implicit_gemm_f32f32_f32f32_f32_nchwkcrs_nchw_tilesize64x128x8_stage3_warpsize1x4x1_g1_ffma_simple_t1r1s1_aligna4_alignc4 Tactic: 0x9cd5cdc35441c505
[05/26/2023-18:06:02] [V] [TRT] Tactic: 0x9cd5cdc35441c505 Time: 0.00801702
[05/26/2023-18:06:02] [V] [TRT] /linear/MatMul Set Tactic Name: sm80_xmma_fprop_implicit_gemm_f32f32_f32f32_f32_nchwkcrs_nchw_tilesize64x64x8_stage3_warpsize1x4x1_g1_ffma_simple_t1r1s1_aligna4_alignc4 Tactic: 0x1fc87d7eb370bb7a
[05/26/2023-18:06:02] [V] [TRT] Tactic: 0x1fc87d7eb370bb7a Time: 0.00542239
[05/26/2023-18:06:02] [V] [TRT] /linear/MatMul Set Tactic Name: sm80_xmma_fprop_implicit_gemm_f32f32_f32f32_f32_nchwkcrs_nchw_tilesize128x64x8_stage3_warpsize2x2x1_g1_ffma_aligna4_alignc4 Tactic: 0x12dbf7d94ee3696d
[05/26/2023-18:06:02] [V] [TRT] Tactic: 0x12dbf7d94ee3696d Time: 0.00988251
[05/26/2023-18:06:02] [V] [TRT] /linear/MatMul Set Tactic Name: sm80_xmma_fprop_implicit_gemm_f32f32_f32f32_f32_nchwkcrs_nchw_tilesize128x64x8_stage3_warpsize2x2x1_g1_ffma_t1r1s1_aligna4_alignc4 Tactic: 0xe5603263b7f00303
[05/26/2023-18:06:02] [V] [TRT] Tactic: 0xe5603263b7f00303 Time: 0.00976335
[05/26/2023-18:06:02] [V] [TRT] /linear/MatMul Set Tactic Name: sm80_xmma_fprop_implicit_gemm_f32f32_f32f32_f32_nchwkcrs_nchw_tilesize128x32x8_stage3_warpsize2x2x1_g1_ffma_simple_t1r1s1_aligna4_alignc4 Tactic: 0x828d0ea88c66fce7
[05/26/2023-18:06:02] [V] [TRT] Tactic: 0x828d0ea88c66fce7 Time: 0.00576768
[05/26/2023-18:06:02] [V] [TRT] /linear/MatMul Set Tactic Name: sm80_xmma_fprop_implicit_gemm_f32f32_f32f32_f32_nchwkcrs_nchw_tilesize64x256x8_stage3_warpsize1x4x1_g1_ffma_simple_t1r1s1_aligna4_alignc4 Tactic: 0x9de226a0c44627c4
[05/26/2023-18:06:02] [V] [TRT] Tactic: 0x9de226a0c44627c4 Time: 0.0164978
[05/26/2023-18:06:02] [V] [TRT] /linear/MatMul Set Tactic Name: sm80_xmma_fprop_implicit_gemm_indexed_f32f32_f32f32_f32_nchwkcrs_nchw_tilesize128x32x8_stage3_warpsize2x2x1_g1_ffma_aligna4_alignc4 Tactic: 0xa9366041633a5135
[05/26/2023-18:06:02] [V] [TRT] Tactic: 0xa9366041633a5135 Time: 0.0077671
[05/26/2023-18:06:02] [V] [TRT] /linear/MatMul Set Tactic Name: sm80_xmma_fprop_implicit_gemm_f32f32_f32f32_f32_nchwkcrs_nchw_tilesize128x64x8_stage3_warpsize2x2x1_g1_ffma_simple_t1r1s1_aligna4_alignc4 Tactic: 0x8e3884f0eaec3ecd
[05/26/2023-18:06:02] [V] [TRT] Tactic: 0x8e3884f0eaec3ecd Time: 0.00816711
[05/26/2023-18:06:02] [V] [TRT] /linear/MatMul Set Tactic Name: sm80_xmma_fprop_implicit_gemm_f32f32_f32f32_f32_nchwkcrs_nchw_tilesize256x128x8_stage3_warpsize4x2x1_g1_ffma_aligna4_alignc4 Tactic: 0xbb8c3889c7eacd30
[05/26/2023-18:06:02] [V] [TRT] Tactic: 0xbb8c3889c7eacd30 Time: 0.0195703
[05/26/2023-18:06:02] [V] [TRT] /linear/MatMul Set Tactic Name: sm80_xmma_fprop_implicit_gemm_f32f32_f32f32_f32_nchwkcrs_nchw_tilesize32x32x8_stage3_warpsize1x2x1_g1_ffma_aligna4_alignc4 Tactic: 0xb0bf940d5e0f9f45
[05/26/2023-18:06:02] [V] [TRT] Tactic: 0xb0bf940d5e0f9f45 Time: 0.00471624
[05/26/2023-18:06:02] [V] [TRT] /linear/MatMul Set Tactic Name: sm80_xmma_fprop_implicit_gemm_f32f32_f32f32_f32_nchwkcrs_nchw_tilesize64x128x8_stage3_warpsize1x4x1_g1_ffma_t1r1s1_aligna4_alignc4 Tactic: 0xc0b05b61d128e46e
[05/26/2023-18:06:02] [V] [TRT] Tactic: 0xc0b05b61d128e46e Time: 0.0088078
[05/26/2023-18:06:02] [V] [TRT] /linear/MatMul Set Tactic Name: sm80_xmma_fprop_implicit_gemm_f32f32_f32f32_f32_nchwkcrs_nchw_tilesize128x16x8_stage3_warpsize4x1x1_g1_ffma_aligna4_alignc4 Tactic: 0x9d9fdb5fd9945f64
[05/26/2023-18:06:02] [V] [TRT] Tactic: 0x9d9fdb5fd9945f64 Time: 0.00511837
[05/26/2023-18:06:02] [V] [TRT] /linear/MatMul Set Tactic Name: sm80_xmma_fprop_implicit_gemm_f32f32_f32f32_f32_nchwkcrs_nchw_tilesize64x128x8_stage3_warpsize1x4x1_g1_ffma_aligna4_alignc4 Tactic: 0x5aa723e0481da855
[05/26/2023-18:06:02] [V] [TRT] Tactic: 0x5aa723e0481da855 Time: 0.00911114
[05/26/2023-18:06:02] [V] [TRT] /linear/MatMul Set Tactic Name: sm80_xmma_fprop_implicit_gemm_f32f32_f32f32_f32_nchwkcrs_nchw_tilesize64x256x8_stage3_warpsize1x4x1_g1_ffma_t1r1s1_aligna4_alignc4 Tactic: 0x2ee10e11d6651675
[05/26/2023-18:06:02] [V] [TRT] Tactic: 0x2ee10e11d6651675 Time: 0.0176107
[05/26/2023-18:06:02] [V] [TRT] /linear/MatMul Set Tactic Name: sm80_xmma_fprop_implicit_gemm_f32f32_f32f32_f32_nchwkcrs_nchw_tilesize64x64x8_stage3_warpsize1x4x1_g1_ffma_t1r1s1_aligna4_alignc4 Tactic: 0x865894c4635db7fd
[05/26/2023-18:06:02] [V] [TRT] Tactic: 0x865894c4635db7fd Time: 0.0055884
[05/26/2023-18:06:02] [V] [TRT] /linear/MatMul Set Tactic Name: sm80_xmma_fprop_implicit_gemm_f32f32_f32f32_f32_nchwkcrs_nchw_tilesize32x32x8_stage3_warpsize1x2x1_g1_ffma_simple_t1r1s1_aligna4_alignc4 Tactic: 0x90f8f2915f87ed77
[05/26/2023-18:06:02] [V] [TRT] Tactic: 0x90f8f2915f87ed77 Time: 0.00452771
[05/26/2023-18:06:02] [V] [TRT] /linear/MatMul Set Tactic Name: ampere_scudnn_128x64_relu_small_nn_v1 Tactic: 0x3f243c490d502deb
[05/26/2023-18:06:02] [V] [TRT] Tactic: 0x3f243c490d502deb Time: 0.00821638
[05/26/2023-18:06:02] [V] [TRT] /linear/MatMul Set Tactic Name: ampere_scudnn_128x128_relu_medium_nn_v1 Tactic: 0xf067e6205da31c2e
[05/26/2023-18:06:02] [V] [TRT] Tactic: 0xf067e6205da31c2e Time: 0.00953722
[05/26/2023-18:06:02] [V] [TRT] Fastest Tactic: 0xaa0953b1a73b0b9b Time: 0.00259094
[05/26/2023-18:06:02] [V] [TRT] >>>>>>>>>>>>>>> Chose Runner Type: CaskConvolution Tactic: 0xaa0953b1a73b0b9b
[05/26/2023-18:06:02] [V] [TRT] *************** Autotuning format combination: Float(10,1,10,10) -> Float(5,1,5,5) ***************
[05/26/2023-18:06:02] [V] [TRT] --------------- Timing Runner: /linear/MatMul (CublasConvolution)
[05/26/2023-18:06:02] [V] [TRT] CublasConvolution has no valid tactics for this config, skipping
[05/26/2023-18:06:02] [V] [TRT] --------------- Timing Runner: /linear/MatMul (CaskFlattenConvolution)
[05/26/2023-18:06:02] [V] [TRT] CaskFlattenConvolution has no valid tactics for this config, skipping
[05/26/2023-18:06:02] [V] [TRT] --------------- Timing Runner: /linear/MatMul (CaskConvolution)
[05/26/2023-18:06:02] [V] [TRT] /linear/MatMul Set Tactic Name: sm80_xmma_fprop_implicit_gemm_f32f32_f32f32_f32_nhwckrsc_nhwc_tilesize128x64x8_stage3_warpsize2x2x1_g1_ffma_t1r1s1_aligna4_alignc4 Tactic: 0x35f26f9c09557d86
[05/26/2023-18:06:02] [V] [TRT] Tactic: 0x35f26f9c09557d86 Time: 0.00745897
[05/26/2023-18:06:02] [V] [TRT] /linear/MatMul Set Tactic Name: sm80_xmma_fprop_implicit_gemm_f32f32_f32f32_f32_nhwckrsc_nhwc_tilesize64x128x8_stage3_warpsize1x4x1_g1_ffma_simple_t1r1s1_aligna4_alignc4 Tactic: 0xc7b3afceb5fb03c0
[05/26/2023-18:06:02] [V] [TRT] Tactic: 0xc7b3afceb5fb03c0 Time: 0.0070363
[05/26/2023-18:06:02] [V] [TRT] /linear/MatMul Set Tactic Name: sm80_xmma_fprop_implicit_gemm_indexed_wo_smem_f32f32_tf32f32_f32_nhwckrsc_nhwc_tilesize128x32x16_stage1_warpsize4x1x1_g1_tensor16x8x8_aligna8_alignc4 Tactic: 0xf78ec258f27b3e23
[05/26/2023-18:06:02] [V] [TRT] Tactic: 0xf78ec258f27b3e23 Time: 0.00378009
[05/26/2023-18:06:02] [V] [TRT] /linear/MatMul Set Tactic Name: sm80_xmma_fprop_implicit_gemm_f32f32_f32f32_f32_nhwckrsc_nhwc_tilesize32x32x8_stage3_warpsize1x2x1_g1_ffma_aligna4_alignc4 Tactic: 0x7121ec1db3f80c67
[05/26/2023-18:06:02] [V] [TRT] Tactic: 0x7121ec1db3f80c67 Time: 0.00441046
[05/26/2023-18:06:02] [V] [TRT] /linear/MatMul Set Tactic Name: sm80_xmma_fprop_implicit_gemm_f32f32_f32f32_f32_nhwckrsc_nhwc_tilesize128x32x8_stage3_warpsize2x2x1_g1_ffma_simple_t1r1s1_aligna4_alignc4 Tactic: 0xd9eb6ca56ddc3a22
[05/26/2023-18:06:02] [V] [TRT] Tactic: 0xd9eb6ca56ddc3a22 Time: 0.0052702
[05/26/2023-18:06:02] [V] [TRT] /linear/MatMul Set Tactic Name: sm80_xmma_fprop_implicit_gemm_f32f32_f32f32_f32_nhwckrsc_nhwc_tilesize256x64x8_stage3_warpsize2x2x1_g1_ffma_simple_t1r1s1_aligna4_alignc4 Tactic: 0xbc0bba0ff1a92939
[05/26/2023-18:06:02] [V] [TRT] Tactic: 0xbc0bba0ff1a92939 Time: 0.0147927
[05/26/2023-18:06:02] [V] [TRT] /linear/MatMul Set Tactic Name: sm80_xmma_fprop_implicit_gemm_indexed_f32f32_f32f32_f32_nhwckrsc_nhwc_tilesize64x64x8_stage3_warpsize1x4x1_g1_ffma_aligna4_alignc4 Tactic: 0x19b688348f983aa0
[05/26/2023-18:06:02] [V] [TRT] Tactic: 0x19b688348f983aa0 Time: 0.00541105
[05/26/2023-18:06:02] [V] [TRT] /linear/MatMul Set Tactic Name: sm80_xmma_fprop_implicit_gemm_indexed_f32f32_f32f32_f32_nhwckrsc_nhwc_tilesize32x32x8_stage3_warpsize1x2x1_g1_ffma_aligna4_alignc4 Tactic: 0x0a143be7a52f301a
[05/26/2023-18:06:02] [V] [TRT] Tactic: 0x0a143be7a52f301a Time: 0.00428262
[05/26/2023-18:06:02] [V] [TRT] /linear/MatMul Set Tactic Name: sm80_xmma_fprop_implicit_gemm_f32f32_f32f32_f32_nhwckrsc_nhwc_tilesize64x64x8_stage3_warpsize1x4x1_g1_ffma_aligna4_alignc4 Tactic: 0x62835fce994f06dd
[05/26/2023-18:06:02] [V] [TRT] Tactic: 0x62835fce994f06dd Time: 0.00566347
[05/26/2023-18:06:02] [V] [TRT] /linear/MatMul Set Tactic Name: sm80_xmma_fprop_implicit_gemm_f32f32_f32f32_f32_nhwckrsc_nhwc_tilesize64x128x8_stage3_warpsize1x4x1_g1_ffma_t1r1s1_aligna4_alignc4 Tactic: 0x1022069e6f8d9aeb
[05/26/2023-18:06:02] [V] [TRT] Tactic: 0x1022069e6f8d9aeb Time: 0.00737348
[05/26/2023-18:06:02] [V] [TRT] /linear/MatMul Set Tactic Name: sm80_xmma_fprop_implicit_gemm_f32f32_f32f32_f32_nhwckrsc_nhwc_tilesize64x64x8_stage3_warpsize1x4x1_g1_ffma_simple_t1r1s1_aligna4_alignc4 Tactic: 0x90898977fc8ce537
[05/26/2023-18:06:02] [V] [TRT] Tactic: 0x90898977fc8ce537 Time: 0.00528718
[05/26/2023-18:06:02] [V] [TRT] /linear/MatMul Set Tactic Name: sm80_xmma_fprop_implicit_gemm_f32f32_f32f32_f32_nhwckrsc_nhwc_tilesize128x16x8_stage3_warpsize4x1x1_g1_ffma_aligna4_alignc4 Tactic: 0x92ed3100c35fc43e
[05/26/2023-18:06:02] [V] [TRT] Tactic: 0x92ed3100c35fc43e Time: 0.00479497
[05/26/2023-18:06:02] [V] [TRT] /linear/MatMul Set Tactic Name: sm80_xmma_fprop_implicit_gemm_indexed_wo_smem_f32f32_tf32f32_f32_nhwckrsc_nhwc_tilesize128x32x64_stage1_warpsize4x1x1_g1_tensor16x8x8_aligna8_alignc4 Tactic: 0x93030576a9fb03f9
[05/26/2023-18:06:02] [V] [TRT] Tactic: 0x93030576a9fb03f9 Time: 0.0052702
[05/26/2023-18:06:02] [V] [TRT] /linear/MatMul Set Tactic Name: sm80_xmma_fprop_implicit_gemm_indexed_f32f32_f32f32_f32_nhwckrsc_nhwc_tilesize128x16x8_stage3_warpsize4x1x1_g1_ffma_aligna4_alignc4 Tactic: 0x4fd3c46622e98342
[05/26/2023-18:06:02] [V] [TRT] Tactic: 0x4fd3c46622e98342 Time: 0.00488777
[05/26/2023-18:06:02] [V] [TRT] /linear/MatMul Set Tactic Name: sm80_xmma_fprop_implicit_gemm_f32f32_f32f32_f32_nhwckrsc_nhwc_tilesize128x64x8_stage3_warpsize2x2x1_g1_ffma_simple_t1r1s1_aligna4_alignc4 Tactic: 0xd55ee6fd0b56f808
[05/26/2023-18:06:02] [V] [TRT] Tactic: 0xd55ee6fd0b56f808 Time: 0.00700278
[05/26/2023-18:06:02] [V] [TRT] /linear/MatMul Set Tactic Name: sm80_xmma_fprop_implicit_gemm_f32f32_f32f32_f32_nhwckrsc_nhwc_tilesize128x64x8_stage3_warpsize2x2x1_g1_ffma_aligna4_alignc4 Tactic: 0x1da91d865428f237
[05/26/2023-18:06:02] [V] [TRT] Tactic: 0x1da91d865428f237 Time: 0.00849264
[05/26/2023-18:06:02] [V] [TRT] /linear/MatMul Set Tactic Name: sm80_xmma_fprop_implicit_gemm_indexed_f32f32_f32f32_f32_nhwckrsc_nhwc_tilesize128x32x8_stage3_warpsize2x2x1_g1_ffma_aligna4_alignc4 Tactic: 0xa6448a1e79f1ca6f
[05/26/2023-18:06:02] [V] [TRT] Tactic: 0xa6448a1e79f1ca6f Time: 0.00566576
[05/26/2023-18:06:02] [V] [TRT] /linear/MatMul Set Tactic Name: sm80_xmma_fprop_implicit_gemm_indexed_wo_smem_f32f32_tf32f32_f32_nhwckrsc_nhwc_tilesize128x16x32_stage1_warpsize4x1x1_g1_tensor16x8x8_aligna4_alignc4 Tactic: 0xcf8ea142095f02d2
[05/26/2023-18:06:02] [V] [TRT] Tactic: 0xcf8ea142095f02d2 Time: 0.00446829
[05/26/2023-18:06:02] [V] [TRT] /linear/MatMul Set Tactic Name: sm80_xmma_fprop_implicit_gemm_f32f32_f32f32_f32_nhwckrsc_nhwc_tilesize32x32x8_stage3_warpsize1x2x1_g1_ffma_simple_t1r1s1_aligna4_alignc4 Tactic: 0x1fb90698107bb33a
[05/26/2023-18:06:02] [V] [TRT] Tactic: 0x1fb90698107bb33a Time: 0.00425183
[05/26/2023-18:06:02] [V] [TRT] /linear/MatMul Set Tactic Name: sm80_xmma_fprop_implicit_gemm_indexed_wo_smem_f32f32_tf32f32_f32_nhwckrsc_nhwc_tilesize128x16x64_stage1_warpsize4x1x1_g1_tensor16x8x8_aligna8_alignc4 Tactic: 0xab0496509b88ebe0
[05/26/2023-18:06:02] [V] [TRT] Tactic: 0xab0496509b88ebe0 Time: 0.00446514
[05/26/2023-18:06:02] [V] [TRT] /linear/MatMul Set Tactic Name: sm80_xmma_fprop_implicit_gemm_f32f32_f32f32_f32_nhwckrsc_nhwc_tilesize64x64x8_stage3_warpsize1x4x1_g1_ffma_t1r1s1_aligna4_alignc4 Tactic: 0x55d80c17b1cd982d
[05/26/2023-18:06:02] [V] [TRT] Tactic: 0x55d80c17b1cd982d Time: 0.0055949
[05/26/2023-18:06:02] [V] [TRT] /linear/MatMul Set Tactic Name: sm80_xmma_fprop_implicit_gemm_indexed_wo_smem_f32f32_tf32f32_f32_nhwckrsc_nhwc_tilesize128x32x16_stage1_warpsize4x1x1_g1_tensor16x8x8_aligna4_alignc4 Tactic: 0xf231cca3335919a4
[05/26/2023-18:06:02] [V] [TRT] Tactic: 0xf231cca3335919a4 Time: 0.00398146
[05/26/2023-18:06:02] [V] [TRT] /linear/MatMul Set Tactic Name: sm80_xmma_fprop_implicit_gemm_f32f32_f32f32_f32_nhwckrsc_nhwc_tilesize256x64x8_stage3_warpsize2x2x1_g1_ffma_aligna4_alignc4 Tactic: 0x8014228ec08b4d49
[05/26/2023-18:06:02] [V] [TRT] Tactic: 0x8014228ec08b4d49 Time: 0.0167025
[05/26/2023-18:06:02] [V] [TRT] Fastest Tactic: 0xf78ec258f27b3e23 Time: 0.00378009
[05/26/2023-18:06:02] [V] [TRT] >>>>>>>>>>>>>>> Chose Runner Type: CaskConvolution Tactic: 0xf78ec258f27b3e23
[05/26/2023-18:06:02] [V] [TRT] *************** Autotuning format combination: Float(3,1:4,3,3) -> Float(2,1:4,2,2) ***************
[05/26/2023-18:06:02] [V] [TRT] --------------- Timing Runner: /linear/MatMul (CudaDepthwiseConvolution)
[05/26/2023-18:06:02] [V] [TRT] CudaDepthwiseConvolution has no valid tactics for this config, skipping
[05/26/2023-18:06:02] [V] [TRT] --------------- Timing Runner: /linear/MatMul (CublasConvolution)
[05/26/2023-18:06:02] [V] [TRT] CublasConvolution has no valid tactics for this config, skipping
[05/26/2023-18:06:02] [V] [TRT] /linear/MatMul: 2 available tactics, 2 unparsable, 0 pruned, 2 remaining after tactic pruning.
[05/26/2023-18:06:02] [V] [TRT] --------------- Timing Runner: /linear/MatMul (CaskGemmConvolution)
[05/26/2023-18:06:02] [V] [TRT] Set Tactic Name: sm86_xmma_gemm_f32f32_tf32f32_f32_tn_n_tilesize32x32x64_stage6_warpsize2x2x1_tensor16x8x8 Tactic: 0x0000000000020386 numSplitK: 1 numBuffers: 0 numKernels: 1
[05/26/2023-18:06:02] [V] [TRT] Tactic: 0x0000000000020386 Time: 0.00373333
[05/26/2023-18:06:02] [V] [TRT] Set Tactic Name: sm86_xmma_gemm_f32f32_tf32f32_f32_tn_n_tilesize64x32x64_stage4_warpsize2x2x1_tensor16x8x8 Tactic: 0x00000000000204ec numSplitK: 1 numBuffers: 0 numKernels: 1
[05/26/2023-18:06:02] [V] [TRT] Tactic: 0x00000000000204ec Time: 0.00421297
[05/26/2023-18:06:02] [V] [TRT] Fastest Tactic: 0x0000000000020386 Time: 0.00373333
[05/26/2023-18:06:02] [V] [TRT] --------------- Timing Runner: /linear/MatMul (CaskFlattenConvolution)
[05/26/2023-18:06:02] [V] [TRT] CaskFlattenConvolution has no valid tactics for this config, skipping
[05/26/2023-18:06:02] [V] [TRT] --------------- Timing Runner: /linear/MatMul (CaskConvolution)
[05/26/2023-18:06:02] [V] [TRT] /linear/MatMul Set Tactic Name: ampere_scudnn_128x128_relu_exp_interior_nhwc_tn_v1 Tactic: 0x17173deba0b64484
[05/26/2023-18:06:02] [V] [TRT] Tactic: 0x17173deba0b64484 Time: 0.00786165
[05/26/2023-18:06:02] [V] [TRT] /linear/MatMul Set Tactic Name: ampere_scudnn_128x32_sliced1x4_ldg4_relu_exp_small_nhwc_tn_v1 Tactic: 0x3e2b881168d9689d
[05/26/2023-18:06:02] [V] [TRT] Tactic: 0x3e2b881168d9689d Time: 0.00684735
[05/26/2023-18:06:02] [V] [TRT] /linear/MatMul Set Tactic Name: ampere_scudnn_128x128_ldg4_relu_exp_small_nhwc_tn_v1 Tactic: 0xf90060ce8193b811
[05/26/2023-18:06:02] [V] [TRT] Tactic: 0xf90060ce8193b811 Time: 0.00776854
[05/26/2023-18:06:02] [V] [TRT] /linear/MatMul Set Tactic Name: ampere_scudnn_128x128_relu_exp_medium_nhwc_tn_v1 Tactic: 0xd9031472c05adf51
[05/26/2023-18:06:02] [V] [TRT] Tactic: 0xd9031472c05adf51 Time: 0.0079807
[05/26/2023-18:06:02] [V] [TRT] /linear/MatMul Set Tactic Name: ampere_scudnn_128x128_ldg4_relu_exp_interior_nhwc_tn_v1 Tactic: 0xe47307053a42b3e4
[05/26/2023-18:06:02] [V] [TRT] Tactic: 0xe47307053a42b3e4 Time: 0.00767398
[05/26/2023-18:06:02] [V] [TRT] /linear/MatMul Set Tactic Name: ampere_scudnn_128x64_sliced1x2_ldg4_relu_exp_medium_nhwc_tn_v1 Tactic: 0x412c44dfeaf9161d
[05/26/2023-18:06:02] [V] [TRT] Tactic: 0x412c44dfeaf9161d Time: 0.00688109
[05/26/2023-18:06:02] [V] [TRT] /linear/MatMul Set Tactic Name: ampere_scudnn_128x64_sliced1x2_ldg4_relu_exp_small_nhwc_tn_v1 Tactic: 0x27b316f52c109002
[05/26/2023-18:06:02] [V] [TRT] Tactic: 0x27b316f52c109002 Time: 0.00683276
[05/26/2023-18:06:02] [V] [TRT] /linear/MatMul Set Tactic Name: ampere_scudnn_128x64_sliced1x2_ldg4_relu_exp_interior_nhwc_tn_v1 Tactic: 0xae0c89d047932ba3
[05/26/2023-18:06:02] [V] [TRT] Tactic: 0xae0c89d047932ba3 Time: 0.00673683
[05/26/2023-18:06:02] [V] [TRT] /linear/MatMul Set Tactic Name: ampere_scudnn_128x128_ldg4_relu_exp_medium_nhwc_tn_v1 Tactic: 0x7bc32c782b800c48
[05/26/2023-18:06:02] [V] [TRT] Tactic: 0x7bc32c782b800c48 Time: 0.00780704
[05/26/2023-18:06:02] [V] [TRT] /linear/MatMul Set Tactic Name: sm80_xmma_fprop_implicit_gemm_f32f32_f32f32_f32_nhwckrsc_nhwc_tilesize128x64x8_stage3_warpsize2x2x1_g1_ffma_t1r1s1_aligna4_alignc4 Tactic: 0x35f26f9c09557d86
[05/26/2023-18:06:02] [V] [TRT] Tactic: 0x35f26f9c09557d86 Time: 0.00747383
[05/26/2023-18:06:02] [V] [TRT] /linear/MatMul Set Tactic Name: sm80_xmma_fprop_implicit_gemm_f32f32_f32f32_f32_nhwckrsc_nhwc_tilesize64x128x8_stage3_warpsize1x4x1_g1_ffma_simple_t1r1s1_aligna4_alignc4 Tactic: 0xc7b3afceb5fb03c0
[05/26/2023-18:06:02] [V] [TRT] Tactic: 0xc7b3afceb5fb03c0 Time: 0.00704762
[05/26/2023-18:06:02] [V] [TRT] /linear/MatMul Set Tactic Name: sm80_xmma_fprop_implicit_gemm_indexed_wo_smem_f32f32_tf32f32_f32_nhwckrsc_nhwc_tilesize128x32x16_stage1_warpsize4x1x1_g1_tensor16x8x8_aligna8_alignc4 Tactic: 0xf78ec258f27b3e23
[05/26/2023-18:06:02] [V] [TRT] Tactic: 0xf78ec258f27b3e23 Time: 0.00370403
[05/26/2023-18:06:02] [V] [TRT] /linear/MatMul Set Tactic Name: sm80_xmma_fprop_implicit_gemm_f32f32_f32f32_f32_nhwckrsc_nhwc_tilesize32x32x8_stage3_warpsize1x2x1_g1_ffma_aligna4_alignc4 Tactic: 0x7121ec1db3f80c67
[05/26/2023-18:06:02] [V] [TRT] Tactic: 0x7121ec1db3f80c67 Time: 0.00440464
[05/26/2023-18:06:02] [V] [TRT] /linear/MatMul Set Tactic Name: ampere_scudnn_128x128_relu_exp_small_nhwc_tn_v1 Tactic: 0x5030121339a48bf3
[05/26/2023-18:06:02] [V] [TRT] Tactic: 0x5030121339a48bf3 Time: 0.00793383
[05/26/2023-18:06:02] [V] [TRT] /linear/MatMul Set Tactic Name: sm80_xmma_fprop_implicit_gemm_f32f32_tf32f32_f32_nhwckrsc_nhwc_tilesize128x128x16_stage4_warpsize2x2x1_g1_tensor16x8x8_simple_t1r1s1 Tactic: 0x9dece0dc37e90462
[05/26/2023-18:06:02] [V] [TRT] Tactic: 0x9dece0dc37e90462 Time: 0.00641113
[05/26/2023-18:06:02] [V] [TRT] /linear/MatMul Set Tactic Name: sm80_xmma_fprop_implicit_gemm_f32f32_f32f32_f32_nhwckrsc_nhwc_tilesize128x32x8_stage3_warpsize2x2x1_g1_ffma_simple_t1r1s1_aligna4_alignc4 Tactic: 0xd9eb6ca56ddc3a22
[05/26/2023-18:06:02] [V] [TRT] Tactic: 0xd9eb6ca56ddc3a22 Time: 0.00527184
[05/26/2023-18:06:02] [V] [TRT] /linear/MatMul Set Tactic Name: sm80_xmma_fprop_implicit_gemm_indexed_wo_smem_f32f32_tf32f32_f32_nhwckrsc_nhwc_tilesize128x32x64_stage1_warpsize4x1x1_g1_tensor16x8x8_aligna4_alignc8 Tactic: 0x1acd4f006848c62b
[05/26/2023-18:06:02] [V] [TRT] Tactic: 0x1acd4f006848c62b Time: 0.006239
[05/26/2023-18:06:02] [V] [TRT] /linear/MatMul Set Tactic Name: sm80_xmma_fprop_implicit_gemm_f32f32_f32f32_f32_nhwckrsc_nhwc_tilesize256x64x8_stage3_warpsize2x2x1_g1_ffma_simple_t1r1s1_aligna4_alignc4 Tactic: 0xbc0bba0ff1a92939
[05/26/2023-18:06:02] [V] [TRT] Tactic: 0xbc0bba0ff1a92939 Time: 0.0148626
[05/26/2023-18:06:02] [V] [TRT] /linear/MatMul Set Tactic Name: sm80_xmma_fprop_implicit_gemm_indexed_f32f32_f32f32_f32_nhwckrsc_nhwc_tilesize64x64x8_stage3_warpsize1x4x1_g1_ffma_aligna4_alignc4 Tactic: 0x19b688348f983aa0
[05/26/2023-18:06:02] [V] [TRT] Tactic: 0x19b688348f983aa0 Time: 0.0054058
[05/26/2023-18:06:02] [V] [TRT] /linear/MatMul Set Tactic Name: sm80_xmma_fprop_implicit_gemm_indexed_f32f32_f32f32_f32_nhwckrsc_nhwc_tilesize32x32x8_stage3_warpsize1x2x1_g1_ffma_aligna4_alignc4 Tactic: 0x0a143be7a52f301a
[05/26/2023-18:06:02] [V] [TRT] Tactic: 0x0a143be7a52f301a Time: 0.0042681
[05/26/2023-18:06:02] [V] [TRT] /linear/MatMul Set Tactic Name: sm80_xmma_fprop_implicit_gemm_f32f32_f32f32_f32_nhwckrsc_nhwc_tilesize64x64x8_stage3_warpsize1x4x1_g1_ffma_aligna4_alignc4 Tactic: 0x62835fce994f06dd
[05/26/2023-18:06:02] [V] [TRT] Tactic: 0x62835fce994f06dd Time: 0.00569793
[05/26/2023-18:06:02] [V] [TRT] /linear/MatMul Set Tactic Name: ampere_scudnn_128x32_sliced1x4_ldg4_relu_exp_interior_nhwc_tn_v1 Tactic: 0xc7feb33970feefa7
[05/26/2023-18:06:02] [V] [TRT] Tactic: 0xc7feb33970feefa7 Time: 0.00674722
[05/26/2023-18:06:02] [V] [TRT] /linear/MatMul Set Tactic Name: sm80_xmma_fprop_implicit_gemm_f32f32_f32f32_f32_nhwckrsc_nhwc_tilesize64x128x8_stage3_warpsize1x4x1_g1_ffma_t1r1s1_aligna4_alignc4 Tactic: 0x1022069e6f8d9aeb
[05/26/2023-18:06:02] [V] [TRT] Tactic: 0x1022069e6f8d9aeb Time: 0.00734194
[05/26/2023-18:06:02] [V] [TRT] /linear/MatMul Set Tactic Name: sm80_xmma_fprop_implicit_gemm_indexed_wo_smem_f32f32_tf32f32_f32_nhwckrsc_nhwc_tilesize128x16x64_stage1_warpsize4x1x1_g1_tensor16x8x8_alignc4 Tactic: 0xcc46f0f5cee60677
[05/26/2023-18:06:02] [V] [TRT] Tactic: 0xcc46f0f5cee60677 Time: 0.00397282
[05/26/2023-18:06:02] [V] [TRT] /linear/MatMul Set Tactic Name: sm80_xmma_fprop_implicit_gemm_f32f32_f32f32_f32_nhwckrsc_nhwc_tilesize64x64x8_stage3_warpsize1x4x1_g1_ffma_simple_t1r1s1_aligna4_alignc4 Tactic: 0x90898977fc8ce537
[05/26/2023-18:06:02] [V] [TRT] Tactic: 0x90898977fc8ce537 Time: 0.00526775
[05/26/2023-18:06:02] [V] [TRT] /linear/MatMul Set Tactic Name: sm80_xmma_fprop_implicit_gemm_f32f32_f32f32_f32_nhwckrsc_nhwc_tilesize128x16x8_stage3_warpsize4x1x1_g1_ffma_aligna4_alignc4 Tactic: 0x92ed3100c35fc43e
[05/26/2023-18:06:02] [V] [TRT] Tactic: 0x92ed3100c35fc43e Time: 0.00479939
[05/26/2023-18:06:02] [V] [TRT] /linear/MatMul Set Tactic Name: sm80_xmma_fprop_implicit_gemm_indexed_wo_smem_f32f32_tf32f32_f32_nhwckrsc_nhwc_tilesize128x32x64_stage1_warpsize4x1x1_g1_tensor16x8x8_aligna8_alignc4 Tactic: 0x93030576a9fb03f9
[05/26/2023-18:06:02] [V] [TRT] Tactic: 0x93030576a9fb03f9 Time: 0.00525714
[05/26/2023-18:06:02] [V] [TRT] /linear/MatMul Set Tactic Name: sm80_xmma_fprop_implicit_gemm_indexed_wo_smem_f32f32_tf32f32_f32_nhwckrsc_nhwc_tilesize128x32x16_stage1_warpsize4x1x1_g1_tensor16x8x8_aligna8 Tactic: 0xdb77237fa21087f5
[05/26/2023-18:06:02] [V] [TRT] Tactic: 0xdb77237fa21087f5 Time: 0.00375748
[05/26/2023-18:06:02] [V] [TRT] /linear/MatMul Set Tactic Name: sm80_xmma_fprop_implicit_gemm_f32f32_tf32f32_f32_nhwckrsc_nhwc_tilesize128x128x16_stage4_warpsize2x2x1_g1_tensor16x8x8_t1r1s1 Tactic: 0x130df49cb195156b
[05/26/2023-18:06:02] [V] [TRT] Tactic: 0x130df49cb195156b Time: 0.00688566
[05/26/2023-18:06:02] [V] [TRT] /linear/MatMul Set Tactic Name: sm80_xmma_fprop_implicit_gemm_indexed_wo_smem_f32f32_tf32f32_f32_nhwckrsc_nhwc_tilesize128x16x32_stage1_warpsize4x1x1_g1_tensor16x8x8_aligna4 Tactic: 0xb3e5ce9d1b1da232
[05/26/2023-18:06:02] [V] [TRT] Tactic: 0xb3e5ce9d1b1da232 Time: 0.00431556
[05/26/2023-18:06:02] [V] [TRT] /linear/MatMul Set Tactic Name: sm80_xmma_fprop_implicit_gemm_indexed_f32f32_f32f32_f32_nhwckrsc_nhwc_tilesize128x16x8_stage3_warpsize4x1x1_g1_ffma_aligna4_alignc4 Tactic: 0x4fd3c46622e98342
[05/26/2023-18:06:02] [V] [TRT] Tactic: 0x4fd3c46622e98342 Time: 0.00485349
[05/26/2023-18:06:02] [V] [TRT] /linear/MatMul Set Tactic Name: sm80_xmma_fprop_implicit_gemm_indexed_f32f32_tf32f32_f32_nhwckrsc_nhwc_tilesize128x128x16_stage4_warpsize2x2x1_g1_tensor16x8x8 Tactic: 0x65e41d81f093b482
[05/26/2023-18:06:02] [V] [TRT] Tactic: 0x65e41d81f093b482 Time: 0.00639642
[05/26/2023-18:06:02] [V] [TRT] /linear/MatMul Set Tactic Name: sm80_xmma_fprop_implicit_gemm_indexed_wo_smem_f32f32_tf32f32_f32_nhwckrsc_nhwc_tilesize128x32x64_stage1_warpsize4x1x1_g1_tensor16x8x8_alignc8 Tactic: 0x3a8712b17741b582
[05/26/2023-18:06:02] [V] [TRT] Tactic: 0x3a8712b17741b582 Time: 0.00463779
[05/26/2023-18:06:02] [V] [TRT] /linear/MatMul Set Tactic Name: sm80_xmma_fprop_implicit_gemm_f32f32_f32f32_f32_nhwckrsc_nhwc_tilesize128x64x8_stage3_warpsize2x2x1_g1_ffma_simple_t1r1s1_aligna4_alignc4 Tactic: 0xd55ee6fd0b56f808
[05/26/2023-18:06:02] [V] [TRT] Tactic: 0xd55ee6fd0b56f808 Time: 0.00698667
[05/26/2023-18:06:02] [V] [TRT] /linear/MatMul Set Tactic Name: sm80_xmma_fprop_implicit_gemm_f32f32_f32f32_f32_nhwckrsc_nhwc_tilesize128x64x8_stage3_warpsize2x2x1_g1_ffma_aligna4_alignc4 Tactic: 0x1da91d865428f237
[05/26/2023-18:06:02] [V] [TRT] Tactic: 0x1da91d865428f237 Time: 0.00848807
[05/26/2023-18:06:02] [V] [TRT] /linear/MatMul Set Tactic Name: sm80_xmma_fprop_implicit_gemm_indexed_f32f32_f32f32_f32_nhwckrsc_nhwc_tilesize128x32x8_stage3_warpsize2x2x1_g1_ffma_aligna4_alignc4 Tactic: 0xa6448a1e79f1ca6f
[05/26/2023-18:06:02] [V] [TRT] Tactic: 0xa6448a1e79f1ca6f Time: 0.00564695
[05/26/2023-18:06:02] [V] [TRT] /linear/MatMul Set Tactic Name: sm80_xmma_fprop_implicit_gemm_indexed_wo_smem_f32f32_tf32f32_f32_nhwckrsc_nhwc_tilesize128x32x64_stage1_warpsize4x1x1_g1_tensor16x8x8 Tactic: 0xb33296dda7141c64
[05/26/2023-18:06:02] [V] [TRT] Tactic: 0xb33296dda7141c64 Time: 0.00463631
[05/26/2023-18:06:02] [V] [TRT] /linear/MatMul Set Tactic Name: sm80_xmma_fprop_implicit_gemm_indexed_wo_smem_f32f32_tf32f32_f32_nhwckrsc_nhwc_tilesize128x32x16_stage1_warpsize4x1x1_g1_tensor16x8x8_aligna8_alignc8 Tactic: 0x7bff86d5f2eadc76
[05/26/2023-18:06:02] [V] [TRT] Tactic: 0x7bff86d5f2eadc76 Time: 0.00369735
[05/26/2023-18:06:02] [V] [TRT] /linear/MatMul Set Tactic Name: sm80_xmma_fprop_implicit_gemm_indexed_wo_smem_f32f32_tf32f32_f32_nhwckrsc_nhwc_tilesize128x16x32_stage1_warpsize4x1x1_g1_tensor16x8x8_aligna4_alignc4 Tactic: 0xcf8ea142095f02d2
[05/26/2023-18:06:02] [V] [TRT] Tactic: 0xcf8ea142095f02d2 Time: 0.00436516
[05/26/2023-18:06:02] [V] [TRT] /linear/MatMul Set Tactic Name: sm80_xmma_fprop_implicit_gemm_f32f32_f32f32_f32_nhwckrsc_nhwc_tilesize32x32x8_stage3_warpsize1x2x1_g1_ffma_simple_t1r1s1_aligna4_alignc4 Tactic: 0x1fb90698107bb33a
[05/26/2023-18:06:02] [V] [TRT] Tactic: 0x1fb90698107bb33a Time: 0.0042318
[05/26/2023-18:06:02] [V] [TRT] /linear/MatMul Set Tactic Name: sm80_xmma_fprop_implicit_gemm_indexed_wo_smem_f32f32_tf32f32_f32_nhwckrsc_nhwc_tilesize128x16x64_stage1_warpsize4x1x1_g1_tensor16x8x8_aligna4_alignc8 Tactic: 0x22cadc265a3b2e32
[05/26/2023-18:06:02] [V] [TRT] Tactic: 0x22cadc265a3b2e32 Time: 0.00577938
[05/26/2023-18:06:02] [V] [TRT] /linear/MatMul Set Tactic Name: sm80_xmma_fprop_implicit_gemm_indexed_wo_smem_f32f32_tf32f32_f32_nhwckrsc_nhwc_tilesize128x16x64_stage1_warpsize4x1x1_g1_tensor16x8x8_aligna8_alignc4 Tactic: 0xab0496509b88ebe0
[05/26/2023-18:06:02] [V] [TRT] Tactic: 0xab0496509b88ebe0 Time: 0.00445853
[05/26/2023-18:06:02] [V] [TRT] /linear/MatMul Set Tactic Name: sm80_xmma_fprop_implicit_gemm_f32f32_f32f32_f32_nhwckrsc_nhwc_tilesize64x64x8_stage3_warpsize1x4x1_g1_ffma_t1r1s1_aligna4_alignc4 Tactic: 0x55d80c17b1cd982d
[05/26/2023-18:06:02] [V] [TRT] Tactic: 0x55d80c17b1cd982d Time: 0.0056102
[05/26/2023-18:06:02] [V] [TRT] /linear/MatMul Set Tactic Name: sm80_xmma_fprop_implicit_gemm_indexed_wo_smem_f32f32_tf32f32_f32_nhwckrsc_nhwc_tilesize128x16x32_stage1_warpsize4x1x1_g1_tensor16x8x8 Tactic: 0xae48d3ccfe1edfcd
[05/26/2023-18:06:02] [V] [TRT] Tactic: 0xae48d3ccfe1edfcd Time: 0.00364994
[05/26/2023-18:06:02] [V] [TRT] /linear/MatMul Set Tactic Name: sm80_xmma_fprop_implicit_gemm_f32f32_tf32f32_f32_nhwckrsc_nhwc_tilesize128x128x16_stage4_warpsize2x2x1_g1_tensor16x8x8 Tactic: 0xb443c221fcb1565b
[05/26/2023-18:06:02] [V] [TRT] Tactic: 0xb443c221fcb1565b Time: 0.00672353
[05/26/2023-18:06:02] [V] [TRT] /linear/MatMul Set Tactic Name: sm80_xmma_fprop_implicit_gemm_indexed_wo_smem_f32f32_tf32f32_f32_nhwckrsc_nhwc_tilesize128x32x16_stage1_warpsize4x1x1_g1_tensor16x8x8_alignc4 Tactic: 0xfed494d61b2087ba
[05/26/2023-18:06:02] [V] [TRT] Tactic: 0xfed494d61b2087ba Time: 0.0037086
[05/26/2023-18:06:02] [V] [TRT] /linear/MatMul Set Tactic Name: sm80_xmma_fprop_implicit_gemm_indexed_wo_smem_f32f32_tf32f32_f32_nhwckrsc_nhwc_tilesize128x16x32_stage1_warpsize4x1x1_g1_tensor16x8x8_alignc4 Tactic: 0x1a373db9a2bc4028
[05/26/2023-18:06:02] [V] [TRT] Tactic: 0x1a373db9a2bc4028 Time: 0.00366137
[05/26/2023-18:06:02] [V] [TRT] /linear/MatMul Set Tactic Name: sm80_xmma_fprop_implicit_gemm_indexed_wo_smem_f32f32_tf32f32_f32_nhwckrsc_nhwc_tilesize128x16x64_stage1_warpsize4x1x1_g1_tensor16x8x8_aligna8 Tactic: 0xe9e5475c77d60638
[05/26/2023-18:06:02] [V] [TRT] Tactic: 0xe9e5475c77d60638 Time: 0.00450086
[05/26/2023-18:06:02] [V] [TRT] /linear/MatMul Set Tactic Name: sm80_xmma_fprop_implicit_gemm_indexed_wo_smem_f32f32_tf32f32_f32_nhwckrsc_nhwc_tilesize128x32x16_stage1_warpsize4x1x1_g1_tensor16x8x8_alignc8 Tactic: 0x72a5d05b1bb165ef
[05/26/2023-18:06:02] [V] [TRT] Tactic: 0x72a5d05b1bb165ef Time: 0.00368024
[05/26/2023-18:06:02] [V] [TRT] /linear/MatMul Set Tactic Name: sm80_xmma_fprop_implicit_gemm_indexed_wo_smem_f32f32_tf32f32_f32_nhwckrsc_nhwc_tilesize128x16x32_stage1_warpsize4x1x1_g1_tensor16x8x8_alignc8 Tactic: 0x96467934a22da27d
[05/26/2023-18:06:02] [V] [TRT] Tactic: 0x96467934a22da27d Time: 0.00366034
[05/26/2023-18:06:02] [V] [TRT] /linear/MatMul Set Tactic Name: sm80_xmma_fprop_implicit_gemm_indexed_wo_smem_f32f32_tf32f32_f32_nhwckrsc_nhwc_tilesize128x16x64_stage1_warpsize4x1x1_g1_tensor16x8x8 Tactic: 0x10383a0781d24dde
[05/26/2023-18:06:02] [V] [TRT] Tactic: 0x10383a0781d24dde Time: 0.00352624
[05/26/2023-18:06:02] [V] [TRT] /linear/MatMul Set Tactic Name: sm80_xmma_fprop_implicit_gemm_indexed_wo_smem_f32f32_tf32f32_f32_nhwckrsc_nhwc_tilesize128x16x64_stage1_warpsize4x1x1_g1_tensor16x8x8_alignc8 Tactic: 0x4037b478ce77e422
[05/26/2023-18:06:02] [V] [TRT] Tactic: 0x4037b478ce77e422 Time: 0.00361257
[05/26/2023-18:06:02] [V] [TRT] /linear/MatMul Set Tactic Name: sm80_xmma_fprop_implicit_gemm_indexed_wo_smem_f32f32_tf32f32_f32_nhwckrsc_nhwc_tilesize128x16x32_stage1_warpsize4x1x1_g1_tensor16x8x8_aligna8 Tactic: 0x3f948a101b8c4067
[05/26/2023-18:06:02] [V] [TRT] Tactic: 0x3f948a101b8c4067 Time: 0.00340267
[05/26/2023-18:06:02] [V] [TRT] /linear/MatMul Set Tactic Name: sm80_xmma_fprop_implicit_gemm_indexed_wo_smem_f32f32_tf32f32_f32_nhwckrsc_nhwc_tilesize128x32x16_stage1_warpsize4x1x1_g1_tensor16x8x8 Tactic: 0x9cb304e2edbc1221
[05/26/2023-18:06:02] [V] [TRT] Tactic: 0x9cb304e2edbc1221 Time: 0.00326473
[05/26/2023-18:06:02] [V] [TRT] /linear/MatMul Set Tactic Name: sm80_xmma_fprop_implicit_gemm_indexed_wo_smem_f32f32_tf32f32_f32_nhwckrsc_nhwc_tilesize128x32x16_stage1_warpsize4x1x1_g1_tensor16x8x8_aligna4_alignc4 Tactic: 0xf231cca3335919a4
[05/26/2023-18:06:02] [V] [TRT] Tactic: 0xf231cca3335919a4 Time: 0.00352836
[05/26/2023-18:06:02] [V] [TRT] /linear/MatMul Set Tactic Name: sm80_xmma_fprop_implicit_gemm_indexed_wo_smem_f32f32_tf32f32_f32_nhwckrsc_nhwc_tilesize128x32x64_stage1_warpsize4x1x1_g1_tensor16x8x8_aligna8 Tactic: 0x9355e195cee05798
[05/26/2023-18:06:02] [V] [TRT] Tactic: 0x9355e195cee05798 Time: 0.00468321
[05/26/2023-18:06:02] [V] [TRT] /linear/MatMul Set Tactic Name: sm80_xmma_fprop_implicit_gemm_indexed_wo_smem_f32f32_tf32f32_f32_nhwckrsc_nhwc_tilesize128x32x16_stage1_warpsize4x1x1_g1_tensor16x8x8_aligna4_alignc8 Tactic: 0x7e40882e33c8fbf1
[05/26/2023-18:06:02] [V] [TRT] Tactic: 0x7e40882e33c8fbf1 Time: 0.00354486
[05/26/2023-18:06:02] [V] [TRT] /linear/MatMul Set Tactic Name: ampere_scudnn_128x32_sliced1x4_ldg4_relu_exp_medium_nhwc_tn_v1 Tactic: 0x3e191488237fab8f
[05/26/2023-18:06:02] [V] [TRT] Tactic: 0x3e191488237fab8f Time: 0.0062233
[05/26/2023-18:06:02] [V] [TRT] /linear/MatMul Set Tactic Name: sm80_xmma_fprop_implicit_gemm_indexed_wo_smem_f32f32_tf32f32_f32_nhwckrsc_nhwc_tilesize128x32x64_stage1_warpsize4x1x1_g1_tensor16x8x8_alignc4 Tactic: 0xb6f6563c77d057d7
[05/26/2023-18:06:02] [V] [TRT] Tactic: 0xb6f6563c77d057d7 Time: 0.00423771
[05/26/2023-18:06:02] [V] [TRT] /linear/MatMul Set Tactic Name: sm80_xmma_fprop_implicit_gemm_indexed_wo_smem_f32f32_tf32f32_f32_nhwckrsc_nhwc_tilesize128x32x16_stage1_warpsize4x1x1_g1_tensor16x8x8_aligna4 Tactic: 0x570667f2a28165a0
[05/26/2023-18:06:02] [V] [TRT] Tactic: 0x570667f2a28165a0 Time: 0.00340844
[05/26/2023-18:06:02] [V] [TRT] /linear/MatMul Set Tactic Name: sm80_xmma_fprop_implicit_gemm_indexed_wo_smem_f32f32_tf32f32_f32_nhwckrsc_nhwc_tilesize128x16x32_stage1_warpsize4x1x1_g1_tensor16x8x8_aligna4_alignc8 Tactic: 0x43ffe5cf09cee087
[05/26/2023-18:06:02] [V] [TRT] Tactic: 0x43ffe5cf09cee087 Time: 0.00389424
[05/26/2023-18:06:02] [V] [TRT] /linear/MatMul Set Tactic Name: sm80_xmma_fprop_implicit_gemm_indexed_wo_smem_f32f32_tf32f32_f32_nhwckrsc_nhwc_tilesize128x16x32_stage1_warpsize4x1x1_g1_tensor16x8x8_aligna8_alignc8 Tactic: 0x4640eb34c8ecc700
[05/26/2023-18:06:02] [V] [TRT] Tactic: 0x4640eb34c8ecc700 Time: 0.00341758
[05/26/2023-18:06:02] [V] [TRT] /linear/MatMul Set Tactic Name: sm80_xmma_fprop_implicit_gemm_f32f32_f32f32_f32_nhwckrsc_nhwc_tilesize256x64x8_stage3_warpsize2x2x1_g1_ffma_aligna4_alignc4 Tactic: 0x8014228ec08b4d49
[05/26/2023-18:06:02] [V] [TRT] Tactic: 0x8014228ec08b4d49 Time: 0.0149051
[05/26/2023-18:06:02] [V] [TRT] Fastest Tactic: 0x9cb304e2edbc1221 Time: 0.00326473
[05/26/2023-18:06:02] [V] [TRT] >>>>>>>>>>>>>>> Chose Runner Type: CaskConvolution Tactic: 0x9cb304e2edbc1221
[05/26/2023-18:06:02] [V] [TRT] =============== Computing costs for 
[05/26/2023-18:06:02] [V] [TRT] *************** Autotuning format combination: Float(5,1,1,1) -> Float(5,1) ***************
[05/26/2023-18:06:02] [V] [TRT] --------------- Timing Runner: reshape_after_/linear/MatMul (Shuffle)
[05/26/2023-18:06:02] [V] [TRT] Tactic: 0x0000000000000000 Time: 0.00247259
[05/26/2023-18:06:02] [V] [TRT] Tactic: 0x0000000000000001 Time: 0.008352
[05/26/2023-18:06:02] [V] [TRT] Fastest Tactic: 0x0000000000000000 Time: 0.00247259
[05/26/2023-18:06:02] [V] [TRT] >>>>>>>>>>>>>>> Chose Runner Type: Shuffle Tactic: 0x0000000000000000
[05/26/2023-18:06:02] [V] [TRT] Formats and tactics selection completed in 1.04349 seconds.
[05/26/2023-18:06:02] [V] [TRT] After reformat layers: 3 layers
[05/26/2023-18:06:02] [V] [TRT] Total number of blocks in pre-optimized block assignment: 3
[05/26/2023-18:06:02] [I] [TRT] Total Activation Memory: 2147484672
[05/26/2023-18:06:02] [I] [TRT] Detected 1 inputs and 1 output network tensors.
[05/26/2023-18:06:02] [V] [TRT] /linear/MatMul Set Tactic Name: sm70_xmma_fprop_conv1x1_f32f32_f32_f32_nchwkcrs_nchw_simt_small_batch_bias_relu Tactic: 0xaa0953b1a73b0b9b
[05/26/2023-18:06:02] [V] [TRT] Layer: /linear/MatMul Host Persistent: 2880 Device Persistent: 0 Scratch Memory: 0
[05/26/2023-18:06:02] [V] [TRT] Skipped printing memory information for 2 layers with 0 memory size i.e. Host Persistent + Device Persistent + Scratch Memory == 0.
[05/26/2023-18:06:02] [I] [TRT] Total Host Persistent Memory: 2880
[05/26/2023-18:06:02] [I] [TRT] Total Device Persistent Memory: 0
[05/26/2023-18:06:02] [I] [TRT] Total Scratch Memory: 0
[05/26/2023-18:06:02] [I] [TRT] [MemUsageStats] Peak memory usage of TRT CPU/GPU memory allocators: CPU 0 MiB, GPU 5 MiB
[05/26/2023-18:06:02] [I] [TRT] [BlockAssignment] Started assigning block shifts. This will take 2 steps to complete.
[05/26/2023-18:06:02] [I] [TRT] [BlockAssignment] Algorithm ShiftNTopDown took 0.006402ms to assign 2 blocks to 2 nodes requiring 1024 bytes.
[05/26/2023-18:06:02] [V] [TRT] Total number of blocks in optimized block assignment: 2
[05/26/2023-18:06:02] [I] [TRT] Total Activation Memory: 1024
[05/26/2023-18:06:02] [V] [TRT] Finalize: /linear/MatMul Set kernel index: 0
[05/26/2023-18:06:02] [V] [TRT] Total number of generated kernels selected for the engine: 1
[05/26/2023-18:06:02] [V] [TRT] Kernel: 0 CASK_STATIC
[05/26/2023-18:06:02] [V] [TRT] Disabling unused tactic source: CUDNN
[05/26/2023-18:06:02] [V] [TRT] Disabling unused tactic source: CUBLAS, CUBLAS_LT
[05/26/2023-18:06:02] [V] [TRT] Disabling unused tactic source: JIT_CONVOLUTIONS
[05/26/2023-18:06:02] [V] [TRT] Engine generation completed in 1.51453 seconds.
[05/26/2023-18:06:02] [V] [TRT] Deleting timing cache: 15 entries, served 0 hits since creation.
[05/26/2023-18:06:02] [V] [TRT] Engine Layer Information:
Layer(NoOp): reshape_before_/linear/MatMul, Tactic: 0x0000000000000000, input0 (Float[1,10]) -> reshape_before_/linear/MatMul_out_tensor (Float[1,10,1,1])
Layer(CaskConvolution): /linear/MatMul, Tactic: 0xaa0953b1a73b0b9b, reshape_before_/linear/MatMul_out_tensor (Float[1,10,1,1]) -> /linear/MatMul_out_tensor (Float[1,5,1,1])
Layer(NoOp): reshape_after_/linear/MatMul, Tactic: 0x0000000000000000, /linear/MatMul_out_tensor (Float[1,5,1,1]) -> output0 (Float[1,5])
[05/26/2023-18:06:02] [I] [TRT] [MemUsageChange] TensorRT-managed allocation in building engine: CPU +0, GPU +4, now: CPU 0, GPU 4 (MiB)
[05/26/2023-18:06:02] [I] Engine built in 3.04335 sec.
[05/26/2023-18:06:02] [I] [TRT] Loaded engine size: 0 MiB
[05/26/2023-18:06:02] [V] [TRT] Deserialization required 1715 microseconds.
[05/26/2023-18:06:02] [I] [TRT] [MemUsageChange] TensorRT-managed allocation in engine deserialization: CPU +0, GPU +0, now: CPU 0, GPU 0 (MiB)
[05/26/2023-18:06:02] [I] Engine deserialized in 0.00187134 sec.
[05/26/2023-18:06:02] [V] [TRT] Total per-runner device persistent memory is 0
[05/26/2023-18:06:02] [V] [TRT] Total per-runner host persistent memory is 2880
[05/26/2023-18:06:02] [V] [TRT] Allocated activation device memory of size 1024
[05/26/2023-18:06:02] [I] [TRT] [MemUsageChange] TensorRT-managed allocation in IExecutionContext creation: CPU +0, GPU +0, now: CPU 0, GPU 0 (MiB)
[05/26/2023-18:06:02] [I] Setting persistentCacheLimit to 0 bytes.
[05/26/2023-18:06:02] [V] Using enqueueV3.
[05/26/2023-18:06:02] [I] Using random values for input input0
[05/26/2023-18:06:02] [I] Created input binding for input0 with dimensions 1x10
[05/26/2023-18:06:02] [I] Using random values for output output0
[05/26/2023-18:06:02] [I] Created output binding for output0 with dimensions 1x5
[05/26/2023-18:06:02] [I] Layer Information:
[05/26/2023-18:06:02] [I] [TRT] The profiling verbosity was set to ProfilingVerbosity::kLAYER_NAMES_ONLY when the engine was built, so only the layer names will be returned. Rebuild the engine with ProfilingVerbosity::kDETAILED to get more verbose layer information.
[05/26/2023-18:06:02] [I] Layers:
reshape_before_/linear/MatMul
/linear/MatMul
reshape_after_/linear/MatMul

Bindings:
input0
output0
[05/26/2023-18:06:02] [I] [TRT] The profiling verbosity was set to ProfilingVerbosity::kLAYER_NAMES_ONLY when the engine was built, so only the layer names will be returned. Rebuild the engine with ProfilingVerbosity::kDETAILED to get more verbose layer information.
[05/26/2023-18:06:02] [I] Starting inference
[05/26/2023-18:06:06] [I] The e2e network timing is not reported since it is inaccurate due to the extra synchronizations when the profiler is enabled.
[05/26/2023-18:06:06] [I] To show e2e network timing report, add --separateProfileRun to profile layer timing in a separate run or remove --dumpProfile to disable the profiler.
[05/26/2023-18:06:06] [I] Output Tensors:
[05/26/2023-18:06:06] [I] output0: (1x5)
[05/26/2023-18:06:06] [I] -0.0588241 -0.612153 0.159086 -0.81694 0.539329
[05/26/2023-18:06:06] [I] 
[05/26/2023-18:06:06] [I] === Profile (128718 iterations ) ===
[05/26/2023-18:06:06] [I]                          Layer   Time (ms)   Avg. Time (ms)   Median Time (ms)   Time %
[05/26/2023-18:06:06] [I]                 /linear/MatMul      435.95           0.0034             0.0031    100.0
[05/26/2023-18:06:06] [I]                          Total      435.95           0.0034             0.0031    100.0
[05/26/2023-18:06:06] [I] 
&&&& PASSED TensorRT.trtexec [TensorRT v8501] # trtexec --onnx=sample.onnx --memPoolSize=workspace:2048 --saveEngine=sample.engine --verbose --profilingVerbosity=layer_names_only --dumpOutput --dumpProfile --dumpLayerInfo --exportOutput=log/sample/build/build_output.log --exportProfile=log/sample/build/build_profile.log --exportLayerInfo=log/sample/build/build_layer_info.log --warmUp=200 --iterations=50
